-- =========================================================
-- Test 02: Vie migration and DML
-- =========================================================
-- ========================================================
-- ========================================================
-- START SETUP
-- ========================================================
-- ========================================================
/* Extensions needed */
CREATE EXTENSION IF NOT EXISTS postgis;
CREATE EXTENSION IF NOT EXISTS pgcrypto;
CREATE EXTENSION IF NOT EXISTS btree_gist;
SET search_path TO chronoturtle, public;
/* -------------------
   SCHEMA
   ------------------- */
CREATE SCHEMA management;
CREATE SCHEMA telematic;
/* -------------------
   ENUM
   ------------------- */
CREATE TYPE management.tire_type_enum AS ENUM ('winter','summer','all_season');
CREATE TYPE management.tire_status_enum AS ENUM ('mounted','stored','damaged','discarded');
CREATE TYPE management.fuel_type_enum AS ENUM ('gasoline','diesel','hybrid','electric');
CREATE TYPE management.customer_type_enum AS ENUM ('private','corporate');
CREATE TYPE management.skill_level_enum AS ENUM ('junior','mid','senior','master');
CREATE TYPE management.service_type_enum AS ENUM ('maintenance','repair','inspection','recall','recurring');
CREATE TYPE management.tire_set_status_enum AS ENUM ('stored','mounted','disposed');
CREATE TYPE management.engine_state_enum AS ENUM ('ok','warning','error');
-- ========================================================
-- 1) tire
-- Test cases:
--   - single table with many realistic typed columns (production_date, enums, numeric)
--   - referenced by other tables (tire_set, service_record)
--   - tests serial PK handling
-- ========================================================
CREATE TABLE management.tire
(
    id              SERIAL PRIMARY KEY,
    production_date DATE                        NOT NULL,
    tire_type       management.tire_type_enum   NOT NULL,
    size_text       TEXT                        NOT NULL, -- e.g. "205/55R16"
    profile_mm_left NUMERIC(4, 1)               NOT NULL, -- mm of tread left (decimal)
    brand           TEXT,
    pressure_psi    NUMERIC(5, 2),
    status          management.tire_status_enum NOT NULL DEFAULT 'stored',
    manufacturer_id INT,                                  -- optional link to manufacturer
    notes           TEXT,
    created_at      TIMESTAMPTZ                          DEFAULT Date('2025-11-24')::timestamptz
);
CREATE INDEX idx_tire_brand ON management.tire (brand);
CREATE INDEX idx_tire_status ON management.tire (status);
-- ========================================================
-- 2) manufacturer
-- Test cases:
--   - table with NO references (standalone)
--   - includes PostGIS location (GEOGRAPHY) for HQ location
--   - jsonb for miscellaneous details
-- ========================================================
CREATE TABLE management.manufacturer
(
    id           SERIAL PRIMARY KEY,
    name         TEXT NOT NULL,
    location     geometry(Geometry, 4326),
    founded_year INT,
    details      JSONB,
    created_at   TIMESTAMPTZ DEFAULT Date('2025-11-23')::timestamptz
);
CREATE INDEX idx_manufacturer_name ON management.manufacturer (name);
-- ========================================================
-- 3) garage
-- Test cases:
--   - table referenced by multiple tables (mechanic, service_record, tire_set)
--   - contains self reference (parent_garage_id)
--   - uses PostGIS GEOGRAPHY for location
-- ========================================================
CREATE TABLE management.garage
(
    garage_id        SERIAL PRIMARY KEY,
    parent_garage_id INT  REFERENCES management.garage (garage_id) ON DELETE SET NULL, -- self reference
    name             TEXT NOT NULL,
    location         geometry(Geometry, 2056),                                         -- e.g. POINT(lon lat)
    services_offered TEXT[],                                                           -- array of services
    opening_hours    JSONB,                                                            -- structured opening hours, timezone-aware
    rating           NUMERIC(3, 2),
    created_at       TIMESTAMPTZ DEFAULT Date('2025-11-22')::timestamptz
);
CREATE INDEX idx_garage_name ON management.garage (name);
-- Spatial index for PostGIS queries
CREATE INDEX idx_garage_location ON management.garage USING GIST (location);
-- ========================================================
-- 4) car
-- Test cases:
--   - UUID primary key table
--   - references manufacturer (no-ref table)
--   - referenced by tire_set (back-reference to installed_tire_set_id)
--   - arrays, jsonb, enums, and realistic columns
-- ========================================================
CREATE TABLE management.car
(
    id              UUID PRIMARY KEY DEFAULT gen_random_uuid(),
    vin             VARCHAR(17) UNIQUE        NOT NULL,
    manufacturer_id INT                       REFERENCES management.manufacturer (id) ON DELETE SET NULL,
    model           TEXT,
    model_trim      TEXT,
    year            INT,
    mileage_km      BIGINT           DEFAULT 0,
    fuel_type       management.fuel_type_enum NOT NULL,
    tags            TEXT[], -- keywords e.g. ['fleet','leased']
    options         JSONB,  -- options and packages
    created_at      TIMESTAMPTZ      DEFAULT Date('2025-11-21')::timestamptz
);
CREATE INDEX idx_car_manufacturer ON management.car (manufacturer_id);
CREATE INDEX idx_car_fuel ON management.car (fuel_type);
-- ========================================================
-- 5) tire_set
-- Test cases:
--   - uses composite PK
--   - grouping multiple FK references to the same table (4 management.tire FK columns)
--   - references car (UUID) and garage (storage location)
--   - tests update/remove semantics for sets
-- ========================================================
CREATE TABLE management.tire_set
(
    car_id              UUID                            REFERENCES management.car (id) ON DELETE SET NULL,
    front_left_tire_id  INT REFERENCES management.tire (id) ON DELETE RESTRICT,
    front_right_tire_id INT REFERENCES management.tire (id) ON DELETE RESTRICT,
    rear_left_tire_id   INT REFERENCES management.tire (id) ON DELETE RESTRICT,
    rear_right_tire_id  INT REFERENCES management.tire (id) ON DELETE RESTRICT,
    set_status          management.tire_set_status_enum NOT NULL DEFAULT 'stored',
    mounted_at          TIMESTAMPTZ,
    removed_at          TIMESTAMPTZ,
    storage_garage_id   INT                             REFERENCES management.garage (garage_id) ON DELETE SET NULL,
    notes               TEXT,
    PRIMARY KEY (front_left_tire_id, front_right_tire_id, rear_left_tire_id, rear_right_tire_id)
);
CREATE INDEX idx_tireset_car ON management.tire_set (car_id);
CREATE INDEX idx_tireset_status ON management.tire_set (set_status);
-- ========================================================
-- 6) tire_set_log
-- Test cases:
--   - uses composite FK referencing tire_set's composite PK
--   - tests foreign key integrity with multi-column references
-- ========================================================
CREATE TABLE management.tire_set_log
(
    id                  SERIAL PRIMARY KEY,
    front_left_tire_id  INT,
    front_right_tire_id INT,
    rear_left_tire_id   INT,
    rear_right_tire_id  INT,
    log                 TEXT,
    created_at          TIMESTAMPTZ DEFAULT Date('2025-11-28')::timestamptz,
    FOREIGN KEY (front_left_tire_id, front_right_tire_id, rear_left_tire_id, rear_right_tire_id)
        REFERENCES management.tire_set (front_left_tire_id, front_right_tire_id, rear_left_tire_id, rear_right_tire_id)
        ON DELETE RESTRICT
);
-- ========================================================
-- 7) owner
-- Test cases:
--   - SERIAL PK
--   - various contact fields and an enum
--   - used in many-to-many ownership history
--   - has UNIQUE constraint on email
-- ========================================================
CREATE TABLE management.owner
(
    id            SERIAL PRIMARY KEY,
    legal_name    TEXT                          NOT NULL,
    display_name  TEXT,
    address       TEXT,
    phone         TEXT,
    email         TEXT,
    customer_type management.customer_type_enum NOT NULL DEFAULT 'private',
    metadata      JSONB,
    created_at    TIMESTAMPTZ                            DEFAULT Date('2025-11-20')::timestamptz,
    UNIQUE (email)
);
CREATE INDEX idx_owner_email ON management.owner (email);
-- ========================================================
-- 8) car_owner_history
-- Test cases:
--   - references car (UUID) and management.owner (serial)
--   - uses TSRANGE to test temporal ownership ranges (range types)
--   - tests constraint with exclusion or check on overlapping ownership windows if needed
-- ========================================================
CREATE TABLE management.car_owner_history
(
    id               SERIAL PRIMARY KEY,
    car_id           UUID    NOT NULL REFERENCES management.car (id) ON DELETE CASCADE,
    owner_id         INT     NOT NULL REFERENCES management.owner (id) ON DELETE CASCADE,
    ownership_period TSRANGE NOT NULL, -- e.g. ['2020-01-01','2021-01-01']
    notes            TEXT,
    created_at       TIMESTAMPTZ DEFAULT Date('2025-11-19')::timestamptz
);
-- Example useful index (gin on range)
CREATE INDEX idx_car_owner_history_car_period ON management.car_owner_history USING GIST (car_id, ownership_period);
-- ========================================================
-- 9) mechanic
-- Test cases:
--   - SERIAL PK referencing garage
--   - arrays and enums to test text[] and skill-level enumeration
-- ========================================================
CREATE TABLE management.mechanic
(
    mechanic_id    SERIAL PRIMARY KEY,
    garage_id      INT  REFERENCES management.garage (garage_id) ON DELETE SET NULL,
    full_name      TEXT NOT NULL,
    certifications TEXT[], -- e.g. ['ASE A1','EV Certified']
    hire_date      DATE,
    skill_level    management.skill_level_enum DEFAULT 'mid',
    active         BOOLEAN                     DEFAULT true,
    notes          TEXT,
    created_at     TIMESTAMPTZ                 DEFAULT Date('2025-11-18')::timestamptz
);
CREATE INDEX idx_mechanic_garage ON management.mechanic (garage_id);
CREATE INDEX idx_mechanic_skill ON management.mechanic (skill_level);
-- ========================================================
-- 10) garage_mechanic
-- Test cases:
--   - Many-to-many join table (garage <-> mechanic)
--   - uses TSRANGE to represent shift ranges
--   - composite PK (garage_id, mechanic_id)
-- ========================================================
CREATE TABLE management.garage_mechanic
(
    garage_id   INT     NOT NULL REFERENCES management.garage (garage_id) ON DELETE CASCADE,
    mechanic_id INT     NOT NULL REFERENCES management.mechanic (mechanic_id) ON DELETE CASCADE,
    shift_range TSRANGE NOT NULL,
    role        TEXT,
    created_at  TIMESTAMPTZ DEFAULT Date('2025-11-17')::timestamptz,
    UNIQUE (garage_id, mechanic_id, shift_range),
    PRIMARY KEY (garage_id, mechanic_id)
);
CREATE INDEX idx_gma_garage ON management.garage_mechanic (garage_id);
CREATE INDEX idx_gma_mechanic ON management.garage_mechanic (mechanic_id);
-- ========================================================
-- 11) service_record
-- Test cases:
--   - Complex hub: references multiple other tables (car, mechanic, garage, tire)
--   - referenced by other tables (inspection)
--   - self-reference for follow-up services (related_service_id)
--   - includes jsonb diagnostics and TSRANGE service_window
--   - uses UUID PK
-- ========================================================
CREATE TABLE management.service_record
(
    service_id         UUID PRIMARY KEY DEFAULT gen_random_uuid(),
    car_id             UUID REFERENCES management.car (id) ON DELETE CASCADE,
    mechanic_id        INT                          REFERENCES management.mechanic (mechanic_id) ON DELETE SET NULL,
    garage_id          INT                          REFERENCES management.garage (garage_id) ON DELETE SET NULL,
    related_service_id UUID                         REFERENCES management.service_record (service_id) ON DELETE SET NULL, -- self reference
    tire_id            INT                          REFERENCES management.tire (id) ON DELETE SET NULL,
    service_type       management.service_type_enum NOT NULL,
    cost               NUMERIC(12, 2),
    notes              TEXT,
    service_window     TSRANGE,                                                                                           -- planned window for the service
    diagnostic_data    JSONB,                                                                                             -- e.g. diagnostics, DTC snapshots
    created_at         TIMESTAMPTZ      DEFAULT Date('2025-11-16')::timestamptz
);
CREATE INDEX idx_service_car ON management.service_record (car_id);
CREATE INDEX idx_service_garage ON management.service_record (garage_id);
CREATE INDEX idx_service_type ON management.service_record (service_type);
-- ========================================================
-- 12) inspection
-- Test cases:
--   - references management.service_record (tests referencing a UUID PK)
--   - stores jsonb for issues found
-- ========================================================
CREATE TABLE management.inspection
(
    id             SERIAL PRIMARY KEY,
    service_id     UUID REFERENCES management.service_record (service_id) ON DELETE CASCADE,
    inspector_name TEXT,
    passed         BOOLEAN,
    issues_found   JSONB,
    performed_at   TIMESTAMPTZ DEFAULT Date('2025-11-18')::timestamptz
);
CREATE INDEX idx_inspection_service ON management.inspection (service_id);
-- ========================================================
-- 13) feature
-- Test cases:
--   - master list table used in many-to-many with car (feature assignment)
--   - has UNIQUE constraint on name
-- ========================================================
CREATE TABLE management.feature
(
    feature_id  SERIAL PRIMARY KEY,
    name        TEXT NOT NULL UNIQUE,
    description TEXT,
    created_at  TIMESTAMPTZ DEFAULT Date('2025-11-14')::timestamptz
);
-- ========================================================
-- 14) management.car_feature
-- Test cases:
--   - car references multiple tables (car->feature)
--   - also demonstrates installation/unenrollment time windows
-- ========================================================
CREATE TABLE management.car_feature
(
    id           SERIAL PRIMARY KEY,
    car_id       UUID REFERENCES management.car (id) ON DELETE CASCADE,
    feature_id   INT REFERENCES management.feature (feature_id) ON DELETE CASCADE,
    installed_at TIMESTAMPTZ DEFAULT Date('2025-11-13')::timestamptz,
    removed_at   TIMESTAMPTZ,
    installed_by INT REFERENCES management.mechanic (mechanic_id) ON DELETE SET NULL,
    notes        TEXT
);
CREATE INDEX idx_cfa_car ON management.car_feature (car_id);
CREATE INDEX idx_cfa_feature ON management.car_feature (feature_id);
-- ========================================================
-- 15) telematic.telematics_snapshot
-- Test cases:
--   - different schema (telematic)
--   - jsonb (telematics), arrays (DTC codes), range (speed_range), gps jsonb
--   - tests storing varied telemetry and indexing strategies
-- ========================================================
CREATE TABLE telematic.telematics_snapshot
(
    id           SERIAL PRIMARY KEY,
    car_id       UUID REFERENCES management.car (id) ON DELETE CASCADE,
    snapshot_ts  TIMESTAMPTZ NOT NULL         DEFAULT Date('2025-11-12')::timestamptz,
    dtc_codes    TEXT[],    -- diagnostic trouble codes
    telematics   JSONB,     -- full device snapshot
    speed_range  INT4RANGE, -- min/max speed observed in snapshot window
    gps          JSONB,     -- { lat, lon, accuracy, path: [ ... ] }
    engine_state management.engine_state_enum DEFAULT 'ok'
);
CREATE INDEX idx_telematics_car_time ON telematic.telematics_snapshot (car_id, snapshot_ts);
CREATE INDEX idx_telematics_engine_state ON telematic.telematics_snapshot (engine_state);
-- ========================================================
-- 16) maintenance_ticket
-- Test cases:
--   - demonstrates SERIAL PK with a custom column name (custom_name_id)
--   - references a UUID PK and is referenced by others if needed
-- ========================================================
CREATE TABLE management.maintenance_ticket
(
    custom_name_id SERIAL PRIMARY KEY, -- custom-id name, tests ORMs that expect "id"
    service_id     UUID REFERENCES management.service_record (service_id) ON DELETE SET NULL,
    reported_by    INT  REFERENCES management.owner (id) ON DELETE SET NULL,
    description    TEXT,
    status         TEXT,
    created_at     TIMESTAMPTZ DEFAULT Date('2025-11-11')::timestamptz
);
CREATE INDEX idx_maintenance_service ON management.maintenance_ticket (service_id);
-- ========================================================
-- 17) Additional useful index / constraint examples
-- Test cases:
--   - unique and partial indexes to test DB optimization & constraint behaviour
-- ========================================================
-- Example: unique VIN already was created; here's a partial unique on manufacturer name + founded_year only if founded_year is not null
CREATE UNIQUE INDEX IF NOT EXISTS uq_manufacturer_name_year ON management.manufacturer (name, founded_year) WHERE founded_year IS NOT NULL;
-- ========================================================
-- ========================================================
-- START TESTS
-- ========================================================
-- ========================================================
-- =========================================================
-- STEP 1: Insert 1 row WITHOUT SERIAL PK for every table
-- =========================================================
-- manufacturer
INSERT INTO management.manufacturer (name, location, founded_year, details)
VALUES ('Example Tyres Ltd',
        ST_Transform(ST_SetSRID(ST_Point(2600000, 1200000), 2056), 4326),
        1958,
        '{
            "notes": "HQ in Switzerland",
            "website": "https://exampletyres.example"
        }'::jsonb);
-- garage
INSERT INTO management.garage (parent_garage_id, name, location, services_offered, opening_hours, rating)
VALUES (NULL,
        'Central Garage',
        ST_Transform(ST_SetSRID(ST_Point(2600000, 1200000), 2056), 2056),
        ARRAY ['tyre_change','inspection','maintenance'],
        '{
            "mon-fri": "08:00-18:00",
            "sat": "09:00-14:00"
        }'::jsonb,
        4.6);
-- owner
INSERT INTO management.owner (legal_name, display_name, address, phone, email, customer_type, metadata)
VALUES ('Max Muster',
        'M. Muster',
        'Example Street 1, 1000 Sampletown',
        '+41 44 000 00 01',
        'max.muster@example.com',
        'private',
        '{
            "notes": "VIP customer"
        }'::jsonb);
-- tire
INSERT INTO management.tire (production_date, tire_type, size_text, profile_mm_left, brand, pressure_psi, status, manufacturer_id, notes)
VALUES ('2024-06-15',
        'summer',
        '205/55R16',
        7.5,
        'GoodTyre',
        32.0,
        'stored',
        (SELECT id FROM management.manufacturer WHERE name = 'Example Tyres Ltd' LIMIT 1),
        'Batch A1');
-- car
INSERT INTO management.car (id, vin, manufacturer_id, model, model_trim, year, mileage_km, fuel_type, tags, options)
VALUES ('00000000-0000-0000-0000-000000000001'::uuid,
        'WDB1234561A654321',
        (SELECT id FROM management.manufacturer WHERE name = 'Example Tyres Ltd' LIMIT 1),
        'Model X',
        'Premium',
        2021,
        45200,
        'gasoline',
        ARRAY ['fleet','company'],
        '{
            "color": "black",
            "seats": 5
        }'::jsonb);
-- car_owner_history
INSERT INTO management.car_owner_history (car_id, owner_id, ownership_period)
VALUES ((SELECT id FROM management.car WHERE vin = 'WDB1234561A654321' LIMIT 1),
        (SELECT id FROM management.owner WHERE legal_name = 'Max Muster' LIMIT 1),
        '[2020-01-01,2021-01-01]'::tsrange);
-- tire_set
INSERT INTO management.tire_set (car_id, front_left_tire_id, front_right_tire_id, rear_left_tire_id, rear_right_tire_id, set_status,
                                 storage_garage_id, notes)
VALUES ((SELECT id FROM management.car WHERE vin = 'WDB1234561A654321'),
        (SELECT id FROM management.tire WHERE brand = 'GoodTyre' LIMIT 1),
        (SELECT id FROM management.tire WHERE brand = 'GoodTyre' LIMIT 1),
        (SELECT id FROM management.tire WHERE brand = 'GoodTyre' LIMIT 1),
        (SELECT id FROM management.tire WHERE brand = 'GoodTyre' LIMIT 1),
        'mounted',
        (SELECT garage_id FROM management.garage WHERE name = 'Central Garage' LIMIT 1),
        'Initial set');
-- tire_set
INSERT INTO management.tire_set_log (front_left_tire_id, front_right_tire_id, rear_left_tire_id, rear_right_tire_id, log)
VALUES ((SELECT id FROM management.tire WHERE brand = 'GoodTyre' LIMIT 1),
        (SELECT id FROM management.tire WHERE brand = 'GoodTyre' LIMIT 1),
        (SELECT id FROM management.tire WHERE brand = 'GoodTyre' LIMIT 1),
        (SELECT id FROM management.tire WHERE brand = 'GoodTyre' LIMIT 1),
        'Intern accidentally punctured the left rear tire, we just glued it');
-- mechanic
INSERT INTO management.mechanic (garage_id, full_name, certifications, hire_date, skill_level, active, notes)
VALUES ((SELECT garage_id FROM management.garage WHERE name = 'Central Garage'),
        'John Doe',
        ARRAY ['ASE A1','EV Certified'],
        '2018-05-01',
        'senior',
        true,
        'Lead mechanic');
-- garage_mechanic
INSERT INTO management.garage_mechanic (garage_id, mechanic_id, shift_range, role)
VALUES ((SELECT garage_id FROM management.garage WHERE name = 'Central Garage'),
        (SELECT mechanic_id FROM management.mechanic WHERE full_name = 'John Doe'),
        '[2025-11-01 08:00:00,2025-11-01 16:00:00)'::tsrange,
        'shift_lead');
-- service_record
INSERT INTO management.service_record (service_id, car_id, mechanic_id, garage_id, tire_id, service_type, cost, notes)
VALUES ('00000000-0000-0000-0000-000000000002'::uuid,
        (SELECT id FROM management.car WHERE vin = 'WDB1234561A654321'),
        (SELECT mechanic_id FROM management.mechanic WHERE full_name = 'John Doe'),
        (SELECT garage_id FROM management.garage WHERE name = 'Central Garage'),
        (SELECT id FROM management.tire WHERE brand = 'GoodTyre' LIMIT 1),
        'maintenance',
        249.99,
        'Oil change and basic inspection');
-- inspection
INSERT INTO management.inspection (service_id, inspector_name, passed, issues_found)
VALUES ((SELECT service_id FROM management.service_record LIMIT 1),
        'Richard Roe',
        true,
        '[]'::jsonb);
-- feature
INSERT INTO management.feature (name, description)
VALUES ('Heated Seats', 'Seats with internal heating');
-- car_feature
INSERT INTO management.car_feature (car_id, feature_id, installed_at, installed_by, notes)
VALUES ((SELECT id FROM management.car WHERE vin = 'WDB1234561A654321'),
        (SELECT feature_id FROM management.feature WHERE name = 'Heated Seats'),
        Date('2025-11-10')::timestamptz,
        (SELECT mechanic_id FROM management.mechanic WHERE full_name = 'John Doe'),
        'Installed at purchase');
-- telematics_snapshot
INSERT INTO telematic.telematics_snapshot (car_id, snapshot_ts, dtc_codes, telematics, speed_range, gps, engine_state)
VALUES ((SELECT id FROM management.car WHERE vin = 'WDB1234561A654321'),
        Date('2025-11-10')::timestamptz,
        ARRAY []::text[],
        '{
            "battery": 98,
            "temp_c": 22
        }'::jsonb,
        '[0,120]'::int4range,
        '{
            "lat": 47.376887,
            "lon": 8.541694
        }'::jsonb,
        'ok');
-- maintenance_ticket
INSERT INTO management.maintenance_ticket (service_id, reported_by, description, status)
VALUES ((SELECT service_id FROM management.service_record LIMIT 1),
        (SELECT id FROM management.owner WHERE legal_name = 'Max Muster'),
        'Customer reports vibration at high speed',
        'open');
-- =========================================================
-- STEP 2: migrate to vie
-- =========================================================
SELECT set_commit_author('alice@example.com');
 set_commit_author 
-------------------
 
(1 row)

SELECT migrate_schemas_to_vie('management', 'telematic');
NOTICE:  column "management__tire_hash" of relation "management__tire_set" already exists, skipping
NOTICE:  column "management__tire_hash" of relation "management__tire_set" already exists, skipping
NOTICE:  column "management__tire_hash" of relation "management__tire_set" already exists, skipping
 migrate_schemas_to_vie 
------------------------
 
(1 row)

SELECT *
FROM management.maintenance_ticket;
 custom_name_id |              service_id              | reported_by |               description                | status |          created_at          
----------------+--------------------------------------+-------------+------------------------------------------+--------+------------------------------
              1 | 00000000-0000-0000-0000-000000000002 |           1 | Customer reports vibration at high speed | open   | Tue Nov 11 00:00:00 2025 PST
(1 row)

SELECT *
FROM management.inspection;
 id |              service_id              | inspector_name | passed | issues_found |         performed_at         
----+--------------------------------------+----------------+--------+--------------+------------------------------
  1 | 00000000-0000-0000-0000-000000000002 | Richard Roe    | t      | []           | Tue Nov 18 00:00:00 2025 PST
(1 row)

SELECT *
FROM telematic.telematics_snapshot;
 id |                car_id                |         snapshot_ts          | dtc_codes |          telematics           | speed_range |                 gps                 | engine_state 
----+--------------------------------------+------------------------------+-----------+-------------------------------+-------------+-------------------------------------+--------------
  1 | 00000000-0000-0000-0000-000000000001 | Mon Nov 10 00:00:00 2025 PST | {}        | {"temp_c": 22, "battery": 98} | [0,121)     | {"lat": 47.376887, "lon": 8.541694} | ok
(1 row)

SELECT *
FROM management.car_feature;
 id |                car_id                | feature_id |         installed_at         | removed_at | installed_by |         notes         
----+--------------------------------------+------------+------------------------------+------------+--------------+-----------------------
  1 | 00000000-0000-0000-0000-000000000001 |          1 | Mon Nov 10 00:00:00 2025 PST |            |            1 | Installed at purchase
(1 row)

SELECT *
FROM management.car_owner_history;
 id |                car_id                | owner_id |                    ownership_period                     | notes |          created_at          
----+--------------------------------------+----------+---------------------------------------------------------+-------+------------------------------
  1 | 00000000-0000-0000-0000-000000000001 |        1 | ["Wed Jan 01 00:00:00 2020","Fri Jan 01 00:00:00 2021"] |       | Wed Nov 19 00:00:00 2025 PST
(1 row)

SELECT *
FROM management.garage_mechanic;
 garage_id | mechanic_id |                       shift_range                       |    role    |          created_at          
-----------+-------------+---------------------------------------------------------+------------+------------------------------
         1 |           1 | ["Sat Nov 01 08:00:00 2025","Sat Nov 01 16:00:00 2025") | shift_lead | Mon Nov 17 00:00:00 2025 PST
(1 row)

SELECT *
FROM management.tire_set;
                car_id                | front_left_tire_id | front_right_tire_id | rear_left_tire_id | rear_right_tire_id | set_status | mounted_at | removed_at | storage_garage_id |    notes    
--------------------------------------+--------------------+---------------------+-------------------+--------------------+------------+------------+------------+-------------------+-------------
 00000000-0000-0000-0000-000000000001 |                  1 |                   1 |                 1 |                  1 | mounted    |            |            |                 1 | Initial set
(1 row)

SELECT *
FROM management.tire_set_log;
 id | front_left_tire_id | front_right_tire_id | rear_left_tire_id | rear_right_tire_id |                                log                                 |          created_at          
----+--------------------+---------------------+-------------------+--------------------+--------------------------------------------------------------------+------------------------------
  1 |                  1 |                   1 |                 1 |                  1 | Intern accidentally punctured the left rear tire, we just glued it | Fri Nov 28 00:00:00 2025 PST
(1 row)

SELECT *
FROM management.service_record;
              service_id              |                car_id                | mechanic_id | garage_id | related_service_id | tire_id | service_type |  cost  |              notes              | service_window | diagnostic_data |          created_at          
--------------------------------------+--------------------------------------+-------------+-----------+--------------------+---------+--------------+--------+---------------------------------+----------------+-----------------+------------------------------
 00000000-0000-0000-0000-000000000002 | 00000000-0000-0000-0000-000000000001 |           1 |         1 |                    |       1 | maintenance  | 249.99 | Oil change and basic inspection |                |                 | Sun Nov 16 00:00:00 2025 PST
(1 row)

SELECT *
FROM management.mechanic;
 mechanic_id | garage_id | full_name |      certifications       | hire_date  | skill_level | active |     notes     |          created_at          
-------------+-----------+-----------+---------------------------+------------+-------------+--------+---------------+------------------------------
           1 |         1 | John Doe  | {"ASE A1","EV Certified"} | 05-01-2018 | senior      | t      | Lead mechanic | Tue Nov 18 00:00:00 2025 PST
(1 row)

SELECT *
FROM management.car;
                  id                  |        vin        | manufacturer_id |  model  | model_trim | year | mileage_km | fuel_type |      tags       |            options             |          created_at          
--------------------------------------+-------------------+-----------------+---------+------------+------+------------+-----------+-----------------+--------------------------------+------------------------------
 00000000-0000-0000-0000-000000000001 | WDB1234561A654321 |               1 | Model X | Premium    | 2021 |      45200 | gasoline  | {fleet,company} | {"color": "black", "seats": 5} | Fri Nov 21 00:00:00 2025 PST
(1 row)

SELECT *
FROM management.feature;
 feature_id |     name     |         description         |          created_at          
------------+--------------+-----------------------------+------------------------------
          1 | Heated Seats | Seats with internal heating | Fri Nov 14 00:00:00 2025 PST
(1 row)

SELECT *
FROM management.owner;
 id | legal_name | display_name |              address              |      phone       |         email          | customer_type |         metadata          |          created_at          
----+------------+--------------+-----------------------------------+------------------+------------------------+---------------+---------------------------+------------------------------
  1 | Max Muster | M. Muster    | Example Street 1, 1000 Sampletown | +41 44 000 00 01 | max.muster@example.com | private       | {"notes": "VIP customer"} | Thu Nov 20 00:00:00 2025 PST
(1 row)

SELECT *
FROM management.garage;
 garage_id | parent_garage_id |      name      |                      location                      |           services_offered           |                  opening_hours                   | rating |          created_at          
-----------+------------------+----------------+----------------------------------------------------+--------------------------------------+--------------------------------------------------+--------+------------------------------
         1 |                  | Central Garage | 0101000020080800000000000020D6434100000000804F3241 | {tyre_change,inspection,maintenance} | {"sat": "09:00-14:00", "mon-fri": "08:00-18:00"} |   4.60 | Sat Nov 22 00:00:00 2025 PST
(1 row)

SELECT *
FROM management.tire;
 id | production_date | tire_type | size_text | profile_mm_left |  brand   | pressure_psi | status | manufacturer_id |  notes   |          created_at          
----+-----------------+-----------+-----------+-----------------+----------+--------------+--------+-----------------+----------+------------------------------
  1 | 06-15-2024      | summer    | 205/55R16 |             7.5 | GoodTyre |        32.00 | stored |               1 | Batch A1 | Mon Nov 24 00:00:00 2025 PST
(1 row)

SELECT *
FROM management.manufacturer;
 id |       name        |                      location                      | founded_year |                                  details                                  |          created_at          
----+-------------------+----------------------------------------------------+--------------+---------------------------------------------------------------------------+------------------------------
  1 | Example Tyres Ltd | 0101000020E61000005E707ADB28C11D40DA7C8C14BD794740 |         1958 | {"notes": "HQ in Switzerland", "website": "https://exampletyres.example"} | Sun Nov 23 00:00:00 2025 PST
(1 row)

-- =========================================================
-- STEP 3: Insert 1 row WITH PK for every table
-- =========================================================
-- manufacturer
INSERT INTO management.manufacturer (id, name, location, founded_year, details)
VALUES (1001,
        'Sample Wheels Ltd',
        ST_SetSRID(ST_Point(8.541694, 47.376887), 4326),
        1975,
        '{
            "special": "high performance"
        }'::jsonb);
SELECT *
FROM management.manufacturer;
  id  |       name        |                      location                      | founded_year |                                  details                                  |          created_at          
------+-------------------+----------------------------------------------------+--------------+---------------------------------------------------------------------------+------------------------------
    1 | Example Tyres Ltd | 0101000020E61000005E707ADB28C11D40DA7C8C14BD794740 |         1958 | {"notes": "HQ in Switzerland", "website": "https://exampletyres.example"} | Sun Nov 23 00:00:00 2025 PST
 1001 | Sample Wheels Ltd | 0101000020E6100000FCE07CEA58152140CFA44DD53DB04740 |         1975 | {"special": "high performance"}                                           | Sun Nov 23 00:00:00 2025 PST
(2 rows)

-- garage
INSERT INTO management.garage (garage_id, parent_garage_id, name, location, services_offered, opening_hours, rating)
VALUES (5001,
        NULL,
        'North Garage',
        ST_SetSRID(ST_Point(7.588576, 47.559598), 2056),
        ARRAY ['inspection','repair'],
        '{
            "mon-fri": "07:00-17:00"
        }'::jsonb,
        4.2);
SELECT *
FROM management.garage;
 garage_id | parent_garage_id |      name      |                      location                      |           services_offered           |                  opening_hours                   | rating |          created_at          
-----------+------------------+----------------+----------------------------------------------------+--------------------------------------+--------------------------------------------------+--------+------------------------------
         1 |                  | Central Garage | 0101000020080800000000000020D6434100000000804F3241 | {tyre_change,inspection,maintenance} | {"sat": "09:00-14:00", "mon-fri": "08:00-18:00"} |   4.60 | Sat Nov 22 00:00:00 2025 PST
      5001 |                  | North Garage   | 0101000020080800008CD7BCAAB35A1E40197442E8A0C74740 | {inspection,repair}                  | {"mon-fri": "07:00-17:00"}                       |   4.20 | Sat Nov 22 00:00:00 2025 PST
(2 rows)

-- owner
INSERT INTO management.owner (id, legal_name, display_name, address, phone, email, customer_type, metadata)
VALUES (3001,
        'Müster Logistics Ltd',
        'MüsterLog',
        'Example Park 5, 1000 Sampletown',
        '+41 44 000 11 22',
        'contact@muesterlog.example',
        'corporate',
        '{
            "fleet_size": 80
        }'::jsonb);
SELECT *
FROM management.owner;
  id  |      legal_name      | display_name |              address              |      phone       |           email            | customer_type |         metadata          |          created_at          
------+----------------------+--------------+-----------------------------------+------------------+----------------------------+---------------+---------------------------+------------------------------
    1 | Max Muster           | M. Muster    | Example Street 1, 1000 Sampletown | +41 44 000 00 01 | max.muster@example.com     | private       | {"notes": "VIP customer"} | Thu Nov 20 00:00:00 2025 PST
 3001 | Müster Logistics Ltd | MüsterLog    | Example Park 5, 1000 Sampletown   | +41 44 000 11 22 | contact@muesterlog.example | corporate     | {"fleet_size": 80}        | Thu Nov 20 00:00:00 2025 PST
(2 rows)

-- tire
INSERT INTO management.tire (id, production_date, tire_type, size_text, profile_mm_left, brand, pressure_psi, status, manufacturer_id)
VALUES (2001,
        '2023-11-01',
        'winter',
        '195/65R15',
        9.2,
        'SwissGrip',
        34.0,
        'mounted',
        1001);
SELECT *
FROM management.tire;
  id  | production_date | tire_type | size_text | profile_mm_left |   brand   | pressure_psi | status  | manufacturer_id |  notes   |          created_at          
------+-----------------+-----------+-----------+-----------------+-----------+--------------+---------+-----------------+----------+------------------------------
    1 | 06-15-2024      | summer    | 205/55R16 |             7.5 | GoodTyre  |        32.00 | stored  |               1 | Batch A1 | Mon Nov 24 00:00:00 2025 PST
 2001 | 11-01-2023      | winter    | 195/65R15 |             9.2 | SwissGrip |        34.00 | mounted |            1001 |          | Mon Nov 24 00:00:00 2025 PST
(2 rows)

-- car
INSERT INTO management.car (id, vin, manufacturer_id, model, model_trim, year, mileage_km, fuel_type, tags, options)
VALUES ('11111111-1111-1111-1111-111111111111'::uuid,
        '1HGCM82633A004352',
        1001,
        'Model S',
        'Long Range',
        2020,
        12000,
        'electric',
        ARRAY ['leased'],
        '{
            "battery_kwh": 85
        }'::jsonb);
INSERT INTO management.car (id, vin, manufacturer_id, model, model_trim, year, mileage_km, fuel_type, tags, options)
VALUES ('22222222-2222-2222-2222-222222222222'::uuid,
        'VF1RFB00456812345',
        (SELECT id FROM management.manufacturer WHERE name = 'Demo Wheels Ltd' LIMIT 1),
        'Model A',
        'Comfort',
        2019,
        38000,
        'diesel',
        ARRAY ['company'],
        '{
            "color": "silver",
            "seats": 5
        }'::jsonb);
SELECT *
FROM management.car;
                  id                  |        vin        | manufacturer_id |  model  | model_trim | year | mileage_km | fuel_type |      tags       |             options             |          created_at          
--------------------------------------+-------------------+-----------------+---------+------------+------+------------+-----------+-----------------+---------------------------------+------------------------------
 00000000-0000-0000-0000-000000000001 | WDB1234561A654321 |               1 | Model X | Premium    | 2021 |      45200 | gasoline  | {fleet,company} | {"color": "black", "seats": 5}  | Fri Nov 21 00:00:00 2025 PST
 11111111-1111-1111-1111-111111111111 | 1HGCM82633A004352 |            1001 | Model S | Long Range | 2020 |      12000 | electric  | {leased}        | {"battery_kwh": 85}             | Fri Nov 21 00:00:00 2025 PST
 22222222-2222-2222-2222-222222222222 | VF1RFB00456812345 |                 | Model A | Comfort    | 2019 |      38000 | diesel    | {company}       | {"color": "silver", "seats": 5} | Fri Nov 21 00:00:00 2025 PST
(3 rows)

-- tire_set
INSERT INTO management.tire_set (car_id, front_left_tire_id, front_right_tire_id, rear_left_tire_id, rear_right_tire_id, set_status,
                                 storage_garage_id)
VALUES ('11111111-1111-1111-1111-111111111111'::uuid,
        2001,
        2001,
        2001,
        2001,
        'stored',
        5001);
SELECT *
FROM management.tire_set;
                car_id                | front_left_tire_id | front_right_tire_id | rear_left_tire_id | rear_right_tire_id | set_status | mounted_at | removed_at | storage_garage_id |    notes    
--------------------------------------+--------------------+---------------------+-------------------+--------------------+------------+------------+------------+-------------------+-------------
 00000000-0000-0000-0000-000000000001 |                  1 |                   1 |                 1 |                  1 | mounted    |            |            |                 1 | Initial set
 11111111-1111-1111-1111-111111111111 |               2001 |                2001 |              2001 |               2001 | stored     |            |            |              5001 | 
(2 rows)

-- tire_set_log
INSERT INTO management.tire_set_log (front_left_tire_id, front_right_tire_id, rear_left_tire_id, rear_right_tire_id, log)
VALUES (2001,
        2001,
        2001,
        2001,
        'have one flat spot');
SELECT *
FROM management.tire_set_log;
 id | front_left_tire_id | front_right_tire_id | rear_left_tire_id | rear_right_tire_id |                                log                                 |          created_at          
----+--------------------+---------------------+-------------------+--------------------+--------------------------------------------------------------------+------------------------------
  1 |                  1 |                   1 |                 1 |                  1 | Intern accidentally punctured the left rear tire, we just glued it | Fri Nov 28 00:00:00 2025 PST
  2 |               2001 |                2001 |              2001 |               2001 | have one flat spot                                                 | Fri Nov 28 00:00:00 2025 PST
(2 rows)

-- mechanic
INSERT INTO management.mechanic (mechanic_id, garage_id, full_name, certifications, hire_date, skill_level, active)
VALUES (7001,
        5001,
        'Erika Müster',
        ARRAY ['ASE B2'],
        '2020-09-15',
        'mid',
        true);
SELECT *
FROM management.mechanic;
 mechanic_id | garage_id |  full_name   |      certifications       | hire_date  | skill_level | active |     notes     |          created_at          
-------------+-----------+--------------+---------------------------+------------+-------------+--------+---------------+------------------------------
           1 |         1 | John Doe     | {"ASE A1","EV Certified"} | 05-01-2018 | senior      | t      | Lead mechanic | Tue Nov 18 00:00:00 2025 PST
        7001 |      5001 | Erika Müster | {"ASE B2"}                | 09-15-2020 | mid         | t      |               | Tue Nov 18 00:00:00 2025 PST
(2 rows)

-- garage_mechanic
INSERT INTO management.garage_mechanic (garage_id, mechanic_id, shift_range, role)
VALUES (5001,
        7001,
        '[2025-11-02 08:00:00,2025-11-02 16:00:00)'::tsrange,
        'morning');
SELECT *
FROM management.garage_mechanic;
 garage_id | mechanic_id |                       shift_range                       |    role    |          created_at          
-----------+-------------+---------------------------------------------------------+------------+------------------------------
         1 |           1 | ["Sat Nov 01 08:00:00 2025","Sat Nov 01 16:00:00 2025") | shift_lead | Mon Nov 17 00:00:00 2025 PST
      5001 |        7001 | ["Sun Nov 02 08:00:00 2025","Sun Nov 02 16:00:00 2025") | morning    | Mon Nov 17 00:00:00 2025 PST
(2 rows)

-- service_record
INSERT INTO management.service_record (service_id, car_id, mechanic_id, garage_id, tire_id, service_type, cost, notes)
VALUES ('22222222-2222-2222-2222-222222222222'::uuid,
        '11111111-1111-1111-1111-111111111111'::uuid,
        7001,
        5001,
        2001,
        'repair',
        1024.50,
        'Brake pad replacement');
INSERT INTO management.service_record (service_id, car_id, mechanic_id, garage_id, tire_id, service_type, cost, notes)
VALUES ('33333333-3333-3333-3333-333333333333'::uuid,
        (SELECT id FROM management.car WHERE vin = 'VF1RFB00456812345'),
        (SELECT mechanic_id FROM management.mechanic WHERE full_name = 'Joe Bloggs'),
        (SELECT garage_id FROM management.garage WHERE name = 'East Garage'),
        (SELECT id FROM management.tire WHERE brand = 'AlpineGrip' LIMIT 1),
        'inspection',
        299.99,
        'Pre-winter inspection');
SELECT *
FROM management.service_record;
              service_id              |                car_id                | mechanic_id | garage_id | related_service_id | tire_id | service_type |  cost   |              notes              | service_window | diagnostic_data |          created_at          
--------------------------------------+--------------------------------------+-------------+-----------+--------------------+---------+--------------+---------+---------------------------------+----------------+-----------------+------------------------------
 00000000-0000-0000-0000-000000000002 | 00000000-0000-0000-0000-000000000001 |           1 |         1 |                    |       1 | maintenance  |  249.99 | Oil change and basic inspection |                |                 | Sun Nov 16 00:00:00 2025 PST
 22222222-2222-2222-2222-222222222222 | 11111111-1111-1111-1111-111111111111 |        7001 |      5001 |                    |    2001 | repair       | 1024.50 | Brake pad replacement           |                |                 | Sun Nov 16 00:00:00 2025 PST
 33333333-3333-3333-3333-333333333333 | 22222222-2222-2222-2222-222222222222 |             |           |                    |         | inspection   |  299.99 | Pre-winter inspection           |                |                 | Sun Nov 16 00:00:00 2025 PST
(3 rows)

-- inspection
INSERT INTO management.inspection (id, service_id, inspector_name, passed, issues_found)
VALUES (9001,
        '22222222-2222-2222-2222-222222222222'::uuid,
        'Mary Major',
        false,
        '{
            "brakes": "worn",
            "lights": "ok"
        }'::jsonb);
SELECT *
FROM management.inspection;
  id  |              service_id              | inspector_name | passed |            issues_found            |         performed_at         
------+--------------------------------------+----------------+--------+------------------------------------+------------------------------
    1 | 00000000-0000-0000-0000-000000000002 | Richard Roe    | t      | []                                 | Tue Nov 18 00:00:00 2025 PST
 9001 | 22222222-2222-2222-2222-222222222222 | Mary Major     | f      | {"brakes": "worn", "lights": "ok"} | Tue Nov 18 00:00:00 2025 PST
(2 rows)

-- feature
INSERT INTO management.feature (feature_id, name, description)
VALUES (6001, 'Sunroof', 'Panoramic sunroof');
SELECT *
FROM management.feature;
 feature_id |     name     |         description         |          created_at          
------------+--------------+-----------------------------+------------------------------
          1 | Heated Seats | Seats with internal heating | Fri Nov 14 00:00:00 2025 PST
       6001 | Sunroof      | Panoramic sunroof           | Fri Nov 14 00:00:00 2025 PST
(2 rows)

-- car_feature
INSERT INTO management.car_feature (id, car_id, feature_id, installed_at, installed_by)
VALUES (70001,
        '11111111-1111-1111-1111-111111111111'::uuid,
        6001,
        Date('2025-11-10')::timestamptz - interval '365 days',
        7001);
SELECT *
FROM management.car_feature;
  id   |                car_id                | feature_id |         installed_at         | removed_at | installed_by |         notes         
-------+--------------------------------------+------------+------------------------------+------------+--------------+-----------------------
     1 | 00000000-0000-0000-0000-000000000001 |          1 | Mon Nov 10 00:00:00 2025 PST |            |            1 | Installed at purchase
 70001 | 11111111-1111-1111-1111-111111111111 |       6001 | Sun Nov 10 00:00:00 2024 PST |            |         7001 | 
(2 rows)

-- telematics_snapshot
INSERT INTO telematic.telematics_snapshot (id, car_id, snapshot_ts, dtc_codes, telematics, speed_range, gps, engine_state)
VALUES (10001,
        '11111111-1111-1111-1111-111111111111'::uuid,
        Date('2025-11-10')::timestamptz - interval '1 day',
        ARRAY ['P0420'],
        '{
            "battery": 75,
            "temp_c": 15
        }'::jsonb,
        '[10,90]'::int4range,
        '{
            "lat": 46.204391,
            "lon": 6.143157
        }'::jsonb,
        'warning');
SELECT *
FROM telematic.telematics_snapshot;
  id   |                car_id                |         snapshot_ts          | dtc_codes |          telematics           | speed_range |                 gps                 | engine_state 
-------+--------------------------------------+------------------------------+-----------+-------------------------------+-------------+-------------------------------------+--------------
     1 | 00000000-0000-0000-0000-000000000001 | Mon Nov 10 00:00:00 2025 PST | {}        | {"temp_c": 22, "battery": 98} | [0,121)     | {"lat": 47.376887, "lon": 8.541694} | ok
 10001 | 11111111-1111-1111-1111-111111111111 | Sun Nov 09 00:00:00 2025 PST | {P0420}   | {"temp_c": 15, "battery": 75} | [10,91)     | {"lat": 46.204391, "lon": 6.143157} | warning
(2 rows)

-- maintenance_ticket
INSERT INTO management.maintenance_ticket (custom_name_id, service_id, reported_by, description, status)
VALUES (90001,
        '22222222-2222-2222-2222-222222222222'::uuid,
        3001,
        'Brake squeal on cold mornings',
        'open');
SELECT *
FROM management.maintenance_ticket;
 custom_name_id |              service_id              | reported_by |               description                | status |          created_at          
----------------+--------------------------------------+-------------+------------------------------------------+--------+------------------------------
              1 | 00000000-0000-0000-0000-000000000002 |           1 | Customer reports vibration at high speed | open   | Tue Nov 11 00:00:00 2025 PST
          90001 | 22222222-2222-2222-2222-222222222222 |        3001 | Brake squeal on cold mornings            | open   | Tue Nov 11 00:00:00 2025 PST
(2 rows)

-- =========================================================
-- STEP 4: Insert 1 row WITHOUT PK for every table
-- =========================================================
SELECT set_commit_author('bob@example.com');
 set_commit_author 
-------------------
 
(1 row)

-- manufacturer
INSERT INTO management.manufacturer (name, location, founded_year, details)
VALUES ('Demo Wheels Ltd',
        ST_SetSRID(ST_Point(7.4474, 46.9481), 4326),
        1982,
        '{
            "special": "off-road",
            "website": "https://demowheels.example"
        }'::jsonb);
SELECT *
FROM management.manufacturer;
  id  |       name        |                      location                      | founded_year |                                  details                                  |          created_at          
------+-------------------+----------------------------------------------------+--------------+---------------------------------------------------------------------------+------------------------------
    1 | Example Tyres Ltd | 0101000020E61000005E707ADB28C11D40DA7C8C14BD794740 |         1958 | {"notes": "HQ in Switzerland", "website": "https://exampletyres.example"} | Sun Nov 23 00:00:00 2025 PST
 1001 | Sample Wheels Ltd | 0101000020E6100000FCE07CEA58152140CFA44DD53DB04740 |         1975 | {"special": "high performance"}                                           | Sun Nov 23 00:00:00 2025 PST
 1002 | Demo Wheels Ltd   | 0101000020E6100000EEEBC03923CA1D4036AB3E575B794740 |         1982 | {"special": "off-road", "website": "https://demowheels.example"}          | Sun Nov 23 00:00:00 2025 PST
(3 rows)

-- garage
INSERT INTO management.garage (parent_garage_id, name, location, services_offered, opening_hours, rating)
VALUES (NULL,
        'East Garage',
        ST_SetSRID(ST_Point(6.143157, 46.204391), 2056),
        ARRAY ['tyre_change','inspection'],
        '{
            "mon-fri": "08:00-18:00"
        }'::jsonb,
        4.1);
SELECT *
FROM management.garage;
 garage_id | parent_garage_id |      name      |                      location                      |           services_offered           |                  opening_hours                   | rating |          created_at          
-----------+------------------+----------------+----------------------------------------------------+--------------------------------------+--------------------------------------------------+--------+------------------------------
         1 |                  | Central Garage | 0101000020080800000000000020D6434100000000804F3241 | {tyre_change,inspection,maintenance} | {"sat": "09:00-14:00", "mon-fri": "08:00-18:00"} |   4.60 | Sat Nov 22 00:00:00 2025 PST
      5001 |                  | North Garage   | 0101000020080800008CD7BCAAB35A1E40197442E8A0C74740 | {inspection,repair}                  | {"mon-fri": "07:00-17:00"}                       |   4.20 | Sat Nov 22 00:00:00 2025 PST
      5002 |                  | East Garage    | 0101000020080800001EC6A4BF97921840624CFA7B291A4740 | {tyre_change,inspection}             | {"mon-fri": "08:00-18:00"}                       |   4.10 | Sat Nov 22 00:00:00 2025 PST
(3 rows)

-- owner
INSERT INTO management.owner (legal_name, display_name, address, phone, email, customer_type, metadata)
VALUES ('Sample Autos Ltd',
        'Sample Autos',
        'Example Street 12, 1000 Sampletown',
        '+41 41 000 22 33',
        'contact@sampleautos.example',
        'corporate',
        '{
            "fleet_size": 15
        }'::jsonb);
SELECT *
FROM management.owner;
  id  |      legal_name      | display_name |              address               |      phone       |            email            | customer_type |         metadata          |          created_at          
------+----------------------+--------------+------------------------------------+------------------+-----------------------------+---------------+---------------------------+------------------------------
    1 | Max Muster           | M. Muster    | Example Street 1, 1000 Sampletown  | +41 44 000 00 01 | max.muster@example.com      | private       | {"notes": "VIP customer"} | Thu Nov 20 00:00:00 2025 PST
 3001 | Müster Logistics Ltd | MüsterLog    | Example Park 5, 1000 Sampletown    | +41 44 000 11 22 | contact@muesterlog.example  | corporate     | {"fleet_size": 80}        | Thu Nov 20 00:00:00 2025 PST
 3002 | Sample Autos Ltd     | Sample Autos | Example Street 12, 1000 Sampletown | +41 41 000 22 33 | contact@sampleautos.example | corporate     | {"fleet_size": 15}        | Thu Nov 20 00:00:00 2025 PST
(3 rows)

-- tire
INSERT INTO management.tire (production_date, tire_type, size_text, profile_mm_left, brand, pressure_psi, status, manufacturer_id)
VALUES ('2025-01-20',
        'summer',
        '225/45R17',
        8.0,
        'AlpineGrip',
        33.5,
        'mounted',
        (SELECT id FROM management.manufacturer WHERE name = 'Demo Wheels Ltd' LIMIT 1));
SELECT *
FROM management.tire;
  id  | production_date | tire_type | size_text | profile_mm_left |   brand    | pressure_psi | status  | manufacturer_id |  notes   |          created_at          
------+-----------------+-----------+-----------+-----------------+------------+--------------+---------+-----------------+----------+------------------------------
    1 | 06-15-2024      | summer    | 205/55R16 |             7.5 | GoodTyre   |        32.00 | stored  |               1 | Batch A1 | Mon Nov 24 00:00:00 2025 PST
 2001 | 11-01-2023      | winter    | 195/65R15 |             9.2 | SwissGrip  |        34.00 | mounted |            1001 |          | Mon Nov 24 00:00:00 2025 PST
 2002 | 01-20-2025      | summer    | 225/45R17 |             8.0 | AlpineGrip |        33.50 | mounted |            1002 |          | Mon Nov 24 00:00:00 2025 PST
(3 rows)

-- tire_set
INSERT INTO management.tire_set (car_id, front_left_tire_id, front_right_tire_id, rear_left_tire_id, rear_right_tire_id, set_status,
                                 storage_garage_id)
VALUES ((SELECT id FROM management.car WHERE vin = 'VF1RFB00456812345'),
        (SELECT id FROM management.tire WHERE brand = 'AlpineGrip' LIMIT 1),
        (SELECT id FROM management.tire WHERE brand = 'AlpineGrip' LIMIT 1),
        (SELECT id FROM management.tire WHERE brand = 'AlpineGrip' LIMIT 1),
        (SELECT id FROM management.tire WHERE brand = 'AlpineGrip' LIMIT 1),
        'stored',
        (SELECT garage_id FROM management.garage WHERE name = 'East Garage'));
SELECT *
FROM management.tire_set;
                car_id                | front_left_tire_id | front_right_tire_id | rear_left_tire_id | rear_right_tire_id | set_status | mounted_at | removed_at | storage_garage_id |    notes    
--------------------------------------+--------------------+---------------------+-------------------+--------------------+------------+------------+------------+-------------------+-------------
 00000000-0000-0000-0000-000000000001 |                  1 |                   1 |                 1 |                  1 | mounted    |            |            |                 1 | Initial set
 11111111-1111-1111-1111-111111111111 |               2001 |                2001 |              2001 |               2001 | stored     |            |            |              5001 | 
 22222222-2222-2222-2222-222222222222 |               2002 |                2002 |              2002 |               2002 | stored     |            |            |              5002 | 
(3 rows)

-- tire_set_log
INSERT INTO management.tire_set_log (front_left_tire_id, front_right_tire_id, rear_left_tire_id, rear_right_tire_id, log)
VALUES ((SELECT front_left_tire_id FROM management.tire_set WHERE set_status = 'stored' LIMIT 1),
        (SELECT front_right_tire_id FROM management.tire_set WHERE set_status = 'stored' LIMIT 1),
        (SELECT rear_left_tire_id FROM management.tire_set WHERE set_status = 'stored' LIMIT 1),
        (SELECT rear_right_tire_id FROM management.tire_set WHERE set_status = 'stored' LIMIT 1),
        'balanced read tires');
SELECT *
FROM management.tire_set_log;
 id | front_left_tire_id | front_right_tire_id | rear_left_tire_id | rear_right_tire_id |                                log                                 |          created_at          
----+--------------------+---------------------+-------------------+--------------------+--------------------------------------------------------------------+------------------------------
  1 |                  1 |                   1 |                 1 |                  1 | Intern accidentally punctured the left rear tire, we just glued it | Fri Nov 28 00:00:00 2025 PST
  2 |               2001 |                2001 |              2001 |               2001 | have one flat spot                                                 | Fri Nov 28 00:00:00 2025 PST
  3 |               2001 |                2001 |              2001 |               2001 | balanced read tires                                                | Fri Nov 28 00:00:00 2025 PST
(3 rows)

-- mechanic
INSERT INTO management.mechanic (garage_id, full_name, certifications, hire_date, skill_level, active)
VALUES ((SELECT garage_id FROM management.garage WHERE name = 'East Garage'),
        'Joe Bloggs',
        ARRAY ['ASE C1'],
        '2019-03-10',
        'mid',
        true);
SELECT *
FROM management.mechanic;
 mechanic_id | garage_id |  full_name   |      certifications       | hire_date  | skill_level | active |     notes     |          created_at          
-------------+-----------+--------------+---------------------------+------------+-------------+--------+---------------+------------------------------
           1 |         1 | John Doe     | {"ASE A1","EV Certified"} | 05-01-2018 | senior      | t      | Lead mechanic | Tue Nov 18 00:00:00 2025 PST
        7001 |      5001 | Erika Müster | {"ASE B2"}                | 09-15-2020 | mid         | t      |               | Tue Nov 18 00:00:00 2025 PST
        7002 |      5002 | Joe Bloggs   | {"ASE C1"}                | 03-10-2019 | mid         | t      |               | Tue Nov 18 00:00:00 2025 PST
(3 rows)

-- garage_mechanic
INSERT INTO management.garage_mechanic (garage_id, mechanic_id, shift_range, role)
VALUES ((SELECT garage_id FROM management.garage WHERE name = 'East Garage'),
        (SELECT mechanic_id FROM management.mechanic WHERE full_name = 'Joe Bloggs'),
        '[2025-11-03 08:00:00,2025-11-03 16:00:00)'::tsrange,
        'morning');
SELECT *
FROM management.garage_mechanic;
 garage_id | mechanic_id |                       shift_range                       |    role    |          created_at          
-----------+-------------+---------------------------------------------------------+------------+------------------------------
         1 |           1 | ["Sat Nov 01 08:00:00 2025","Sat Nov 01 16:00:00 2025") | shift_lead | Mon Nov 17 00:00:00 2025 PST
      5001 |        7001 | ["Sun Nov 02 08:00:00 2025","Sun Nov 02 16:00:00 2025") | morning    | Mon Nov 17 00:00:00 2025 PST
      5002 |        7002 | ["Mon Nov 03 08:00:00 2025","Mon Nov 03 16:00:00 2025") | morning    | Mon Nov 17 00:00:00 2025 PST
(3 rows)

-- inspection
INSERT INTO management.inspection (service_id, inspector_name, passed, issues_found)
VALUES ((SELECT service_id FROM management.service_record LIMIT 1 OFFSET 1),
        'Jane Roe',
        true,
        '[]'::jsonb);
SELECT *
FROM management.inspection;
  id  |              service_id              | inspector_name | passed |            issues_found            |         performed_at         
------+--------------------------------------+----------------+--------+------------------------------------+------------------------------
    1 | 00000000-0000-0000-0000-000000000002 | Richard Roe    | t      | []                                 | Tue Nov 18 00:00:00 2025 PST
 9001 | 22222222-2222-2222-2222-222222222222 | Mary Major     | f      | {"brakes": "worn", "lights": "ok"} | Tue Nov 18 00:00:00 2025 PST
 9002 | 22222222-2222-2222-2222-222222222222 | Jane Roe       | t      | []                                 | Tue Nov 18 00:00:00 2025 PST
(3 rows)

-- feature
INSERT INTO management.feature (name, description)
VALUES ('Parking Sensors', 'Front and rear parking sensors');
SELECT *
FROM management.feature;
 feature_id |      name       |          description           |          created_at          
------------+-----------------+--------------------------------+------------------------------
          1 | Heated Seats    | Seats with internal heating    | Fri Nov 14 00:00:00 2025 PST
       6001 | Sunroof         | Panoramic sunroof              | Fri Nov 14 00:00:00 2025 PST
       6002 | Parking Sensors | Front and rear parking sensors | Fri Nov 14 00:00:00 2025 PST
(3 rows)

-- car_feature
INSERT INTO management.car_feature (car_id, feature_id, installed_at, installed_by, notes)
VALUES ((SELECT id FROM management.car WHERE vin = 'VF1RFB00456812345'),
        (SELECT feature_id FROM management.feature WHERE name = 'Parking Sensors'),
        Date('2025-11-10')::timestamptz,
        (SELECT mechanic_id FROM management.mechanic WHERE full_name = 'Joe Bloggs'),
        'Optional install');
SELECT *
FROM management.car_feature;
  id   |                car_id                | feature_id |         installed_at         | removed_at | installed_by |         notes         
-------+--------------------------------------+------------+------------------------------+------------+--------------+-----------------------
     1 | 00000000-0000-0000-0000-000000000001 |          1 | Mon Nov 10 00:00:00 2025 PST |            |            1 | Installed at purchase
 70001 | 11111111-1111-1111-1111-111111111111 |       6001 | Sun Nov 10 00:00:00 2024 PST |            |         7001 | 
 70002 | 22222222-2222-2222-2222-222222222222 |       6002 | Mon Nov 10 00:00:00 2025 PST |            |         7002 | Optional install
(3 rows)

-- telematics_snapshot
INSERT INTO telematic.telematics_snapshot (car_id, snapshot_ts, dtc_codes, telematics, speed_range, gps, engine_state)
VALUES ((SELECT id FROM management.car WHERE vin = 'VF1RFB00456812345'),
        Date('2025-11-10')::timestamptz,
        ARRAY []::text[],
        '{
            "battery": 85,
            "temp_c": 18
        }'::jsonb,
        '[0,110]'::int4range,
        '{
            "lat": 46.9481,
            "lon": 7.4474
        }'::jsonb,
        'ok');
SELECT *
FROM telematic.telematics_snapshot;
  id   |                car_id                |         snapshot_ts          | dtc_codes |          telematics           | speed_range |                 gps                 | engine_state 
-------+--------------------------------------+------------------------------+-----------+-------------------------------+-------------+-------------------------------------+--------------
     1 | 00000000-0000-0000-0000-000000000001 | Mon Nov 10 00:00:00 2025 PST | {}        | {"temp_c": 22, "battery": 98} | [0,121)     | {"lat": 47.376887, "lon": 8.541694} | ok
 10001 | 11111111-1111-1111-1111-111111111111 | Sun Nov 09 00:00:00 2025 PST | {P0420}   | {"temp_c": 15, "battery": 75} | [10,91)     | {"lat": 46.204391, "lon": 6.143157} | warning
 10002 | 22222222-2222-2222-2222-222222222222 | Mon Nov 10 00:00:00 2025 PST | {}        | {"temp_c": 18, "battery": 85} | [0,111)     | {"lat": 46.9481, "lon": 7.4474}     | ok
(3 rows)

-- maintenance_ticket
INSERT INTO management.maintenance_ticket (service_id, reported_by, description, status)
VALUES ((SELECT service_id FROM management.service_record LIMIT 1 OFFSET 1),
        (SELECT id FROM management.owner WHERE legal_name = 'Sample Autos Ltd'),
        'Strange noise from front tires',
        'open');
SELECT *
FROM management.maintenance_ticket;
 custom_name_id |              service_id              | reported_by |               description                | status |          created_at          
----------------+--------------------------------------+-------------+------------------------------------------+--------+------------------------------
              1 | 00000000-0000-0000-0000-000000000002 |           1 | Customer reports vibration at high speed | open   | Tue Nov 11 00:00:00 2025 PST
          90001 | 22222222-2222-2222-2222-222222222222 |        3001 | Brake squeal on cold mornings            | open   | Tue Nov 11 00:00:00 2025 PST
          90002 | 22222222-2222-2222-2222-222222222222 |        3002 | Strange noise from front tires           | open   | Tue Nov 11 00:00:00 2025 PST
(3 rows)

-- =========================================================
-- STEP 5: Insert with DUPLICATE PK for every table - should throw error
-- =========================================================
-- manufacturer (duplicate PK 1001)
INSERT INTO management.manufacturer (id, name, location, founded_year, details)
VALUES (1001,
        'Duplicate Wheels',
        ST_SetSRID(ST_Point(8, 47), 4326),
        2000,
        '{
            "notes": "duplicate"
        }'::jsonb);
ERROR:  duplicate key value violates unique constraint "manufacturer_pkey" for table management.manufacturer: (id = 1001)
CONTEXT:  PL/pgSQL function _vie_trigger.check_for_duplicate_constraint(text,text,text,text[],record,record) line 51 at RAISE
SQL statement "SELECT _vie_trigger.check_for_duplicate_constraint(
                    v_view_schema,
                    v_view_name,
                    l_constraint.constraint_name,
                    l_constraint.constraint_columns,
                    NEW,
                    OLD
                    )"
PL/pgSQL function _vie_trigger.generic_dml_trigger() line 70 at PERFORM
-- garage (duplicate PK 5001)
INSERT INTO management.garage (garage_id, parent_garage_id, name, location, services_offered, opening_hours, rating)
VALUES (5001,
        NULL,
        'Duplicate Garage',
        ST_SetSRID(ST_Point(8, 47), 2056),
        ARRAY ['inspection'],
        '{
            "mon-fri": "08:00-17:00"
        }'::jsonb,
        3.5);
ERROR:  duplicate key value violates unique constraint "garage_pkey" for table management.garage: (garage_id = 5001)
CONTEXT:  PL/pgSQL function _vie_trigger.check_for_duplicate_constraint(text,text,text,text[],record,record) line 51 at RAISE
SQL statement "SELECT _vie_trigger.check_for_duplicate_constraint(
                    v_view_schema,
                    v_view_name,
                    l_constraint.constraint_name,
                    l_constraint.constraint_columns,
                    NEW,
                    OLD
                    )"
PL/pgSQL function _vie_trigger.generic_dml_trigger() line 70 at PERFORM
-- owner (duplicate PK 3001)
INSERT INTO management.owner (id, legal_name, display_name, address, phone, email, customer_type, metadata)
VALUES (3001,
        'Duplicate Owner',
        'DupOwner',
        'Test Street 1',
        '+41 000 000 00',
        'dup@example.com',
        'private',
        '{
            "note": "duplicate"
        }'::jsonb);
ERROR:  duplicate key value violates unique constraint "owner_pkey" for table management.owner: (id = 3001)
CONTEXT:  PL/pgSQL function _vie_trigger.check_for_duplicate_constraint(text,text,text,text[],record,record) line 51 at RAISE
SQL statement "SELECT _vie_trigger.check_for_duplicate_constraint(
                    v_view_schema,
                    v_view_name,
                    l_constraint.constraint_name,
                    l_constraint.constraint_columns,
                    NEW,
                    OLD
                    )"
PL/pgSQL function _vie_trigger.generic_dml_trigger() line 70 at PERFORM
-- tire (duplicate PK 2001)
INSERT INTO management.tire (id, production_date, tire_type, size_text, profile_mm_left, brand, pressure_psi, status, manufacturer_id)
VALUES (2001,
        '2025-01-01',
        'winter',
        '205/50R17',
        7.0,
        'DuplicateTire',
        31.0,
        'stored',
        1001);
ERROR:  duplicate key value violates unique constraint "tire_pkey" for table management.tire: (id = 2001)
CONTEXT:  PL/pgSQL function _vie_trigger.check_for_duplicate_constraint(text,text,text,text[],record,record) line 51 at RAISE
SQL statement "SELECT _vie_trigger.check_for_duplicate_constraint(
                    v_view_schema,
                    v_view_name,
                    l_constraint.constraint_name,
                    l_constraint.constraint_columns,
                    NEW,
                    OLD
                    )"
PL/pgSQL function _vie_trigger.generic_dml_trigger() line 70 at PERFORM
-- car (duplicate PK uuid '11111111-1111-1111-1111-111111111111')
INSERT INTO management.car (id, vin, manufacturer_id, model, model_trim, year, mileage_km, fuel_type, tags, options)
VALUES ('11111111-1111-1111-1111-111111111111'::uuid,
        'DUPVIN0000001',
        1001,
        'Duplicate Car',
        'Trim1',
        2022,
        1000,
        'electric',
        ARRAY ['test'],
        '{
            "color": "white"
        }'::jsonb);
ERROR:  duplicate key value violates unique constraint "car_pkey" for table management.car: (id = 11111111-1111-1111-1111-111111111111)
CONTEXT:  PL/pgSQL function _vie_trigger.check_for_duplicate_constraint(text,text,text,text[],record,record) line 51 at RAISE
SQL statement "SELECT _vie_trigger.check_for_duplicate_constraint(
                    v_view_schema,
                    v_view_name,
                    l_constraint.constraint_name,
                    l_constraint.constraint_columns,
                    NEW,
                    OLD
                    )"
PL/pgSQL function _vie_trigger.generic_dml_trigger() line 70 at PERFORM
-- tire_set (duplicate PK 2001)
INSERT INTO management.tire_set (car_id, front_left_tire_id, front_right_tire_id, rear_left_tire_id, rear_right_tire_id, set_status,
                                 storage_garage_id)
VALUES ('11111111-1111-1111-1111-111111111111'::uuid,
        2001, 2001, 2001, 2001,
        'stored',
        5001);
ERROR:  duplicate key value violates unique constraint "tire_set_pkey" for table management.tire_set: (front_left_tire_id = 2001, front_right_tire_id = 2001, rear_left_tire_id = 2001, rear_right_tire_id = 2001)
CONTEXT:  PL/pgSQL function _vie_trigger.check_for_duplicate_constraint(text,text,text,text[],record,record) line 51 at RAISE
SQL statement "SELECT _vie_trigger.check_for_duplicate_constraint(
                    v_view_schema,
                    v_view_name,
                    l_constraint.constraint_name,
                    l_constraint.constraint_columns,
                    NEW,
                    OLD
                    )"
PL/pgSQL function _vie_trigger.generic_dml_trigger() line 70 at PERFORM
-- mechanic (duplicate PK 7001)
INSERT INTO management.mechanic (mechanic_id, garage_id, full_name, certifications, hire_date, skill_level, active)
VALUES (7001,
        5001,
        'Duplicate Mechanic',
        ARRAY ['ASE D1'],
        '2021-01-01',
        'junior',
        true);
ERROR:  duplicate key value violates unique constraint "mechanic_pkey" for table management.mechanic: (mechanic_id = 7001)
CONTEXT:  PL/pgSQL function _vie_trigger.check_for_duplicate_constraint(text,text,text,text[],record,record) line 51 at RAISE
SQL statement "SELECT _vie_trigger.check_for_duplicate_constraint(
                    v_view_schema,
                    v_view_name,
                    l_constraint.constraint_name,
                    l_constraint.constraint_columns,
                    NEW,
                    OLD
                    )"
PL/pgSQL function _vie_trigger.generic_dml_trigger() line 70 at PERFORM
-- garage_mechanic (duplicate PK 5001, 7001)
INSERT INTO management.garage_mechanic (garage_id, mechanic_id, shift_range, role)
VALUES (5001,
        7001,
        '[2025-11-04 08:00:00,2025-11-04 16:00:00)'::tsrange,
        'afternoon');
ERROR:  duplicate key value violates unique constraint "garage_mechanic_pkey" for table management.garage_mechanic: (garage_id = 5001, mechanic_id = 7001)
CONTEXT:  PL/pgSQL function _vie_trigger.check_for_duplicate_constraint(text,text,text,text[],record,record) line 51 at RAISE
SQL statement "SELECT _vie_trigger.check_for_duplicate_constraint(
                    v_view_schema,
                    v_view_name,
                    l_constraint.constraint_name,
                    l_constraint.constraint_columns,
                    NEW,
                    OLD
                    )"
PL/pgSQL function _vie_trigger.generic_dml_trigger() line 70 at PERFORM
-- service_record (duplicate PK '22222222-2222-2222-2222-222222222222')
INSERT INTO management.service_record (service_id, car_id, mechanic_id, garage_id, tire_id, service_type, cost, notes)
VALUES ('22222222-2222-2222-2222-222222222222'::uuid,
        '11111111-1111-1111-1111-111111111111'::uuid,
        7001,
        5001,
        2001,
        'repair',
        999.99,
        'Duplicate entry');
ERROR:  duplicate key value violates unique constraint "service_record_pkey" for table management.service_record: (service_id = 22222222-2222-2222-2222-222222222222)
CONTEXT:  PL/pgSQL function _vie_trigger.check_for_duplicate_constraint(text,text,text,text[],record,record) line 51 at RAISE
SQL statement "SELECT _vie_trigger.check_for_duplicate_constraint(
                    v_view_schema,
                    v_view_name,
                    l_constraint.constraint_name,
                    l_constraint.constraint_columns,
                    NEW,
                    OLD
                    )"
PL/pgSQL function _vie_trigger.generic_dml_trigger() line 70 at PERFORM
-- inspection (duplicate PK 9001)
INSERT INTO management.inspection (id, service_id, inspector_name, passed, issues_found)
VALUES (9001,
        '22222222-2222-2222-2222-222222222222'::uuid,
        'Duplicate Inspector',
        true,
        '[]'::jsonb);
ERROR:  duplicate key value violates unique constraint "inspection_pkey" for table management.inspection: (id = 9001)
CONTEXT:  PL/pgSQL function _vie_trigger.check_for_duplicate_constraint(text,text,text,text[],record,record) line 51 at RAISE
SQL statement "SELECT _vie_trigger.check_for_duplicate_constraint(
                    v_view_schema,
                    v_view_name,
                    l_constraint.constraint_name,
                    l_constraint.constraint_columns,
                    NEW,
                    OLD
                    )"
PL/pgSQL function _vie_trigger.generic_dml_trigger() line 70 at PERFORM
-- feature (duplicate PK 6001)
INSERT INTO management.feature (feature_id, name, description)
VALUES (6001, 'Duplicate Feature', 'Test duplicate feature');
ERROR:  duplicate key value violates unique constraint "feature_pkey" for table management.feature: (feature_id = 6001)
CONTEXT:  PL/pgSQL function _vie_trigger.check_for_duplicate_constraint(text,text,text,text[],record,record) line 51 at RAISE
SQL statement "SELECT _vie_trigger.check_for_duplicate_constraint(
                    v_view_schema,
                    v_view_name,
                    l_constraint.constraint_name,
                    l_constraint.constraint_columns,
                    NEW,
                    OLD
                    )"
PL/pgSQL function _vie_trigger.generic_dml_trigger() line 70 at PERFORM
-- car_feature (duplicate PK 70001)
INSERT INTO management.car_feature (id, car_id, feature_id, installed_at, installed_by)
VALUES (70001,
        '11111111-1111-1111-1111-111111111111'::uuid,
        6001,
        Date('2025-11-10')::timestamptz,
        7001);
ERROR:  duplicate key value violates unique constraint "car_feature_pkey" for table management.car_feature: (id = 70001)
CONTEXT:  PL/pgSQL function _vie_trigger.check_for_duplicate_constraint(text,text,text,text[],record,record) line 51 at RAISE
SQL statement "SELECT _vie_trigger.check_for_duplicate_constraint(
                    v_view_schema,
                    v_view_name,
                    l_constraint.constraint_name,
                    l_constraint.constraint_columns,
                    NEW,
                    OLD
                    )"
PL/pgSQL function _vie_trigger.generic_dml_trigger() line 70 at PERFORM
-- telematics_snapshot (duplicate PK 10001)
INSERT INTO telematic.telematics_snapshot (id, car_id, snapshot_ts, dtc_codes, telematics, speed_range, gps, engine_state)
VALUES (10001,
        '11111111-1111-1111-1111-111111111111'::uuid,
        Date('2025-11-10')::timestamptz,
        ARRAY ['P0001'],
        '{
            "battery": 50
        }'::jsonb,
        '[0,100]'::int4range,
        '{
            "lat": 46.0,
            "lon": 7.0
        }'::jsonb,
        'ok');
ERROR:  duplicate key value violates unique constraint "telematics_snapshot_pkey" for table telematic.telematics_snapshot: (id = 10001)
CONTEXT:  PL/pgSQL function _vie_trigger.check_for_duplicate_constraint(text,text,text,text[],record,record) line 51 at RAISE
SQL statement "SELECT _vie_trigger.check_for_duplicate_constraint(
                    v_view_schema,
                    v_view_name,
                    l_constraint.constraint_name,
                    l_constraint.constraint_columns,
                    NEW,
                    OLD
                    )"
PL/pgSQL function _vie_trigger.generic_dml_trigger() line 70 at PERFORM
-- maintenance_ticket (duplicate PK 90001)
INSERT INTO management.maintenance_ticket (custom_name_id, service_id, reported_by, description, status)
VALUES (90001,
        '22222222-2222-2222-2222-222222222222'::uuid,
        3001,
        'Duplicate ticket',
        'open');
ERROR:  duplicate key value violates unique constraint "maintenance_ticket_pkey" for table management.maintenance_ticket: (custom_name_id = 90001)
CONTEXT:  PL/pgSQL function _vie_trigger.check_for_duplicate_constraint(text,text,text,text[],record,record) line 51 at RAISE
SQL statement "SELECT _vie_trigger.check_for_duplicate_constraint(
                    v_view_schema,
                    v_view_name,
                    l_constraint.constraint_name,
                    l_constraint.constraint_columns,
                    NEW,
                    OLD
                    )"
PL/pgSQL function _vie_trigger.generic_dml_trigger() line 70 at PERFORM
-- =========================================================
-- STEP 6: Multiple inserts WITHOUT PK for every table
-- =========================================================
SELECT set_commit_author('alice@example.com');
 set_commit_author 
-------------------
 
(1 row)

-- manufacturer
INSERT INTO management.manufacturer (name, location, founded_year, details)
VALUES ('Placeholder Wheels Ltd', ST_SetSRID(ST_Point(8.6, 47.0), 4326), 1990, '{
    "notes": "importer"
}'::jsonb),
       ('TireMasters', ST_SetSRID(ST_Point(8.55, 47.01), 4326), 1985, '{
           "notes": "premium"
       }'::jsonb);
SELECT *
FROM management.manufacturer;
  id  |          name          |                      location                      | founded_year |                                  details                                  |          created_at          
------+------------------------+----------------------------------------------------+--------------+---------------------------------------------------------------------------+------------------------------
    1 | Example Tyres Ltd      | 0101000020E61000005E707ADB28C11D40DA7C8C14BD794740 |         1958 | {"notes": "HQ in Switzerland", "website": "https://exampletyres.example"} | Sun Nov 23 00:00:00 2025 PST
 1001 | Sample Wheels Ltd      | 0101000020E6100000FCE07CEA58152140CFA44DD53DB04740 |         1975 | {"special": "high performance"}                                           | Sun Nov 23 00:00:00 2025 PST
 1002 | Demo Wheels Ltd        | 0101000020E6100000EEEBC03923CA1D4036AB3E575B794740 |         1982 | {"special": "off-road", "website": "https://demowheels.example"}          | Sun Nov 23 00:00:00 2025 PST
 1003 | Placeholder Wheels Ltd | 0101000020E610000033333333333321400000000000804740 |         1990 | {"notes": "importer"}                                                     | Sun Nov 23 00:00:00 2025 PST
 1004 | TireMasters            | 0101000020E61000009A99999999192140E17A14AE47814740 |         1985 | {"notes": "premium"}                                                      | Sun Nov 23 00:00:00 2025 PST
(5 rows)

-- garage
INSERT INTO management.garage (parent_garage_id, name, location, services_offered, opening_hours, rating)
VALUES (NULL, 'West Garage', ST_SetSRID(ST_Point(6.64, 46.52), 2056), ARRAY ['inspection','tyre_change'], '{
    "mon-fri": "08-18"
}'::jsonb, 4.0),
       (NULL, 'St. Gallen Garage', ST_SetSRID(ST_Point(9.37, 47.42), 2056), ARRAY ['maintenance','inspection'], '{
           "mon-fri": "07-17"
       }'::jsonb, 4.3);
SELECT *
FROM management.garage;
 garage_id | parent_garage_id |       name        |                      location                      |           services_offered           |                  opening_hours                   | rating |          created_at          
-----------+------------------+-------------------+----------------------------------------------------+--------------------------------------+--------------------------------------------------+--------+------------------------------
         1 |                  | Central Garage    | 0101000020080800000000000020D6434100000000804F3241 | {tyre_change,inspection,maintenance} | {"sat": "09:00-14:00", "mon-fri": "08:00-18:00"} |   4.60 | Sat Nov 22 00:00:00 2025 PST
      5001 |                  | North Garage      | 0101000020080800008CD7BCAAB35A1E40197442E8A0C74740 | {inspection,repair}                  | {"mon-fri": "07:00-17:00"}                       |   4.20 | Sat Nov 22 00:00:00 2025 PST
      5002 |                  | East Garage       | 0101000020080800001EC6A4BF97921840624CFA7B291A4740 | {tyre_change,inspection}             | {"mon-fri": "08:00-18:00"}                       |   4.10 | Sat Nov 22 00:00:00 2025 PST
      5003 |                  | West Garage       | 0101000020080800008FC2F5285C8F1A40C3F5285C8F424740 | {inspection,tyre_change}             | {"mon-fri": "08-18"}                             |   4.00 | Sat Nov 22 00:00:00 2025 PST
      5004 |                  | St. Gallen Garage | 0101000020080800003D0AD7A370BD2240F6285C8FC2B54740 | {maintenance,inspection}             | {"mon-fri": "07-17"}                             |   4.30 | Sat Nov 22 00:00:00 2025 PST
(5 rows)

-- owner
INSERT INTO management.owner (legal_name, display_name, address, phone, email, customer_type, metadata)
VALUES ('Example Corp A', 'Hug', 'Industrial Str. 1', '+41 41 123 45 67', 'corp-a@example.com', 'corporate', '{}'::jsonb),
       ('Example Corp B', 'Meyer', 'Main Str. 12', '+41 44 765 43 21', 'corp-b@example.com', 'corporate', '{}'::jsonb);
SELECT *
FROM management.owner;
  id  |      legal_name      | display_name |              address               |      phone       |            email            | customer_type |         metadata          |          created_at          
------+----------------------+--------------+------------------------------------+------------------+-----------------------------+---------------+---------------------------+------------------------------
    1 | Max Muster           | M. Muster    | Example Street 1, 1000 Sampletown  | +41 44 000 00 01 | max.muster@example.com      | private       | {"notes": "VIP customer"} | Thu Nov 20 00:00:00 2025 PST
 3001 | Müster Logistics Ltd | MüsterLog    | Example Park 5, 1000 Sampletown    | +41 44 000 11 22 | contact@muesterlog.example  | corporate     | {"fleet_size": 80}        | Thu Nov 20 00:00:00 2025 PST
 3002 | Sample Autos Ltd     | Sample Autos | Example Street 12, 1000 Sampletown | +41 41 000 22 33 | contact@sampleautos.example | corporate     | {"fleet_size": 15}        | Thu Nov 20 00:00:00 2025 PST
 3003 | Example Corp A       | Hug          | Industrial Str. 1                  | +41 41 123 45 67 | corp-a@example.com          | corporate     | {}                        | Thu Nov 20 00:00:00 2025 PST
 3004 | Example Corp B       | Meyer        | Main Str. 12                       | +41 44 765 43 21 | corp-b@example.com          | corporate     | {}                        | Thu Nov 20 00:00:00 2025 PST
(5 rows)

-- tire
INSERT INTO management.tire (production_date, tire_type, size_text, profile_mm_left, brand, pressure_psi, status, manufacturer_id)
VALUES ('2025-03-10', 'summer', '205/55R16', 7.5, 'WheelPro', 32.0, 'mounted', (SELECT id FROM management.manufacturer WHERE name = 'Placeholder Wheels Ltd')),
       ('2025-03-11', 'winter', '195/65R15', 8.0, 'TireMasters', 34.0, 'stored', (SELECT id FROM management.manufacturer WHERE name = 'TireMasters'));
SELECT *
FROM management.tire;
  id  | production_date | tire_type | size_text | profile_mm_left |    brand    | pressure_psi | status  | manufacturer_id |  notes   |          created_at          
------+-----------------+-----------+-----------+-----------------+-------------+--------------+---------+-----------------+----------+------------------------------
    1 | 06-15-2024      | summer    | 205/55R16 |             7.5 | GoodTyre    |        32.00 | stored  |               1 | Batch A1 | Mon Nov 24 00:00:00 2025 PST
 2001 | 11-01-2023      | winter    | 195/65R15 |             9.2 | SwissGrip   |        34.00 | mounted |            1001 |          | Mon Nov 24 00:00:00 2025 PST
 2002 | 01-20-2025      | summer    | 225/45R17 |             8.0 | AlpineGrip  |        33.50 | mounted |            1002 |          | Mon Nov 24 00:00:00 2025 PST
 2003 | 03-10-2025      | summer    | 205/55R16 |             7.5 | WheelPro    |        32.00 | mounted |            1003 |          | Mon Nov 24 00:00:00 2025 PST
 2004 | 03-11-2025      | winter    | 195/65R15 |             8.0 | TireMasters |        34.00 | stored  |            1004 |          | Mon Nov 24 00:00:00 2025 PST
(5 rows)

-- tire_set
INSERT INTO management.tire_set (car_id, front_left_tire_id, front_right_tire_id, rear_left_tire_id, rear_right_tire_id, set_status,
                                 storage_garage_id)
VALUES ((SELECT id FROM management.car WHERE vin = 'VF1TEST000001'), (SELECT id FROM management.tire WHERE brand = 'WheelPro' LIMIT 1),
        (SELECT id FROM management.tire WHERE brand = 'WheelPro' LIMIT 1), (SELECT id FROM management.tire WHERE brand = 'WheelPro' LIMIT 1),
        (SELECT id FROM management.tire WHERE brand = 'WheelPro' LIMIT 1), 'mounted',
        (SELECT garage_id FROM management.garage WHERE name = 'West Garage')),
       ((SELECT id FROM management.car WHERE vin = 'VF1TEST000002'), (SELECT id FROM management.tire WHERE brand = 'TireMasters' LIMIT 1),
        (SELECT id FROM management.tire WHERE brand = 'TireMasters' LIMIT 1), (SELECT id FROM management.tire WHERE brand = 'TireMasters' LIMIT 1),
        (SELECT id FROM management.tire WHERE brand = 'TireMasters' LIMIT 1), 'stored',
        (SELECT garage_id FROM management.garage WHERE name = 'St. Gallen Garage'));
SELECT *
FROM management.tire_set;
                car_id                | front_left_tire_id | front_right_tire_id | rear_left_tire_id | rear_right_tire_id | set_status | mounted_at | removed_at | storage_garage_id |    notes    
--------------------------------------+--------------------+---------------------+-------------------+--------------------+------------+------------+------------+-------------------+-------------
 00000000-0000-0000-0000-000000000001 |                  1 |                   1 |                 1 |                  1 | mounted    |            |            |                 1 | Initial set
 11111111-1111-1111-1111-111111111111 |               2001 |                2001 |              2001 |               2001 | stored     |            |            |              5001 | 
 22222222-2222-2222-2222-222222222222 |               2002 |                2002 |              2002 |               2002 | stored     |            |            |              5002 | 
                                      |               2003 |                2003 |              2003 |               2003 | mounted    |            |            |              5003 | 
                                      |               2004 |                2004 |              2004 |               2004 | stored     |            |            |              5004 | 
(5 rows)

-- tire_set_log
INSERT INTO management.tire_set_log (front_left_tire_id, front_right_tire_id, rear_left_tire_id, rear_right_tire_id, log)
VALUES ((SELECT id FROM management.tire WHERE brand = 'WheelPro' LIMIT 1),
        (SELECT id FROM management.tire WHERE brand = 'WheelPro' LIMIT 1),
        (SELECT id FROM management.tire WHERE brand = 'WheelPro' LIMIT 1),
        (SELECT id FROM management.tire WHERE brand = 'WheelPro' LIMIT 1),
        'Tires rotated and balanced'),
       ((SELECT id FROM management.tire WHERE brand = 'TireMasters' LIMIT 1),
        (SELECT id FROM management.tire WHERE brand = 'TireMasters' LIMIT 1),
        (SELECT id FROM management.tire WHERE brand = 'TireMasters' LIMIT 1),
        (SELECT id FROM management.tire WHERE brand = 'TireMasters' LIMIT 1),
        'Stored for summer season');
SELECT *
FROM management.tire_set_log;
 id | front_left_tire_id | front_right_tire_id | rear_left_tire_id | rear_right_tire_id |                                log                                 |          created_at          
----+--------------------+---------------------+-------------------+--------------------+--------------------------------------------------------------------+------------------------------
  1 |                  1 |                   1 |                 1 |                  1 | Intern accidentally punctured the left rear tire, we just glued it | Fri Nov 28 00:00:00 2025 PST
  2 |               2001 |                2001 |              2001 |               2001 | have one flat spot                                                 | Fri Nov 28 00:00:00 2025 PST
  3 |               2001 |                2001 |              2001 |               2001 | balanced read tires                                                | Fri Nov 28 00:00:00 2025 PST
  4 |               2003 |                2003 |              2003 |               2003 | Tires rotated and balanced                                         | Fri Nov 28 00:00:00 2025 PST
  5 |               2004 |                2004 |              2004 |               2004 | Stored for summer season                                           | Fri Nov 28 00:00:00 2025 PST
(5 rows)

-- mechanic
INSERT INTO management.mechanic (garage_id, full_name, certifications, hire_date, skill_level, active)
VALUES ((SELECT garage_id FROM management.garage WHERE name = 'West Garage'), 'Fred Nurk', ARRAY ['ASE B1'], '2022-01-01', 'junior', true),
       ((SELECT garage_id FROM management.garage WHERE name = 'St. Gallen Garage'), 'Erika Mustermann', ARRAY ['ASE A2'], '2021-06-15', 'mid', true);
SELECT *
FROM management.mechanic;
 mechanic_id | garage_id |    full_name     |      certifications       | hire_date  | skill_level | active |     notes     |          created_at          
-------------+-----------+------------------+---------------------------+------------+-------------+--------+---------------+------------------------------
           1 |         1 | John Doe         | {"ASE A1","EV Certified"} | 05-01-2018 | senior      | t      | Lead mechanic | Tue Nov 18 00:00:00 2025 PST
        7001 |      5001 | Erika Müster     | {"ASE B2"}                | 09-15-2020 | mid         | t      |               | Tue Nov 18 00:00:00 2025 PST
        7002 |      5002 | Joe Bloggs       | {"ASE C1"}                | 03-10-2019 | mid         | t      |               | Tue Nov 18 00:00:00 2025 PST
        7003 |      5003 | Fred Nurk        | {"ASE B1"}                | 01-01-2022 | junior      | t      |               | Tue Nov 18 00:00:00 2025 PST
        7004 |      5004 | Erika Mustermann | {"ASE A2"}                | 06-15-2021 | mid         | t      |               | Tue Nov 18 00:00:00 2025 PST
(5 rows)

-- =========================================================
-- STEP 7: Updates every table
-- =========================================================
SELECT set_commit_author('bob@example.com');
 set_commit_author 
-------------------
 
(1 row)

-- Update manufacturer
UPDATE management.manufacturer
SET founded_year = founded_year + 1
WHERE name = 'Example Tyres Ltd';
SELECT *
FROM management.manufacturer;
  id  |          name          |                      location                      | founded_year |                                  details                                  |          created_at          
------+------------------------+----------------------------------------------------+--------------+---------------------------------------------------------------------------+------------------------------
 1001 | Sample Wheels Ltd      | 0101000020E6100000FCE07CEA58152140CFA44DD53DB04740 |         1975 | {"special": "high performance"}                                           | Sun Nov 23 00:00:00 2025 PST
 1002 | Demo Wheels Ltd        | 0101000020E6100000EEEBC03923CA1D4036AB3E575B794740 |         1982 | {"special": "off-road", "website": "https://demowheels.example"}          | Sun Nov 23 00:00:00 2025 PST
 1003 | Placeholder Wheels Ltd | 0101000020E610000033333333333321400000000000804740 |         1990 | {"notes": "importer"}                                                     | Sun Nov 23 00:00:00 2025 PST
 1004 | TireMasters            | 0101000020E61000009A99999999192140E17A14AE47814740 |         1985 | {"notes": "premium"}                                                      | Sun Nov 23 00:00:00 2025 PST
    1 | Example Tyres Ltd      | 0101000020E61000005E707ADB28C11D40DA7C8C14BD794740 |         1959 | {"notes": "HQ in Switzerland", "website": "https://exampletyres.example"} | Sun Nov 23 00:00:00 2025 PST
(5 rows)

-- Update garage
UPDATE management.garage
SET rating = 4.8
WHERE name = 'Central Garage';
SELECT *
FROM management.garage;
 garage_id | parent_garage_id |       name        |                      location                      |           services_offered           |                  opening_hours                   | rating |          created_at          
-----------+------------------+-------------------+----------------------------------------------------+--------------------------------------+--------------------------------------------------+--------+------------------------------
      5001 |                  | North Garage      | 0101000020080800008CD7BCAAB35A1E40197442E8A0C74740 | {inspection,repair}                  | {"mon-fri": "07:00-17:00"}                       |   4.20 | Sat Nov 22 00:00:00 2025 PST
      5002 |                  | East Garage       | 0101000020080800001EC6A4BF97921840624CFA7B291A4740 | {tyre_change,inspection}             | {"mon-fri": "08:00-18:00"}                       |   4.10 | Sat Nov 22 00:00:00 2025 PST
      5003 |                  | West Garage       | 0101000020080800008FC2F5285C8F1A40C3F5285C8F424740 | {inspection,tyre_change}             | {"mon-fri": "08-18"}                             |   4.00 | Sat Nov 22 00:00:00 2025 PST
      5004 |                  | St. Gallen Garage | 0101000020080800003D0AD7A370BD2240F6285C8FC2B54740 | {maintenance,inspection}             | {"mon-fri": "07-17"}                             |   4.30 | Sat Nov 22 00:00:00 2025 PST
         1 |                  | Central Garage    | 0101000020080800000000000020D6434100000000804F3241 | {tyre_change,inspection,maintenance} | {"sat": "09:00-14:00", "mon-fri": "08:00-18:00"} |   4.80 | Sat Nov 22 00:00:00 2025 PST
(5 rows)

-- Update owner
UPDATE management.owner
SET phone = '+41 44 999 99 99'
WHERE legal_name = 'Max Muster';
SELECT *
FROM management.owner;
  id  |      legal_name      | display_name |              address               |      phone       |            email            | customer_type |         metadata          |          created_at          
------+----------------------+--------------+------------------------------------+------------------+-----------------------------+---------------+---------------------------+------------------------------
 3001 | Müster Logistics Ltd | MüsterLog    | Example Park 5, 1000 Sampletown    | +41 44 000 11 22 | contact@muesterlog.example  | corporate     | {"fleet_size": 80}        | Thu Nov 20 00:00:00 2025 PST
 3002 | Sample Autos Ltd     | Sample Autos | Example Street 12, 1000 Sampletown | +41 41 000 22 33 | contact@sampleautos.example | corporate     | {"fleet_size": 15}        | Thu Nov 20 00:00:00 2025 PST
 3003 | Example Corp A       | Hug          | Industrial Str. 1                  | +41 41 123 45 67 | corp-a@example.com          | corporate     | {}                        | Thu Nov 20 00:00:00 2025 PST
 3004 | Example Corp B       | Meyer        | Main Str. 12                       | +41 44 765 43 21 | corp-b@example.com          | corporate     | {}                        | Thu Nov 20 00:00:00 2025 PST
    1 | Max Muster           | M. Muster    | Example Street 1, 1000 Sampletown  | +41 44 999 99 99 | max.muster@example.com      | private       | {"notes": "VIP customer"} | Thu Nov 20 00:00:00 2025 PST
(5 rows)

-- Update tire
UPDATE management.tire
SET profile_mm_left = profile_mm_left - 0.5
WHERE brand = 'GoodTyre';
SELECT *
FROM management.tire;
  id  | production_date | tire_type | size_text | profile_mm_left |    brand    | pressure_psi | status  | manufacturer_id |  notes   |          created_at          
------+-----------------+-----------+-----------+-----------------+-------------+--------------+---------+-----------------+----------+------------------------------
 2001 | 11-01-2023      | winter    | 195/65R15 |             9.2 | SwissGrip   |        34.00 | mounted |            1001 |          | Mon Nov 24 00:00:00 2025 PST
 2002 | 01-20-2025      | summer    | 225/45R17 |             8.0 | AlpineGrip  |        33.50 | mounted |            1002 |          | Mon Nov 24 00:00:00 2025 PST
 2003 | 03-10-2025      | summer    | 205/55R16 |             7.5 | WheelPro    |        32.00 | mounted |            1003 |          | Mon Nov 24 00:00:00 2025 PST
 2004 | 03-11-2025      | winter    | 195/65R15 |             8.0 | TireMasters |        34.00 | stored  |            1004 |          | Mon Nov 24 00:00:00 2025 PST
    1 | 06-15-2024      | summer    | 205/55R16 |             7.0 | GoodTyre    |        32.00 | stored  |               1 | Batch A1 | Mon Nov 24 00:00:00 2025 PST
(5 rows)

-- Update car
UPDATE management.car
SET mileage_km = mileage_km + 150
WHERE vin = 'WDB1234561A654321';
SELECT *
FROM management.car;
                  id                  |        vin        | manufacturer_id |  model  | model_trim | year | mileage_km | fuel_type |      tags       |             options             |          created_at          
--------------------------------------+-------------------+-----------------+---------+------------+------+------------+-----------+-----------------+---------------------------------+------------------------------
 11111111-1111-1111-1111-111111111111 | 1HGCM82633A004352 |            1001 | Model S | Long Range | 2020 |      12000 | electric  | {leased}        | {"battery_kwh": 85}             | Fri Nov 21 00:00:00 2025 PST
 22222222-2222-2222-2222-222222222222 | VF1RFB00456812345 |                 | Model A | Comfort    | 2019 |      38000 | diesel    | {company}       | {"color": "silver", "seats": 5} | Fri Nov 21 00:00:00 2025 PST
 00000000-0000-0000-0000-000000000001 | WDB1234561A654321 |               1 | Model X | Premium    | 2021 |      45350 | gasoline  | {fleet,company} | {"color": "black", "seats": 5}  | Fri Nov 21 00:00:00 2025 PST
(3 rows)

-- Update tire_set
UPDATE management.tire_set
SET set_status='disposed'
WHERE front_left_tire_id = 2001;
SELECT *
FROM management.tire_set;
                car_id                | front_left_tire_id | front_right_tire_id | rear_left_tire_id | rear_right_tire_id | set_status | mounted_at | removed_at | storage_garage_id |    notes    
--------------------------------------+--------------------+---------------------+-------------------+--------------------+------------+------------+------------+-------------------+-------------
 00000000-0000-0000-0000-000000000001 |                  1 |                   1 |                 1 |                  1 | mounted    |            |            |                 1 | Initial set
 22222222-2222-2222-2222-222222222222 |               2002 |                2002 |              2002 |               2002 | stored     |            |            |              5002 | 
                                      |               2003 |                2003 |              2003 |               2003 | mounted    |            |            |              5003 | 
                                      |               2004 |                2004 |              2004 |               2004 | stored     |            |            |              5004 | 
 11111111-1111-1111-1111-111111111111 |               2001 |                2001 |              2001 |               2001 | disposed   |            |            |              5001 | 
(5 rows)

-- Update mechanic
UPDATE management.mechanic
SET skill_level='senior'
WHERE full_name = 'John Doe';
SELECT *
FROM management.mechanic;
 mechanic_id | garage_id |    full_name     |      certifications       | hire_date  | skill_level | active |     notes     |          created_at          
-------------+-----------+------------------+---------------------------+------------+-------------+--------+---------------+------------------------------
        7001 |      5001 | Erika Müster     | {"ASE B2"}                | 09-15-2020 | mid         | t      |               | Tue Nov 18 00:00:00 2025 PST
        7002 |      5002 | Joe Bloggs       | {"ASE C1"}                | 03-10-2019 | mid         | t      |               | Tue Nov 18 00:00:00 2025 PST
        7003 |      5003 | Fred Nurk        | {"ASE B1"}                | 01-01-2022 | junior      | t      |               | Tue Nov 18 00:00:00 2025 PST
        7004 |      5004 | Erika Mustermann | {"ASE A2"}                | 06-15-2021 | mid         | t      |               | Tue Nov 18 00:00:00 2025 PST
           1 |         1 | John Doe         | {"ASE A1","EV Certified"} | 05-01-2018 | senior      | t      | Lead mechanic | Tue Nov 18 00:00:00 2025 PST
(5 rows)

-- Update garage_mechanic
UPDATE management.garage_mechanic
SET role='lead'
WHERE garage_id = 1;
SELECT *
FROM management.garage_mechanic;
 garage_id | mechanic_id |                       shift_range                       |  role   |          created_at          
-----------+-------------+---------------------------------------------------------+---------+------------------------------
      5001 |        7001 | ["Sun Nov 02 08:00:00 2025","Sun Nov 02 16:00:00 2025") | morning | Mon Nov 17 00:00:00 2025 PST
      5002 |        7002 | ["Mon Nov 03 08:00:00 2025","Mon Nov 03 16:00:00 2025") | morning | Mon Nov 17 00:00:00 2025 PST
         1 |           1 | ["Sat Nov 01 08:00:00 2025","Sat Nov 01 16:00:00 2025") | lead    | Mon Nov 17 00:00:00 2025 PST
(3 rows)

-- Update service_record
UPDATE management.service_record
SET cost=management.service_record.cost * 1.1;
SELECT *
FROM management.service_record;
              service_id              |                car_id                | mechanic_id | garage_id | related_service_id | tire_id | service_type |  cost   |              notes              | service_window | diagnostic_data |          created_at          
--------------------------------------+--------------------------------------+-------------+-----------+--------------------+---------+--------------+---------+---------------------------------+----------------+-----------------+------------------------------
 00000000-0000-0000-0000-000000000002 | 00000000-0000-0000-0000-000000000001 |           1 |         1 |                    |       1 | maintenance  |  274.99 | Oil change and basic inspection |                |                 | Sun Nov 16 00:00:00 2025 PST
 22222222-2222-2222-2222-222222222222 | 11111111-1111-1111-1111-111111111111 |        7001 |      5001 |                    |    2001 | repair       | 1126.95 | Brake pad replacement           |                |                 | Sun Nov 16 00:00:00 2025 PST
 33333333-3333-3333-3333-333333333333 | 22222222-2222-2222-2222-222222222222 |             |           |                    |         | inspection   |  329.99 | Pre-winter inspection           |                |                 | Sun Nov 16 00:00:00 2025 PST
(3 rows)

-- Update inspection
UPDATE management.inspection
SET passed= false
WHERE id = 9001;
SELECT *
FROM management.inspection;
  id  |              service_id              | inspector_name | passed |            issues_found            |         performed_at         
------+--------------------------------------+----------------+--------+------------------------------------+------------------------------
    1 | 00000000-0000-0000-0000-000000000002 | Richard Roe    | t      | []                                 | Tue Nov 18 00:00:00 2025 PST
 9002 | 22222222-2222-2222-2222-222222222222 | Jane Roe       | t      | []                                 | Tue Nov 18 00:00:00 2025 PST
 9001 | 22222222-2222-2222-2222-222222222222 | Mary Major     | f      | {"brakes": "worn", "lights": "ok"} | Tue Nov 18 00:00:00 2025 PST
(3 rows)

-- Update feature
UPDATE management.feature
SET description='Updated feature description'
WHERE feature_id = 6001;
SELECT *
FROM management.feature;
 feature_id |      name       |          description           |          created_at          
------------+-----------------+--------------------------------+------------------------------
          1 | Heated Seats    | Seats with internal heating    | Fri Nov 14 00:00:00 2025 PST
       6002 | Parking Sensors | Front and rear parking sensors | Fri Nov 14 00:00:00 2025 PST
       6001 | Sunroof         | Updated feature description    | Fri Nov 14 00:00:00 2025 PST
(3 rows)

-- Update management.car_feature
UPDATE management.car_feature
SET notes='Updated notes'
WHERE id = 70001;
SELECT *
FROM management.car_feature;
  id   |                car_id                | feature_id |         installed_at         | removed_at | installed_by |         notes         
-------+--------------------------------------+------------+------------------------------+------------+--------------+-----------------------
     1 | 00000000-0000-0000-0000-000000000001 |          1 | Mon Nov 10 00:00:00 2025 PST |            |            1 | Installed at purchase
 70002 | 22222222-2222-2222-2222-222222222222 |       6002 | Mon Nov 10 00:00:00 2025 PST |            |         7002 | Optional install
 70001 | 11111111-1111-1111-1111-111111111111 |       6001 | Sun Nov 10 00:00:00 2024 PST |            |         7001 | Updated notes
(3 rows)

-- Update telematics_snapshot
UPDATE telematic.telematics_snapshot
SET engine_state='error'
WHERE id = 10001;
SELECT *
FROM telematic.telematics_snapshot;
  id   |                car_id                |         snapshot_ts          | dtc_codes |          telematics           | speed_range |                 gps                 | engine_state 
-------+--------------------------------------+------------------------------+-----------+-------------------------------+-------------+-------------------------------------+--------------
     1 | 00000000-0000-0000-0000-000000000001 | Mon Nov 10 00:00:00 2025 PST | {}        | {"temp_c": 22, "battery": 98} | [0,121)     | {"lat": 47.376887, "lon": 8.541694} | ok
 10002 | 22222222-2222-2222-2222-222222222222 | Mon Nov 10 00:00:00 2025 PST | {}        | {"temp_c": 18, "battery": 85} | [0,111)     | {"lat": 46.9481, "lon": 7.4474}     | ok
 10001 | 11111111-1111-1111-1111-111111111111 | Sun Nov 09 00:00:00 2025 PST | {P0420}   | {"temp_c": 15, "battery": 75} | [10,91)     | {"lat": 46.204391, "lon": 6.143157} | error
(3 rows)

-- Update car_owner_history
UPDATE management.car_owner_history
SET notes='car looks good';
SELECT *
FROM management.car_owner_history;
 id |                car_id                | owner_id |                    ownership_period                     |     notes      |          created_at          
----+--------------------------------------+----------+---------------------------------------------------------+----------------+------------------------------
  1 | 00000000-0000-0000-0000-000000000001 |        1 | ["Wed Jan 01 00:00:00 2020","Fri Jan 01 00:00:00 2021"] | car looks good | Wed Nov 19 00:00:00 2025 PST
(1 row)

-- =========================================================
-- STEP 8: Check all backing table changes
-- =========================================================
SELECT *
FROM _backing.management__manufacturer;
  id  |          name          |                      location                      | founded_year |                                  details                                  |          created_at          |                              row_hash                              
------+------------------------+----------------------------------------------------+--------------+---------------------------------------------------------------------------+------------------------------+--------------------------------------------------------------------
    1 | Example Tyres Ltd      | 0101000020E61000005E707ADB28C11D40DA7C8C14BD794740 |         1958 | {"notes": "HQ in Switzerland", "website": "https://exampletyres.example"} | Sun Nov 23 00:00:00 2025 PST | \x3dc5fe55300d6343219eda612ba2aec12122594d6fb7eb85e2666bd3e9693241
 1001 | Sample Wheels Ltd      | 0101000020E6100000FCE07CEA58152140CFA44DD53DB04740 |         1975 | {"special": "high performance"}                                           | Sun Nov 23 00:00:00 2025 PST | \x768045dfc258396d4d6120dfd25e8721a0e9fee12112c7064c5b2523cfb1a38d
 1002 | Demo Wheels Ltd        | 0101000020E6100000EEEBC03923CA1D4036AB3E575B794740 |         1982 | {"special": "off-road", "website": "https://demowheels.example"}          | Sun Nov 23 00:00:00 2025 PST | \xa8a057d3a0acc3ba033d11acfcc6a1d346f65fdc35af14500a2808abf5dafaaf
 1003 | Placeholder Wheels Ltd | 0101000020E610000033333333333321400000000000804740 |         1990 | {"notes": "importer"}                                                     | Sun Nov 23 00:00:00 2025 PST | \xfa1dc3105bc6354336e0a6a02374730fb560f5318d401b6439bb60d69e693789
 1004 | TireMasters            | 0101000020E61000009A99999999192140E17A14AE47814740 |         1985 | {"notes": "premium"}                                                      | Sun Nov 23 00:00:00 2025 PST | \x683bf04179df659059c6f7bd02df03d9eab776db7198ddbfd3858d1dbab2bad7
    1 | Example Tyres Ltd      | 0101000020E61000005E707ADB28C11D40DA7C8C14BD794740 |         1959 | {"notes": "HQ in Switzerland", "website": "https://exampletyres.example"} | Sun Nov 23 00:00:00 2025 PST | \x307a48b7ab091d4438a8776f1cb758910edc9b5ce2eae9308b0a8dc8af63de23
(6 rows)

SELECT *
FROM _backing.management__garage;
 garage_id | parent_garage_id |       name        |                      location                      |           services_offered           |                  opening_hours                   | rating |          created_at          |                              row_hash                              | management__garage_hash 
-----------+------------------+-------------------+----------------------------------------------------+--------------------------------------+--------------------------------------------------+--------+------------------------------+--------------------------------------------------------------------+-------------------------
         1 |                  | Central Garage    | 0101000020080800000000000020D6434100000000804F3241 | {tyre_change,inspection,maintenance} | {"sat": "09:00-14:00", "mon-fri": "08:00-18:00"} |   4.60 | Sat Nov 22 00:00:00 2025 PST | \x85ee7c7c3784bc816e9b2cca16b813c37f857356324195a869628382e09e1ce5 | 
      5001 |                  | North Garage      | 0101000020080800008CD7BCAAB35A1E40197442E8A0C74740 | {inspection,repair}                  | {"mon-fri": "07:00-17:00"}                       |   4.20 | Sat Nov 22 00:00:00 2025 PST | \x6639458be65c42fae1247ba69d233b4c15f31b5965d6ce010fa9a7919c412220 | 
      5002 |                  | East Garage       | 0101000020080800001EC6A4BF97921840624CFA7B291A4740 | {tyre_change,inspection}             | {"mon-fri": "08:00-18:00"}                       |   4.10 | Sat Nov 22 00:00:00 2025 PST | \xbd2aabc62b2a1d593a9a9029ad6fc2ac1c41793e87fb9b20eacc88ae6a45923c | 
      5003 |                  | West Garage       | 0101000020080800008FC2F5285C8F1A40C3F5285C8F424740 | {inspection,tyre_change}             | {"mon-fri": "08-18"}                             |   4.00 | Sat Nov 22 00:00:00 2025 PST | \x38831a338af234a6bceb44c282f5515524b43d979d231f3861ac7f59d9bbbfa2 | 
      5004 |                  | St. Gallen Garage | 0101000020080800003D0AD7A370BD2240F6285C8FC2B54740 | {maintenance,inspection}             | {"mon-fri": "07-17"}                             |   4.30 | Sat Nov 22 00:00:00 2025 PST | \x5f1958b46ac832ea3d9bbca0b454e17263905d22d68448c5c810a7f520305a86 | 
         1 |                  | Central Garage    | 0101000020080800000000000020D6434100000000804F3241 | {tyre_change,inspection,maintenance} | {"sat": "09:00-14:00", "mon-fri": "08:00-18:00"} |   4.80 | Sat Nov 22 00:00:00 2025 PST | \x37915845393c79210e926ec2e8fdbd0ec1d2258e7eaf322b4ef9e85ce2b0c124 | 
(6 rows)

SELECT *
FROM _backing.management__owner;
  id  |      legal_name      | display_name |              address               |      phone       |            email            | customer_type |         metadata          |          created_at          |                              row_hash                              
------+----------------------+--------------+------------------------------------+------------------+-----------------------------+---------------+---------------------------+------------------------------+--------------------------------------------------------------------
    1 | Max Muster           | M. Muster    | Example Street 1, 1000 Sampletown  | +41 44 000 00 01 | max.muster@example.com      | private       | {"notes": "VIP customer"} | Thu Nov 20 00:00:00 2025 PST | \xe20cdd65ecfdaff0b0a8b417c7d7415cf1c3198b1958d9e010cfef001b31fefc
 3001 | Müster Logistics Ltd | MüsterLog    | Example Park 5, 1000 Sampletown    | +41 44 000 11 22 | contact@muesterlog.example  | corporate     | {"fleet_size": 80}        | Thu Nov 20 00:00:00 2025 PST | \x05a1bf069c31ecc9f5ac04a9e27f71c7a7f4ae2b6459bde4593d4ecb102db420
 3002 | Sample Autos Ltd     | Sample Autos | Example Street 12, 1000 Sampletown | +41 41 000 22 33 | contact@sampleautos.example | corporate     | {"fleet_size": 15}        | Thu Nov 20 00:00:00 2025 PST | \x1079d9d18fe0293133cc55ff2581847276d8711f3acb9058b19c8e2b5464b9c8
 3003 | Example Corp A       | Hug          | Industrial Str. 1                  | +41 41 123 45 67 | corp-a@example.com          | corporate     | {}                        | Thu Nov 20 00:00:00 2025 PST | \x8e8a65b6de5621e79038b5608e988f0db0ca8f2a917e966d9cc8431ced810ac6
 3004 | Example Corp B       | Meyer        | Main Str. 12                       | +41 44 765 43 21 | corp-b@example.com          | corporate     | {}                        | Thu Nov 20 00:00:00 2025 PST | \xf90bc13887bb0ff3500b7a721adbb6c1d5a43f025f926017ca4e86317ee199ad
    1 | Max Muster           | M. Muster    | Example Street 1, 1000 Sampletown  | +41 44 999 99 99 | max.muster@example.com      | private       | {"notes": "VIP customer"} | Thu Nov 20 00:00:00 2025 PST | \xce9409298cb5160b25abc7b59fc6a73167d5193141dba4fd4fd2f1510556c8d6
(6 rows)

SELECT *
FROM _backing.management__tire;
  id  | production_date | tire_type | size_text | profile_mm_left |    brand    | pressure_psi | status  | manufacturer_id |  notes   |          created_at          |                              row_hash                              
------+-----------------+-----------+-----------+-----------------+-------------+--------------+---------+-----------------+----------+------------------------------+--------------------------------------------------------------------
    1 | 06-15-2024      | summer    | 205/55R16 |             7.5 | GoodTyre    |        32.00 | stored  |               1 | Batch A1 | Mon Nov 24 00:00:00 2025 PST | \xd17ca495ff02efdcbf3a7bb8d1c8557a4d2f7cea6ba6471f403983c22d863061
 2001 | 11-01-2023      | winter    | 195/65R15 |             9.2 | SwissGrip   |        34.00 | mounted |            1001 |          | Mon Nov 24 00:00:00 2025 PST | \x6db9e0d97a30b54bcda2684fa92c935a6e1d73598291fd3dc7d22a2d3b739feb
 2002 | 01-20-2025      | summer    | 225/45R17 |             8.0 | AlpineGrip  |        33.50 | mounted |            1002 |          | Mon Nov 24 00:00:00 2025 PST | \xb3f52cd604f9fe0b50bb870772fdc3e649ccc579626ce738b7a4bc12b056c27e
 2003 | 03-10-2025      | summer    | 205/55R16 |             7.5 | WheelPro    |        32.00 | mounted |            1003 |          | Mon Nov 24 00:00:00 2025 PST | \xea87593e203658ce59ddee22a18a4e5bf0cbaba219470de9aa51b833f21e9dc1
 2004 | 03-11-2025      | winter    | 195/65R15 |             8.0 | TireMasters |        34.00 | stored  |            1004 |          | Mon Nov 24 00:00:00 2025 PST | \xd704e518fba43c07bfb4da8d5a4004e8af366821d19c34a71127cf256c0064e8
    1 | 06-15-2024      | summer    | 205/55R16 |             7.0 | GoodTyre    |        32.00 | stored  |               1 | Batch A1 | Mon Nov 24 00:00:00 2025 PST | \x52dc362dc9f6a34f276b0ef339aec207b429613e1775f01b20b9d01d52da369a
(6 rows)

SELECT *
FROM _backing.management__car;
                  id                  |        vin        | manufacturer_id |  model  | model_trim | year | mileage_km | fuel_type |      tags       |             options             |          created_at          |                              row_hash                              |                   management__manufacturer_hash                    
--------------------------------------+-------------------+-----------------+---------+------------+------+------------+-----------+-----------------+---------------------------------+------------------------------+--------------------------------------------------------------------+--------------------------------------------------------------------
 00000000-0000-0000-0000-000000000001 | WDB1234561A654321 |               1 | Model X | Premium    | 2021 |      45200 | gasoline  | {fleet,company} | {"color": "black", "seats": 5}  | Fri Nov 21 00:00:00 2025 PST | \x42a998e58f7b33dcfba5bf8f241ca236d799bd7157ea7e214852d4091fd9c6ab | \x3dc5fe55300d6343219eda612ba2aec12122594d6fb7eb85e2666bd3e9693241
 11111111-1111-1111-1111-111111111111 | 1HGCM82633A004352 |            1001 | Model S | Long Range | 2020 |      12000 | electric  | {leased}        | {"battery_kwh": 85}             | Fri Nov 21 00:00:00 2025 PST | \xaeeafbaff8d52420acfd4a3deac9bd5f2935cb92a742a4f18efc005e10b3c5ca | \x768045dfc258396d4d6120dfd25e8721a0e9fee12112c7064c5b2523cfb1a38d
 22222222-2222-2222-2222-222222222222 | VF1RFB00456812345 |                 | Model A | Comfort    | 2019 |      38000 | diesel    | {company}       | {"color": "silver", "seats": 5} | Fri Nov 21 00:00:00 2025 PST | \x58a3c0c2f4b8ad6b848d6e994f107bc79bdafa716303846e1978bfa38efd43a3 | 
 00000000-0000-0000-0000-000000000001 | WDB1234561A654321 |               1 | Model X | Premium    | 2021 |      45350 | gasoline  | {fleet,company} | {"color": "black", "seats": 5}  | Fri Nov 21 00:00:00 2025 PST | \x111cbc2d9c4868e845e18ac71a0ec4508eca171ac9c5816e18a7a2ba61e9cccc | \x307a48b7ab091d4438a8776f1cb758910edc9b5ce2eae9308b0a8dc8af63de23
(4 rows)

SELECT *
FROM _backing.management__tire_set;
                car_id                | front_left_tire_id | front_right_tire_id | rear_left_tire_id | rear_right_tire_id | set_status | mounted_at | removed_at | storage_garage_id |    notes    |                              row_hash                              |                        management__car_hash                        |                       management__tire_hash                        |                      management__garage_hash                       
--------------------------------------+--------------------+---------------------+-------------------+--------------------+------------+------------+------------+-------------------+-------------+--------------------------------------------------------------------+--------------------------------------------------------------------+--------------------------------------------------------------------+--------------------------------------------------------------------
 00000000-0000-0000-0000-000000000001 |                  1 |                   1 |                 1 |                  1 | mounted    |            |            |                 1 | Initial set | \x6f3a165fea441ab2dcf15c89dd005e9fbd9b358ed66d6c86ff1a785a293496b7 | \x42a998e58f7b33dcfba5bf8f241ca236d799bd7157ea7e214852d4091fd9c6ab | \xd17ca495ff02efdcbf3a7bb8d1c8557a4d2f7cea6ba6471f403983c22d863061 | \x85ee7c7c3784bc816e9b2cca16b813c37f857356324195a869628382e09e1ce5
 11111111-1111-1111-1111-111111111111 |               2001 |                2001 |              2001 |               2001 | stored     |            |            |              5001 |             | \xbe9f294d13abaa61cc6a70c447c4f4c491c41093e938de62e0c422f132c199a1 | \xaeeafbaff8d52420acfd4a3deac9bd5f2935cb92a742a4f18efc005e10b3c5ca | \x6db9e0d97a30b54bcda2684fa92c935a6e1d73598291fd3dc7d22a2d3b739feb | \x6639458be65c42fae1247ba69d233b4c15f31b5965d6ce010fa9a7919c412220
 22222222-2222-2222-2222-222222222222 |               2002 |                2002 |              2002 |               2002 | stored     |            |            |              5002 |             | \xed073451dc188587f1bd3de7e6d6cd76b4e6bf477ed52a4c9f6e792b7f66b14c | \x58a3c0c2f4b8ad6b848d6e994f107bc79bdafa716303846e1978bfa38efd43a3 | \xb3f52cd604f9fe0b50bb870772fdc3e649ccc579626ce738b7a4bc12b056c27e | \xbd2aabc62b2a1d593a9a9029ad6fc2ac1c41793e87fb9b20eacc88ae6a45923c
                                      |               2003 |                2003 |              2003 |               2003 | mounted    |            |            |              5003 |             | \x9864623329bc2631c0e43015ce61dc515f4532d2cb5dc36db162b4b5657b7b49 |                                                                    | \xea87593e203658ce59ddee22a18a4e5bf0cbaba219470de9aa51b833f21e9dc1 | \x38831a338af234a6bceb44c282f5515524b43d979d231f3861ac7f59d9bbbfa2
                                      |               2004 |                2004 |              2004 |               2004 | stored     |            |            |              5004 |             | \x4fc51d0a03f436e407deabb71b20eb1b91d0fa22f29d39022e7dffd1f97e3633 |                                                                    | \xd704e518fba43c07bfb4da8d5a4004e8af366821d19c34a71127cf256c0064e8 | \x5f1958b46ac832ea3d9bbca0b454e17263905d22d68448c5c810a7f520305a86
 11111111-1111-1111-1111-111111111111 |               2001 |                2001 |              2001 |               2001 | disposed   |            |            |              5001 |             | \x4207d0a0dc4a5e6cbd47d2b1dcf6c6c990c9cbed0296b51c4ddad59d03128e74 | \xaeeafbaff8d52420acfd4a3deac9bd5f2935cb92a742a4f18efc005e10b3c5ca | \x6db9e0d97a30b54bcda2684fa92c935a6e1d73598291fd3dc7d22a2d3b739feb | \x6639458be65c42fae1247ba69d233b4c15f31b5965d6ce010fa9a7919c412220
(6 rows)

SELECT *
FROM _backing.management__tire_set_log;
 id | front_left_tire_id | front_right_tire_id | rear_left_tire_id | rear_right_tire_id |                                log                                 |          created_at          |                              row_hash                              |                     management__tire_set_hash                      
----+--------------------+---------------------+-------------------+--------------------+--------------------------------------------------------------------+------------------------------+--------------------------------------------------------------------+--------------------------------------------------------------------
  1 |                  1 |                   1 |                 1 |                  1 | Intern accidentally punctured the left rear tire, we just glued it | Fri Nov 28 00:00:00 2025 PST | \x710b2f79833736c85fcfa00c5c6ab6bc9d00d84db497d112df48a2b6a57ba319 | \x6f3a165fea441ab2dcf15c89dd005e9fbd9b358ed66d6c86ff1a785a293496b7
  2 |               2001 |                2001 |              2001 |               2001 | have one flat spot                                                 | Fri Nov 28 00:00:00 2025 PST | \xcd2438aee13a18978626bc24db66ae0c4d525c696eb1849a37b764b624459853 | \xbe9f294d13abaa61cc6a70c447c4f4c491c41093e938de62e0c422f132c199a1
  3 |               2001 |                2001 |              2001 |               2001 | balanced read tires                                                | Fri Nov 28 00:00:00 2025 PST | \x40817624376df00c0abc64a7b08a4facc4008219b76d2fa777fc6e90328fa2e7 | \xbe9f294d13abaa61cc6a70c447c4f4c491c41093e938de62e0c422f132c199a1
  4 |               2003 |                2003 |              2003 |               2003 | Tires rotated and balanced                                         | Fri Nov 28 00:00:00 2025 PST | \x860f4cfae5dcebda01606ad89c39cfa632d64e786530a80e44627a5a43e8d7e5 | \x9864623329bc2631c0e43015ce61dc515f4532d2cb5dc36db162b4b5657b7b49
  5 |               2004 |                2004 |              2004 |               2004 | Stored for summer season                                           | Fri Nov 28 00:00:00 2025 PST | \xe8e60c6454f6133694c6b2886d6867260fac39f52327c2b635c4eea6c51ba065 | \x4fc51d0a03f436e407deabb71b20eb1b91d0fa22f29d39022e7dffd1f97e3633
(5 rows)

SELECT *
FROM _backing.management__mechanic;
 mechanic_id | garage_id |    full_name     |      certifications       | hire_date  | skill_level | active |     notes     |          created_at          |                              row_hash                              |                      management__garage_hash                       
-------------+-----------+------------------+---------------------------+------------+-------------+--------+---------------+------------------------------+--------------------------------------------------------------------+--------------------------------------------------------------------
           1 |         1 | John Doe         | {"ASE A1","EV Certified"} | 05-01-2018 | senior      | t      | Lead mechanic | Tue Nov 18 00:00:00 2025 PST | \x5edf4351a4481f7ced880a819c65c89eaaaa79b495540a7e47632f99941791d6 | \x85ee7c7c3784bc816e9b2cca16b813c37f857356324195a869628382e09e1ce5
        7001 |      5001 | Erika Müster     | {"ASE B2"}                | 09-15-2020 | mid         | t      |               | Tue Nov 18 00:00:00 2025 PST | \x8d1affbf94a12191358a5f4f65cf80ec9c9ae2e7be96326dea0215136b03ff89 | \x6639458be65c42fae1247ba69d233b4c15f31b5965d6ce010fa9a7919c412220
        7002 |      5002 | Joe Bloggs       | {"ASE C1"}                | 03-10-2019 | mid         | t      |               | Tue Nov 18 00:00:00 2025 PST | \x9ae149d5317f2372007f5e6ad3ff28e8cf7c1f01c9cef5e44f48510c15c1dfc8 | \xbd2aabc62b2a1d593a9a9029ad6fc2ac1c41793e87fb9b20eacc88ae6a45923c
        7003 |      5003 | Fred Nurk        | {"ASE B1"}                | 01-01-2022 | junior      | t      |               | Tue Nov 18 00:00:00 2025 PST | \x5fa781469b109394a2221b90814d4310655bcde3c0bc975ece1254de3282e159 | \x38831a338af234a6bceb44c282f5515524b43d979d231f3861ac7f59d9bbbfa2
        7004 |      5004 | Erika Mustermann | {"ASE A2"}                | 06-15-2021 | mid         | t      |               | Tue Nov 18 00:00:00 2025 PST | \xa42547b3b25abe7134775f43be47ffdc188cfff9e8d1570c0b2a4252a7f0a4fd | \x5f1958b46ac832ea3d9bbca0b454e17263905d22d68448c5c810a7f520305a86
           1 |         1 | John Doe         | {"ASE A1","EV Certified"} | 05-01-2018 | senior      | t      | Lead mechanic | Tue Nov 18 00:00:00 2025 PST | \xec69d636c17a810a5472de40bc3928058914762bcf648056b3e9320de5026547 | \x37915845393c79210e926ec2e8fdbd0ec1d2258e7eaf322b4ef9e85ce2b0c124
(6 rows)

SELECT *
FROM _backing.management__garage_mechanic;
 garage_id | mechanic_id |                       shift_range                       |    role    |          created_at          |                              row_hash                              |                      management__garage_hash                       |                     management__mechanic_hash                      
-----------+-------------+---------------------------------------------------------+------------+------------------------------+--------------------------------------------------------------------+--------------------------------------------------------------------+--------------------------------------------------------------------
         1 |           1 | ["Sat Nov 01 08:00:00 2025","Sat Nov 01 16:00:00 2025") | shift_lead | Mon Nov 17 00:00:00 2025 PST | \x8de8f892a5359de981f1f97e868d48faa47e92e4fee31b6c809801a015f81142 | \x85ee7c7c3784bc816e9b2cca16b813c37f857356324195a869628382e09e1ce5 | \x5edf4351a4481f7ced880a819c65c89eaaaa79b495540a7e47632f99941791d6
      5001 |        7001 | ["Sun Nov 02 08:00:00 2025","Sun Nov 02 16:00:00 2025") | morning    | Mon Nov 17 00:00:00 2025 PST | \x70c9d21866ddd5da33727c0b563856a45a93c424f387b918cbe900da2754d756 | \x6639458be65c42fae1247ba69d233b4c15f31b5965d6ce010fa9a7919c412220 | \x8d1affbf94a12191358a5f4f65cf80ec9c9ae2e7be96326dea0215136b03ff89
      5002 |        7002 | ["Mon Nov 03 08:00:00 2025","Mon Nov 03 16:00:00 2025") | morning    | Mon Nov 17 00:00:00 2025 PST | \x87a80f670a3fbf6239daa50b4f397fe8284716735ca3a2a0437760b40b2268f9 | \xbd2aabc62b2a1d593a9a9029ad6fc2ac1c41793e87fb9b20eacc88ae6a45923c | \x9ae149d5317f2372007f5e6ad3ff28e8cf7c1f01c9cef5e44f48510c15c1dfc8
         1 |           1 | ["Sat Nov 01 08:00:00 2025","Sat Nov 01 16:00:00 2025") | lead       | Mon Nov 17 00:00:00 2025 PST | \x0318ca43d8995397ec1996ade70bc598b37b8e3979562e5ba0ca204b03fb6ddf | \x37915845393c79210e926ec2e8fdbd0ec1d2258e7eaf322b4ef9e85ce2b0c124 | \xec69d636c17a810a5472de40bc3928058914762bcf648056b3e9320de5026547
(4 rows)

SELECT *
FROM _backing.management__service_record;
              service_id              |                car_id                | mechanic_id | garage_id | related_service_id | tire_id | service_type |  cost   |              notes              | service_window | diagnostic_data |          created_at          |                              row_hash                              |                        management__car_hash                        |                      management__garage_hash                       |                     management__mechanic_hash                      | management__service_record_hash |                       management__tire_hash                        
--------------------------------------+--------------------------------------+-------------+-----------+--------------------+---------+--------------+---------+---------------------------------+----------------+-----------------+------------------------------+--------------------------------------------------------------------+--------------------------------------------------------------------+--------------------------------------------------------------------+--------------------------------------------------------------------+---------------------------------+--------------------------------------------------------------------
 00000000-0000-0000-0000-000000000002 | 00000000-0000-0000-0000-000000000001 |           1 |         1 |                    |       1 | maintenance  |  249.99 | Oil change and basic inspection |                |                 | Sun Nov 16 00:00:00 2025 PST | \xaaad14c7f0935d6d971fbcd337b7e21c7596fcd1739af53e3d44ef971135785d | \x42a998e58f7b33dcfba5bf8f241ca236d799bd7157ea7e214852d4091fd9c6ab | \x85ee7c7c3784bc816e9b2cca16b813c37f857356324195a869628382e09e1ce5 | \x5edf4351a4481f7ced880a819c65c89eaaaa79b495540a7e47632f99941791d6 |                                 | \xd17ca495ff02efdcbf3a7bb8d1c8557a4d2f7cea6ba6471f403983c22d863061
 22222222-2222-2222-2222-222222222222 | 11111111-1111-1111-1111-111111111111 |        7001 |      5001 |                    |    2001 | repair       | 1024.50 | Brake pad replacement           |                |                 | Sun Nov 16 00:00:00 2025 PST | \xd5f0a0c283d99061ac8bef774f02463914e71e11d36f990b4dcef92c44a9fdf8 | \xaeeafbaff8d52420acfd4a3deac9bd5f2935cb92a742a4f18efc005e10b3c5ca | \x6639458be65c42fae1247ba69d233b4c15f31b5965d6ce010fa9a7919c412220 | \x8d1affbf94a12191358a5f4f65cf80ec9c9ae2e7be96326dea0215136b03ff89 |                                 | \x6db9e0d97a30b54bcda2684fa92c935a6e1d73598291fd3dc7d22a2d3b739feb
 33333333-3333-3333-3333-333333333333 | 22222222-2222-2222-2222-222222222222 |             |           |                    |         | inspection   |  299.99 | Pre-winter inspection           |                |                 | Sun Nov 16 00:00:00 2025 PST | \x794fb4ccd4d5624b257db94416adb09eb5862aade0aa6616690418bcb958b356 | \x58a3c0c2f4b8ad6b848d6e994f107bc79bdafa716303846e1978bfa38efd43a3 |                                                                    |                                                                    |                                 | 
 00000000-0000-0000-0000-000000000002 | 00000000-0000-0000-0000-000000000001 |           1 |         1 |                    |       1 | maintenance  |  274.99 | Oil change and basic inspection |                |                 | Sun Nov 16 00:00:00 2025 PST | \x617e7beb929951f9df788ed6c2312799c510674796ee21b414d8e62531f1f8ef | \x111cbc2d9c4868e845e18ac71a0ec4508eca171ac9c5816e18a7a2ba61e9cccc | \x37915845393c79210e926ec2e8fdbd0ec1d2258e7eaf322b4ef9e85ce2b0c124 | \xec69d636c17a810a5472de40bc3928058914762bcf648056b3e9320de5026547 |                                 | \x52dc362dc9f6a34f276b0ef339aec207b429613e1775f01b20b9d01d52da369a
 22222222-2222-2222-2222-222222222222 | 11111111-1111-1111-1111-111111111111 |        7001 |      5001 |                    |    2001 | repair       | 1126.95 | Brake pad replacement           |                |                 | Sun Nov 16 00:00:00 2025 PST | \x9f7c1e0fdcb2dfbcf91aa2234b812710ce6f3d8faa3a07c7cb3c68a0c4b5b12d | \xaeeafbaff8d52420acfd4a3deac9bd5f2935cb92a742a4f18efc005e10b3c5ca | \x6639458be65c42fae1247ba69d233b4c15f31b5965d6ce010fa9a7919c412220 | \x8d1affbf94a12191358a5f4f65cf80ec9c9ae2e7be96326dea0215136b03ff89 |                                 | \x6db9e0d97a30b54bcda2684fa92c935a6e1d73598291fd3dc7d22a2d3b739feb
 33333333-3333-3333-3333-333333333333 | 22222222-2222-2222-2222-222222222222 |             |           |                    |         | inspection   |  329.99 | Pre-winter inspection           |                |                 | Sun Nov 16 00:00:00 2025 PST | \xe97932735631ad518bb9565af4a033df0660950195ee610648d0a2c29e0a5ab6 | \x58a3c0c2f4b8ad6b848d6e994f107bc79bdafa716303846e1978bfa38efd43a3 |                                                                    |                                                                    |                                 | 
(6 rows)

SELECT *
FROM _backing.management__inspection;
  id  |              service_id              | inspector_name | passed |            issues_found            |         performed_at         |                              row_hash                              |                  management__service_record_hash                   
------+--------------------------------------+----------------+--------+------------------------------------+------------------------------+--------------------------------------------------------------------+--------------------------------------------------------------------
    1 | 00000000-0000-0000-0000-000000000002 | Richard Roe    | t      | []                                 | Tue Nov 18 00:00:00 2025 PST | \xae95205bfaeac9b8a94ea594909e35bb481e0242810a2c88b24b7600ef303d2f | \xaaad14c7f0935d6d971fbcd337b7e21c7596fcd1739af53e3d44ef971135785d
 9001 | 22222222-2222-2222-2222-222222222222 | Mary Major     | f      | {"brakes": "worn", "lights": "ok"} | Tue Nov 18 00:00:00 2025 PST | \x29e3db2ad667e184c63d4695a49dab719deac307f67daf469ff6e83372291a2f | \xd5f0a0c283d99061ac8bef774f02463914e71e11d36f990b4dcef92c44a9fdf8
 9002 | 22222222-2222-2222-2222-222222222222 | Jane Roe       | t      | []                                 | Tue Nov 18 00:00:00 2025 PST | \x913322191988a6806cb265ac0d0f22341bacc8e30f9253b1b625f2916556e308 | \xd5f0a0c283d99061ac8bef774f02463914e71e11d36f990b4dcef92c44a9fdf8
 9001 | 22222222-2222-2222-2222-222222222222 | Mary Major     | f      | {"brakes": "worn", "lights": "ok"} | Tue Nov 18 00:00:00 2025 PST | \xe5a966ae1b0a7223db8a9ca672b20935a30b6ac73708de6b61cce638852056aa | \x9f7c1e0fdcb2dfbcf91aa2234b812710ce6f3d8faa3a07c7cb3c68a0c4b5b12d
(4 rows)

SELECT *
FROM _backing.management__feature;
 feature_id |      name       |          description           |          created_at          |                              row_hash                              
------------+-----------------+--------------------------------+------------------------------+--------------------------------------------------------------------
          1 | Heated Seats    | Seats with internal heating    | Fri Nov 14 00:00:00 2025 PST | \x497810f12683095d64d460f4a2ba9bf20fc8ffc94bf78b2f4554a92aca90c832
       6001 | Sunroof         | Panoramic sunroof              | Fri Nov 14 00:00:00 2025 PST | \x777824d319e432c1542c5400d396a47713af38e82bc1465df10b8be7b74172f6
       6002 | Parking Sensors | Front and rear parking sensors | Fri Nov 14 00:00:00 2025 PST | \x34f6262799987face52e86128009747d65379c9109da7cfb107c2eda52ceb4e1
       6001 | Sunroof         | Updated feature description    | Fri Nov 14 00:00:00 2025 PST | \x25344e3d055e57d80dbb1f6ed5f3271bdf2c41a32e2a74f17edac000a4d11711
(4 rows)

SELECT *
FROM _backing.management__car_feature;
  id   |                car_id                | feature_id |         installed_at         | removed_at | installed_by |         notes         |                              row_hash                              |                        management__car_hash                        |                      management__feature_hash                      |                     management__mechanic_hash                      
-------+--------------------------------------+------------+------------------------------+------------+--------------+-----------------------+--------------------------------------------------------------------+--------------------------------------------------------------------+--------------------------------------------------------------------+--------------------------------------------------------------------
     1 | 00000000-0000-0000-0000-000000000001 |          1 | Mon Nov 10 00:00:00 2025 PST |            |            1 | Installed at purchase | \x58a494958b16688eb608536e1ec7a47432c0bc6300ba31d08ce761675e2f0956 | \x42a998e58f7b33dcfba5bf8f241ca236d799bd7157ea7e214852d4091fd9c6ab | \x497810f12683095d64d460f4a2ba9bf20fc8ffc94bf78b2f4554a92aca90c832 | \x5edf4351a4481f7ced880a819c65c89eaaaa79b495540a7e47632f99941791d6
 70001 | 11111111-1111-1111-1111-111111111111 |       6001 | Sun Nov 10 00:00:00 2024 PST |            |         7001 |                       | \x2cde8a76cfb760aab3669d95a6efee5b76750f6e69aaf054a50bdfea2166c879 | \xaeeafbaff8d52420acfd4a3deac9bd5f2935cb92a742a4f18efc005e10b3c5ca | \x777824d319e432c1542c5400d396a47713af38e82bc1465df10b8be7b74172f6 | \x8d1affbf94a12191358a5f4f65cf80ec9c9ae2e7be96326dea0215136b03ff89
 70002 | 22222222-2222-2222-2222-222222222222 |       6002 | Mon Nov 10 00:00:00 2025 PST |            |         7002 | Optional install      | \x11e9bdfdeda4fe5b2862816a2084ff44f962e40f11b903187486c85c58d6d7ff | \x58a3c0c2f4b8ad6b848d6e994f107bc79bdafa716303846e1978bfa38efd43a3 | \x34f6262799987face52e86128009747d65379c9109da7cfb107c2eda52ceb4e1 | \x9ae149d5317f2372007f5e6ad3ff28e8cf7c1f01c9cef5e44f48510c15c1dfc8
 70001 | 11111111-1111-1111-1111-111111111111 |       6001 | Sun Nov 10 00:00:00 2024 PST |            |         7001 | Updated notes         | \xaded482b69eeed7dc94bb17a4a664e690c3ffe38a20516fa33b8ce39dbdc4cce | \xaeeafbaff8d52420acfd4a3deac9bd5f2935cb92a742a4f18efc005e10b3c5ca | \x25344e3d055e57d80dbb1f6ed5f3271bdf2c41a32e2a74f17edac000a4d11711 | \x8d1affbf94a12191358a5f4f65cf80ec9c9ae2e7be96326dea0215136b03ff89
(4 rows)

SELECT *
FROM _backing.telematic__telematics_snapshot;
  id   |                car_id                |         snapshot_ts          | dtc_codes |          telematics           | speed_range |                 gps                 | engine_state |                              row_hash                              |                        management__car_hash                        
-------+--------------------------------------+------------------------------+-----------+-------------------------------+-------------+-------------------------------------+--------------+--------------------------------------------------------------------+--------------------------------------------------------------------
     1 | 00000000-0000-0000-0000-000000000001 | Mon Nov 10 00:00:00 2025 PST | {}        | {"temp_c": 22, "battery": 98} | [0,121)     | {"lat": 47.376887, "lon": 8.541694} | ok           | \xc3889c276bb1a067ede2d9c919b2502ff9c28f73f2660d62429941f71cc8ea72 | \x42a998e58f7b33dcfba5bf8f241ca236d799bd7157ea7e214852d4091fd9c6ab
 10001 | 11111111-1111-1111-1111-111111111111 | Sun Nov 09 00:00:00 2025 PST | {P0420}   | {"temp_c": 15, "battery": 75} | [10,91)     | {"lat": 46.204391, "lon": 6.143157} | warning      | \x07be8572f7bee9d83691dbaef06881d0b9bcd0beea047ac95db9dfcb2ec49b59 | \xaeeafbaff8d52420acfd4a3deac9bd5f2935cb92a742a4f18efc005e10b3c5ca
 10002 | 22222222-2222-2222-2222-222222222222 | Mon Nov 10 00:00:00 2025 PST | {}        | {"temp_c": 18, "battery": 85} | [0,111)     | {"lat": 46.9481, "lon": 7.4474}     | ok           | \xc9a9817ecc1e0910d715c33236d475129bef7db7c5f8bccb38d65a9fbc12f43f | \x58a3c0c2f4b8ad6b848d6e994f107bc79bdafa716303846e1978bfa38efd43a3
 10001 | 11111111-1111-1111-1111-111111111111 | Sun Nov 09 00:00:00 2025 PST | {P0420}   | {"temp_c": 15, "battery": 75} | [10,91)     | {"lat": 46.204391, "lon": 6.143157} | error        | \xd23ecfaaa3703980ce82305b56eeb7ba3fd08f34350e4ae812ebf8148fd79972 | \xaeeafbaff8d52420acfd4a3deac9bd5f2935cb92a742a4f18efc005e10b3c5ca
(4 rows)

SELECT *
FROM _backing.management__maintenance_ticket;
 custom_name_id |              service_id              | reported_by |               description                | status |          created_at          |                              row_hash                              |                       management__owner_hash                       |                  management__service_record_hash                   
----------------+--------------------------------------+-------------+------------------------------------------+--------+------------------------------+--------------------------------------------------------------------+--------------------------------------------------------------------+--------------------------------------------------------------------
              1 | 00000000-0000-0000-0000-000000000002 |           1 | Customer reports vibration at high speed | open   | Tue Nov 11 00:00:00 2025 PST | \x51a529003a6d515332bd5a49b84923a4aacc1dc65f04f27d9408cf2b599030bd | \xe20cdd65ecfdaff0b0a8b417c7d7415cf1c3198b1958d9e010cfef001b31fefc | \xaaad14c7f0935d6d971fbcd337b7e21c7596fcd1739af53e3d44ef971135785d
          90001 | 22222222-2222-2222-2222-222222222222 |        3001 | Brake squeal on cold mornings            | open   | Tue Nov 11 00:00:00 2025 PST | \x669608bc9780d98ae92fbc5a31efe7525a575346ad8305008374f553fd91844b | \x05a1bf069c31ecc9f5ac04a9e27f71c7a7f4ae2b6459bde4593d4ecb102db420 | \xd5f0a0c283d99061ac8bef774f02463914e71e11d36f990b4dcef92c44a9fdf8
          90002 | 22222222-2222-2222-2222-222222222222 |        3002 | Strange noise from front tires           | open   | Tue Nov 11 00:00:00 2025 PST | \x83b103b98ffa71ea58f0bb912ffcd520f184b5ea17a8e86fdff9d9cc9308050d | \x1079d9d18fe0293133cc55ff2581847276d8711f3acb9058b19c8e2b5464b9c8 | \xd5f0a0c283d99061ac8bef774f02463914e71e11d36f990b4dcef92c44a9fdf8
(3 rows)

SELECT *
FROM _backing.management__car_owner_history;
 id |                car_id                | owner_id |                    ownership_period                     |     notes      |          created_at          |                              row_hash                              |                        management__car_hash                        |                       management__owner_hash                       
----+--------------------------------------+----------+---------------------------------------------------------+----------------+------------------------------+--------------------------------------------------------------------+--------------------------------------------------------------------+--------------------------------------------------------------------
  1 | 00000000-0000-0000-0000-000000000001 |        1 | ["Wed Jan 01 00:00:00 2020","Fri Jan 01 00:00:00 2021"] |                | Wed Nov 19 00:00:00 2025 PST | \x92bccf3c4d29dd8aaec4a89313ad85b453f71c14c4d02d902da63ddba0ec11e3 | \x42a998e58f7b33dcfba5bf8f241ca236d799bd7157ea7e214852d4091fd9c6ab | \xe20cdd65ecfdaff0b0a8b417c7d7415cf1c3198b1958d9e010cfef001b31fefc
  1 | 00000000-0000-0000-0000-000000000001 |        1 | ["Wed Jan 01 00:00:00 2020","Fri Jan 01 00:00:00 2021"] | car looks good | Wed Nov 19 00:00:00 2025 PST | \x7bb0a3f92fede316ab4571ef62374d3b778339c2874951bfa0e194a94306a470 | \x111cbc2d9c4868e845e18ac71a0ec4508eca171ac9c5816e18a7a2ba61e9cccc | \xce9409298cb5160b25abc7b59fc6a73167d5193141dba4fd4fd2f1510556c8d6
(2 rows)

-- =========================================================
-- STEP 9: Check general functions still work
-- =========================================================
-- NOT NULL error
DO
$$
    BEGIN
        INSERT INTO management.car_owner_history (car_id, ownership_period)
        VALUES ((SELECT id FROM management.car WHERE vin = 'WDB1234561A654321' LIMIT 1),
                '[2020-01-01,2021-01-01]'::tsrange);
    EXCEPTION
        WHEN not_null_violation THEN
            RAISE NOTICE 'NOT NULL violation caught as expected';
    END;
$$;
NOTICE:  NOT NULL violation caught as expected
-- Enum type miss match
UPDATE management.tire_set
SET set_status='bla'
WHERE front_left_tire_id = 2001;
ERROR:  invalid input value for enum management.tire_set_status_enum: "bla"
LINE 2: SET set_status='bla'
                       ^
-- Check if joins work correctly
SELECT *
FROM management.car
         INNER JOIN management.car_owner_history coh on car.id = coh.car_id
         INNER JOIN management.owner o on o.id = coh.owner_id;
                  id                  |        vin        | manufacturer_id |  model  | model_trim | year | mileage_km | fuel_type |      tags       |            options             |          created_at          | id |                car_id                | owner_id |                    ownership_period                     |     notes      |          created_at          | id | legal_name | display_name |              address              |      phone       |         email          | customer_type |         metadata          |          created_at          
--------------------------------------+-------------------+-----------------+---------+------------+------+------------+-----------+-----------------+--------------------------------+------------------------------+----+--------------------------------------+----------+---------------------------------------------------------+----------------+------------------------------+----+------------+--------------+-----------------------------------+------------------+------------------------+---------------+---------------------------+------------------------------
 00000000-0000-0000-0000-000000000001 | WDB1234561A654321 |               1 | Model X | Premium    | 2021 |      45350 | gasoline  | {fleet,company} | {"color": "black", "seats": 5} | Fri Nov 21 00:00:00 2025 PST |  1 | 00000000-0000-0000-0000-000000000001 |        1 | ["Wed Jan 01 00:00:00 2020","Fri Jan 01 00:00:00 2021"] | car looks good | Wed Nov 19 00:00:00 2025 PST |  1 | Max Muster | M. Muster    | Example Street 1, 1000 Sampletown | +41 44 999 99 99 | max.muster@example.com | private       | {"notes": "VIP customer"} | Thu Nov 20 00:00:00 2025 PST
(1 row)

-- Check if some postgis functions still work
SELECT ST_AsGeoJSON(location)
FROM management.garage;
                                                st_asgeojson                                                 
-------------------------------------------------------------------------------------------------------------
 {"type":"Point","crs":{"type":"name","properties":{"name":"EPSG:2056"}},"coordinates":[7.588576,47.559598]}
 {"type":"Point","crs":{"type":"name","properties":{"name":"EPSG:2056"}},"coordinates":[6.143157,46.204391]}
 {"type":"Point","crs":{"type":"name","properties":{"name":"EPSG:2056"}},"coordinates":[6.64,46.52]}
 {"type":"Point","crs":{"type":"name","properties":{"name":"EPSG:2056"}},"coordinates":[9.37,47.42]}
 {"type":"Point","crs":{"type":"name","properties":{"name":"EPSG:2056"}},"coordinates":[2600000,1200000]}
(5 rows)

SELECT ST_AsGeoJSON(location)
FROM management.manufacturer;
                       st_asgeojson                        
-----------------------------------------------------------
 {"type":"Point","coordinates":[8.541694,47.376887]}
 {"type":"Point","coordinates":[7.4474,46.9481]}
 {"type":"Point","coordinates":[8.6,47]}
 {"type":"Point","coordinates":[8.55,47.01]}
 {"type":"Point","coordinates":[7.438632421,46.951082772]}
(5 rows)

-- Check if unique constraint works
INSERT INTO management.owner (legal_name, display_name, address, phone, email, customer_type, metadata)
VALUES ('Max Muster',
        'M. Muster',
        'Example Street 2, 1000 Sampletown',
        '+41 44 000 00 02',
        'max.muster@example.com',
        'private',
        '{
            "notes": "Not VIP customer"
        }'::jsonb);
ERROR:  duplicate key value violates unique constraint "owner_email_key" for table management.owner: (email = max.muster@example.com)
CONTEXT:  PL/pgSQL function _vie_trigger.check_for_duplicate_constraint(text,text,text,text[],record,record) line 51 at RAISE
SQL statement "SELECT _vie_trigger.check_for_duplicate_constraint(
                    v_view_schema,
                    v_view_name,
                    l_constraint.constraint_name,
                    l_constraint.constraint_columns,
                    NEW,
                    OLD
                    )"
PL/pgSQL function _vie_trigger.generic_dml_trigger() line 70 at PERFORM
-- =========================================================
-- STEP 10: Delete tests (failing ones at the end)
-- =========================================================
SELECT set_commit_author('bob@example.com');
 set_commit_author 
-------------------
 
(1 row)

-- Delete from maintenance_ticket (no dependencies)
DELETE
FROM management.maintenance_ticket
WHERE custom_name_id = 90001;
SELECT *
FROM management.maintenance_ticket;
 custom_name_id |              service_id              | reported_by |               description                | status |          created_at          
----------------+--------------------------------------+-------------+------------------------------------------+--------+------------------------------
              1 | 00000000-0000-0000-0000-000000000002 |           1 | Customer reports vibration at high speed | open   | Tue Nov 11 00:00:00 2025 PST
          90002 | 22222222-2222-2222-2222-222222222222 |        3002 | Strange noise from front tires           | open   | Tue Nov 11 00:00:00 2025 PST
(2 rows)

-- Delete from inspection (no dependencies)
DELETE
FROM management.inspection
WHERE id = 9001;
SELECT *
FROM management.inspection;
  id  |              service_id              | inspector_name | passed | issues_found |         performed_at         
------+--------------------------------------+----------------+--------+--------------+------------------------------
    1 | 00000000-0000-0000-0000-000000000002 | Richard Roe    | t      | []           | Tue Nov 18 00:00:00 2025 PST
 9002 | 22222222-2222-2222-2222-222222222222 | Jane Roe       | t      | []           | Tue Nov 18 00:00:00 2025 PST
(2 rows)

-- Delete from car_feature (no dependencies)
DELETE
FROM management.car_feature
WHERE id = 70001;
SELECT *
FROM management.car_feature;
  id   |                car_id                | feature_id |         installed_at         | removed_at | installed_by |         notes         
-------+--------------------------------------+------------+------------------------------+------------+--------------+-----------------------
     1 | 00000000-0000-0000-0000-000000000001 |          1 | Mon Nov 10 00:00:00 2025 PST |            |            1 | Installed at purchase
 70002 | 22222222-2222-2222-2222-222222222222 |       6002 | Mon Nov 10 00:00:00 2025 PST |            |         7002 | Optional install
(2 rows)

-- Delete from feature (safe delete - no remaining references)
DELETE
FROM management.feature
WHERE feature_id = 6001;
SELECT *
FROM management.feature;
 feature_id |      name       |          description           |          created_at          
------------+-----------------+--------------------------------+------------------------------
          1 | Heated Seats    | Seats with internal heating    | Fri Nov 14 00:00:00 2025 PST
       6002 | Parking Sensors | Front and rear parking sensors | Fri Nov 14 00:00:00 2025 PST
(2 rows)

-- Delete from telematics_snapshot (no dependencies)
DELETE
FROM telematic.telematics_snapshot
WHERE id = 10001;
SELECT *
FROM telematic.telematics_snapshot;
  id   |                car_id                |         snapshot_ts          | dtc_codes |          telematics           | speed_range |                 gps                 | engine_state 
-------+--------------------------------------+------------------------------+-----------+-------------------------------+-------------+-------------------------------------+--------------
     1 | 00000000-0000-0000-0000-000000000001 | Mon Nov 10 00:00:00 2025 PST | {}        | {"temp_c": 22, "battery": 98} | [0,121)     | {"lat": 47.376887, "lon": 8.541694} | ok
 10002 | 22222222-2222-2222-2222-222222222222 | Mon Nov 10 00:00:00 2025 PST | {}        | {"temp_c": 18, "battery": 85} | [0,111)     | {"lat": 46.9481, "lon": 7.4474}     | ok
(2 rows)

-- Delete from car_owner_history (no dependencies)
DELETE
FROM management.car_owner_history
WHERE id = 1;
SELECT *
FROM management.car_owner_history;
 id | car_id | owner_id | ownership_period | notes | created_at 
----+--------+----------+------------------+-------+------------
(0 rows)

-- Delete from tire_set_log (no dependencies)
DELETE
FROM management.tire_set_log
WHERE front_left_tire_id = 2001;
SELECT *
FROM management.tire_set_log;
 id | front_left_tire_id | front_right_tire_id | rear_left_tire_id | rear_right_tire_id |                                log                                 |          created_at          
----+--------------------+---------------------+-------------------+--------------------+--------------------------------------------------------------------+------------------------------
  1 |                  1 |                   1 |                 1 |                  1 | Intern accidentally punctured the left rear tire, we just glued it | Fri Nov 28 00:00:00 2025 PST
  4 |               2003 |                2003 |              2003 |               2003 | Tires rotated and balanced                                         | Fri Nov 28 00:00:00 2025 PST
  5 |               2004 |                2004 |              2004 |               2004 | Stored for summer season                                           | Fri Nov 28 00:00:00 2025 PST
(3 rows)

-- Delete from garage_mechanic (no dependencies blocking this)
DELETE
FROM management.garage_mechanic
WHERE garage_id = 5001
  AND mechanic_id = 7001;
SELECT *
FROM management.garage_mechanic;
 garage_id | mechanic_id |                       shift_range                       |  role   |          created_at          
-----------+-------------+---------------------------------------------------------+---------+------------------------------
      5002 |        7002 | ["Mon Nov 03 08:00:00 2025","Mon Nov 03 16:00:00 2025") | morning | Mon Nov 17 00:00:00 2025 PST
         1 |           1 | ["Sat Nov 01 08:00:00 2025","Sat Nov 01 16:00:00 2025") | lead    | Mon Nov 17 00:00:00 2025 PST
(2 rows)

-- Delete from service_record (cascades to inspection)
DELETE
FROM management.service_record
WHERE service_id = '22222222-2222-2222-2222-222222222222'::uuid;
SELECT *
FROM management.service_record;
              service_id              |                car_id                | mechanic_id | garage_id | related_service_id | tire_id | service_type |  cost  |              notes              | service_window | diagnostic_data |          created_at          
--------------------------------------+--------------------------------------+-------------+-----------+--------------------+---------+--------------+--------+---------------------------------+----------------+-----------------+------------------------------
 00000000-0000-0000-0000-000000000002 | 00000000-0000-0000-0000-000000000001 |           1 |         1 |                    |       1 | maintenance  | 274.99 | Oil change and basic inspection |                |                 | Sun Nov 16 00:00:00 2025 PST
 33333333-3333-3333-3333-333333333333 | 22222222-2222-2222-2222-222222222222 |             |           |                    |         | inspection   | 329.99 | Pre-winter inspection           |                |                 | Sun Nov 16 00:00:00 2025 PST
(2 rows)

-- Delete from mechanic (SET NULL on service_record, car_feature, garage_mechanic CASCADE)
DELETE
FROM management.mechanic
WHERE mechanic_id = 7001;
SELECT *
FROM management.mechanic;
 mechanic_id | garage_id |    full_name     |      certifications       | hire_date  | skill_level | active |     notes     |          created_at          
-------------+-----------+------------------+---------------------------+------------+-------------+--------+---------------+------------------------------
        7002 |      5002 | Joe Bloggs       | {"ASE C1"}                | 03-10-2019 | mid         | t      |               | Tue Nov 18 00:00:00 2025 PST
        7003 |      5003 | Fred Nurk        | {"ASE B1"}                | 01-01-2022 | junior      | t      |               | Tue Nov 18 00:00:00 2025 PST
        7004 |      5004 | Erika Mustermann | {"ASE A2"}                | 06-15-2021 | mid         | t      |               | Tue Nov 18 00:00:00 2025 PST
           1 |         1 | John Doe         | {"ASE A1","EV Certified"} | 05-01-2018 | senior      | t      | Lead mechanic | Tue Nov 18 00:00:00 2025 PST
(4 rows)

-- Delete from garage (SET NULL on mechanic, service_record, tire_set, self-reference)
DELETE
FROM management.garage
WHERE garage_id = 5001;
SELECT *
FROM management.garage;
 garage_id | parent_garage_id |       name        |                      location                      |           services_offered           |                  opening_hours                   | rating |          created_at          
-----------+------------------+-------------------+----------------------------------------------------+--------------------------------------+--------------------------------------------------+--------+------------------------------
      5002 |                  | East Garage       | 0101000020080800001EC6A4BF97921840624CFA7B291A4740 | {tyre_change,inspection}             | {"mon-fri": "08:00-18:00"}                       |   4.10 | Sat Nov 22 00:00:00 2025 PST
      5003 |                  | West Garage       | 0101000020080800008FC2F5285C8F1A40C3F5285C8F424740 | {inspection,tyre_change}             | {"mon-fri": "08-18"}                             |   4.00 | Sat Nov 22 00:00:00 2025 PST
      5004 |                  | St. Gallen Garage | 0101000020080800003D0AD7A370BD2240F6285C8FC2B54740 | {maintenance,inspection}             | {"mon-fri": "07-17"}                             |   4.30 | Sat Nov 22 00:00:00 2025 PST
         1 |                  | Central Garage    | 0101000020080800000000000020D6434100000000804F3241 | {tyre_change,inspection,maintenance} | {"sat": "09:00-14:00", "mon-fri": "08:00-18:00"} |   4.80 | Sat Nov 22 00:00:00 2025 PST
(4 rows)

-- Delete from owner (SET NULL on maintenance_ticket, CASCADE on car_owner_history)
DELETE
FROM management.owner
WHERE id = 3001;
SELECT *
FROM management.owner;
  id  |    legal_name    | display_name |              address               |      phone       |            email            | customer_type |         metadata          |          created_at          
------+------------------+--------------+------------------------------------+------------------+-----------------------------+---------------+---------------------------+------------------------------
 3002 | Sample Autos Ltd | Sample Autos | Example Street 12, 1000 Sampletown | +41 41 000 22 33 | contact@sampleautos.example | corporate     | {"fleet_size": 15}        | Thu Nov 20 00:00:00 2025 PST
 3003 | Example Corp A   | Hug          | Industrial Str. 1                  | +41 41 123 45 67 | corp-a@example.com          | corporate     | {}                        | Thu Nov 20 00:00:00 2025 PST
 3004 | Example Corp B   | Meyer        | Main Str. 12                       | +41 44 765 43 21 | corp-b@example.com          | corporate     | {}                        | Thu Nov 20 00:00:00 2025 PST
    1 | Max Muster       | M. Muster    | Example Street 1, 1000 Sampletown  | +41 44 999 99 99 | max.muster@example.com      | private       | {"notes": "VIP customer"} | Thu Nov 20 00:00:00 2025 PST
(4 rows)

-- Delete from car (CASCADE on car_owner_history, car_feature, telematics_snapshot, service_record, SET NULL on tire_set)
DELETE
FROM management.car
WHERE id = '11111111-1111-1111-1111-111111111111'::uuid;
SELECT *
FROM management.car;
                  id                  |        vin        | manufacturer_id |  model  | model_trim | year | mileage_km | fuel_type |      tags       |             options             |          created_at          
--------------------------------------+-------------------+-----------------+---------+------------+------+------------+-----------+-----------------+---------------------------------+------------------------------
 22222222-2222-2222-2222-222222222222 | VF1RFB00456812345 |                 | Model A | Comfort    | 2019 |      38000 | diesel    | {company}       | {"color": "silver", "seats": 5} | Fri Nov 21 00:00:00 2025 PST
 00000000-0000-0000-0000-000000000001 | WDB1234561A654321 |               1 | Model X | Premium    | 2021 |      45350 | gasoline  | {fleet,company} | {"color": "black", "seats": 5}  | Fri Nov 21 00:00:00 2025 PST
(2 rows)

-- Delete from manufacturer (SET NULL on car and tire)
DELETE
FROM management.manufacturer
WHERE id = 1001;
SELECT *
FROM management.manufacturer;
  id  |          name          |                      location                      | founded_year |                                  details                                  |          created_at          
------+------------------------+----------------------------------------------------+--------------+---------------------------------------------------------------------------+------------------------------
 1002 | Demo Wheels Ltd        | 0101000020E6100000EEEBC03923CA1D4036AB3E575B794740 |         1982 | {"special": "off-road", "website": "https://demowheels.example"}          | Sun Nov 23 00:00:00 2025 PST
 1003 | Placeholder Wheels Ltd | 0101000020E610000033333333333321400000000000804740 |         1990 | {"notes": "importer"}                                                     | Sun Nov 23 00:00:00 2025 PST
 1004 | TireMasters            | 0101000020E61000009A99999999192140E17A14AE47814740 |         1985 | {"notes": "premium"}                                                      | Sun Nov 23 00:00:00 2025 PST
    1 | Example Tyres Ltd      | 0101000020E61000005E707ADB28C11D40DA7C8C14BD794740 |         1959 | {"notes": "HQ in Switzerland", "website": "https://exampletyres.example"} | Sun Nov 23 00:00:00 2025 PST
(4 rows)

-- =========================================================
-- Failing deletes (RESTRICT constraints) - should throw errors
-- =========================================================
-- Delete from tire_set (has tire_set_log references with composite FK) - should fail RESTRICT
DELETE
FROM management.tire_set
WHERE car_id = '00000000-0000-0000-0000-000000000001'::uuid;
SELECT *
FROM management.tire_set;
                car_id                | front_left_tire_id | front_right_tire_id | rear_left_tire_id | rear_right_tire_id | set_status | mounted_at | removed_at | storage_garage_id | notes 
--------------------------------------+--------------------+---------------------+-------------------+--------------------+------------+------------+------------+-------------------+-------
 22222222-2222-2222-2222-222222222222 |               2002 |                2002 |              2002 |               2002 | stored     |            |            |              5002 | 
                                      |               2003 |                2003 |              2003 |               2003 | mounted    |            |            |              5003 | 
                                      |               2004 |                2004 |              2004 |               2004 | stored     |            |            |              5004 | 
 11111111-1111-1111-1111-111111111111 |               2001 |                2001 |              2001 |               2001 | disposed   |            |            |              5001 | 
(4 rows)

-- Delete from tire (referenced by tire_set with ON DELETE RESTRICT) - should fail
DELETE
FROM management.tire
WHERE id = 2001;
SELECT *
FROM management.tire;
  id  | production_date | tire_type | size_text | profile_mm_left |    brand    | pressure_psi | status  | manufacturer_id |  notes   |          created_at          
------+-----------------+-----------+-----------+-----------------+-------------+--------------+---------+-----------------+----------+------------------------------
 2002 | 01-20-2025      | summer    | 225/45R17 |             8.0 | AlpineGrip  |        33.50 | mounted |            1002 |          | Mon Nov 24 00:00:00 2025 PST
 2003 | 03-10-2025      | summer    | 205/55R16 |             7.5 | WheelPro    |        32.00 | mounted |            1003 |          | Mon Nov 24 00:00:00 2025 PST
 2004 | 03-11-2025      | winter    | 195/65R15 |             8.0 | TireMasters |        34.00 | stored  |            1004 |          | Mon Nov 24 00:00:00 2025 PST
    1 | 06-15-2024      | summer    | 205/55R16 |             7.0 | GoodTyre    |        32.00 | stored  |               1 | Batch A1 | Mon Nov 24 00:00:00 2025 PST
(4 rows)

-- =========================================================
-- STEP 11: Check tree, commit and commit_tree
-- =========================================================
SELECT 'commit_hash_' || RANK() OVER (ORDER BY commit.created_at) AS hash, parent_commit.rank AS parent_hash, commit.author, commit.message
FROM _vie.commit AS commit
         LEFT JOIN (SELECT hash, 'commit_hash_' || RANK() OVER (ORDER BY created_at) AS rank
                    FROM _vie.commit) AS parent_commit ON parent_commit.hash = commit.parent_hash
ORDER BY created_at;
      hash      |  parent_hash   |      author       |    message     
----------------+----------------+-------------------+----------------
 commit_hash_1  |                | superuser         | Initial commit
 commit_hash_2  | commit_hash_1  | alice@example.com | Auto-commit
 commit_hash_3  | commit_hash_2  | alice@example.com | Auto-commit
 commit_hash_4  | commit_hash_3  | alice@example.com | Auto-commit
 commit_hash_5  | commit_hash_4  | alice@example.com | Auto-commit
 commit_hash_6  | commit_hash_5  | alice@example.com | Auto-commit
 commit_hash_7  | commit_hash_6  | alice@example.com | Auto-commit
 commit_hash_8  | commit_hash_7  | alice@example.com | Auto-commit
 commit_hash_9  | commit_hash_8  | alice@example.com | Auto-commit
 commit_hash_10 | commit_hash_9  | alice@example.com | Auto-commit
 commit_hash_11 | commit_hash_10 | alice@example.com | Auto-commit
 commit_hash_12 | commit_hash_11 | alice@example.com | Auto-commit
 commit_hash_13 | commit_hash_12 | alice@example.com | Auto-commit
 commit_hash_14 | commit_hash_13 | alice@example.com | Auto-commit
 commit_hash_15 | commit_hash_14 | alice@example.com | Auto-commit
 commit_hash_16 | commit_hash_15 | alice@example.com | Auto-commit
 commit_hash_17 | commit_hash_16 | alice@example.com | Auto-commit
 commit_hash_18 | commit_hash_17 | alice@example.com | Auto-commit
 commit_hash_19 | commit_hash_18 | alice@example.com | Auto-commit
 commit_hash_20 | commit_hash_19 | bob@example.com   | Auto-commit
 commit_hash_21 | commit_hash_20 | bob@example.com   | Auto-commit
 commit_hash_22 | commit_hash_21 | bob@example.com   | Auto-commit
 commit_hash_23 | commit_hash_22 | bob@example.com   | Auto-commit
 commit_hash_24 | commit_hash_23 | bob@example.com   | Auto-commit
 commit_hash_25 | commit_hash_24 | bob@example.com   | Auto-commit
 commit_hash_26 | commit_hash_25 | bob@example.com   | Auto-commit
 commit_hash_27 | commit_hash_26 | bob@example.com   | Auto-commit
 commit_hash_28 | commit_hash_27 | bob@example.com   | Auto-commit
 commit_hash_29 | commit_hash_28 | bob@example.com   | Auto-commit
 commit_hash_30 | commit_hash_29 | bob@example.com   | Auto-commit
 commit_hash_31 | commit_hash_30 | bob@example.com   | Auto-commit
 commit_hash_32 | commit_hash_31 | bob@example.com   | Auto-commit
 commit_hash_33 | commit_hash_32 | alice@example.com | Auto-commit
 commit_hash_34 | commit_hash_33 | alice@example.com | Auto-commit
 commit_hash_35 | commit_hash_34 | alice@example.com | Auto-commit
 commit_hash_36 | commit_hash_35 | alice@example.com | Auto-commit
 commit_hash_37 | commit_hash_36 | alice@example.com | Auto-commit
 commit_hash_38 | commit_hash_37 | alice@example.com | Auto-commit
 commit_hash_39 | commit_hash_38 | alice@example.com | Auto-commit
 commit_hash_40 | commit_hash_39 | bob@example.com   | Auto-commit
 commit_hash_41 | commit_hash_40 | bob@example.com   | Auto-commit
 commit_hash_42 | commit_hash_41 | bob@example.com   | Auto-commit
 commit_hash_43 | commit_hash_42 | bob@example.com   | Auto-commit
 commit_hash_44 | commit_hash_43 | bob@example.com   | Auto-commit
 commit_hash_45 | commit_hash_44 | bob@example.com   | Auto-commit
 commit_hash_46 | commit_hash_45 | bob@example.com   | Auto-commit
 commit_hash_47 | commit_hash_46 | bob@example.com   | Auto-commit
 commit_hash_48 | commit_hash_47 | bob@example.com   | Auto-commit
 commit_hash_49 | commit_hash_48 | bob@example.com   | Auto-commit
 commit_hash_50 | commit_hash_49 | bob@example.com   | Auto-commit
 commit_hash_51 | commit_hash_50 | bob@example.com   | Auto-commit
 commit_hash_52 | commit_hash_51 | bob@example.com   | Auto-commit
 commit_hash_53 | commit_hash_52 | bob@example.com   | Auto-commit
 commit_hash_54 | commit_hash_53 | bob@example.com   | Auto-commit
 commit_hash_55 | commit_hash_54 | bob@example.com   | Auto-commit
 commit_hash_56 | commit_hash_55 | bob@example.com   | Auto-commit
 commit_hash_57 | commit_hash_56 | bob@example.com   | Auto-commit
 commit_hash_58 | commit_hash_57 | bob@example.com   | Auto-commit
 commit_hash_59 | commit_hash_58 | bob@example.com   | Auto-commit
 commit_hash_60 | commit_hash_59 | bob@example.com   | Auto-commit
 commit_hash_61 | commit_hash_60 | bob@example.com   | Auto-commit
 commit_hash_62 | commit_hash_61 | bob@example.com   | Auto-commit
 commit_hash_63 | commit_hash_62 | bob@example.com   | Auto-commit
 commit_hash_64 | commit_hash_63 | bob@example.com   | Auto-commit
 commit_hash_65 | commit_hash_64 | bob@example.com   | Auto-commit
 commit_hash_66 | commit_hash_65 | bob@example.com   | Auto-commit
 commit_hash_67 | commit_hash_66 | bob@example.com   | Auto-commit
 commit_hash_68 | commit_hash_67 | bob@example.com   | Auto-commit
 commit_hash_69 | commit_hash_68 | bob@example.com   | Auto-commit
(69 rows)

SELECT tree.*
FROM _vie.tree
    INNER JOIN _vie.commit_tree ON commit_tree.tree_hash = tree.hash
         LEFT JOIN (SELECT hash, RANK() OVER (ORDER BY created_at) AS rank
                    FROM _vie.commit) AS commit ON commit.hash = commit_tree.commit_hash
ORDER BY commit.rank, tree.hash;
                                hash                                | table_schema |     table_name      |                                                   original_pks                                                   |                              row_hash                              
--------------------------------------------------------------------+--------------+---------------------+------------------------------------------------------------------------------------------------------------------+--------------------------------------------------------------------
 \x0634611b052b4683fec67c5a104ad6e82cb2ea3d2e0b565c1a5d582f4edf0ff8 | management   | service_record      | {"service_id": "00000000-0000-0000-0000-000000000002"}                                                           | \xaaad14c7f0935d6d971fbcd337b7e21c7596fcd1739af53e3d44ef971135785d
 \x1b0e48925dc05be0a11833bc9f8ef7f6d258b62b939fdf7c4033889bb325dd63 | management   | tire                | {"id": 1}                                                                                                        | \xd17ca495ff02efdcbf3a7bb8d1c8557a4d2f7cea6ba6471f403983c22d863061
 \x2f1fb48fa2361d2d56147123b1ea3db1762da68985eccaa065dbad27bc73d545 | telematic    | telematics_snapshot | {"id": 1}                                                                                                        | \xc3889c276bb1a067ede2d9c919b2502ff9c28f73f2660d62429941f71cc8ea72
 \x38bd1f02909f072ee3723f1474472b20701d2e4b6e8e150d898b994c0f92ddee | management   | garage_mechanic     | {"garage_id": 1, "mechanic_id": 1}                                                                               | \x8de8f892a5359de981f1f97e868d48faa47e92e4fee31b6c809801a015f81142
 \x418614ff9b8b525314deadf38ee50fddc8bfb34f7f2a9877199960bb96fc2ebb | management   | tire_set            | {"rear_left_tire_id": 1, "front_left_tire_id": 1, "rear_right_tire_id": 1, "front_right_tire_id": 1}             | \x6f3a165fea441ab2dcf15c89dd005e9fbd9b358ed66d6c86ff1a785a293496b7
 \x5d84dc21fb33b40d56b5294f6badb8df7fa9019fad216d2260fef97e2beb51e3 | management   | tire_set_log        | {"id": 1}                                                                                                        | \x710b2f79833736c85fcfa00c5c6ab6bc9d00d84db497d112df48a2b6a57ba319
 \x60cc2ef015279aef3bf4d8fbdd305d9f0ff36f43c5c8eecaf4a903262769bb9b | management   | garage              | {"garage_id": 1}                                                                                                 | \x85ee7c7c3784bc816e9b2cca16b813c37f857356324195a869628382e09e1ce5
 \x64f24611611408bf5b690b70e35c2d7646dc42f2eb55afb88885653d2c32516c | management   | mechanic            | {"mechanic_id": 1}                                                                                               | \x5edf4351a4481f7ced880a819c65c89eaaaa79b495540a7e47632f99941791d6
 \x7ba8ba96abde60465e054806c72fb39eb571c70a4b05e3ca9d2178a8c9e07dc6 | management   | car_owner_history   | {"id": 1}                                                                                                        | \x92bccf3c4d29dd8aaec4a89313ad85b453f71c14c4d02d902da63ddba0ec11e3
 \x7e2fb55bd01a66661f247cefd896211ebb3f37e4d370c6a6e13bd69d50df0271 | management   | manufacturer        | {"id": 1}                                                                                                        | \x3dc5fe55300d6343219eda612ba2aec12122594d6fb7eb85e2666bd3e9693241
 \x848ace6db2b077d30173290a8f77e52ddc64647140769e4b655ed822cb5b8919 | management   | owner               | {"id": 1}                                                                                                        | \xe20cdd65ecfdaff0b0a8b417c7d7415cf1c3198b1958d9e010cfef001b31fefc
 \xaf6db0b28a5bc49044f07344b7e1a4d7e2200da4c9d0a32fdf40031664ebcf19 | management   | car                 | {"id": "00000000-0000-0000-0000-000000000001"}                                                                   | \x42a998e58f7b33dcfba5bf8f241ca236d799bd7157ea7e214852d4091fd9c6ab
 \xbd11e15f1ee3d1e40ba40c24827f35dae1eb1d0afbe0d5e6e0c12b655347c373 | management   | maintenance_ticket  | {"custom_name_id": 1}                                                                                            | \x51a529003a6d515332bd5a49b84923a4aacc1dc65f04f27d9408cf2b599030bd
 \xdcb1bf7539fc08e843c804b23d1b87c2067bbe3b53ad6e27090c846a0bf49404 | management   | car_feature         | {"id": 1}                                                                                                        | \x58a494958b16688eb608536e1ec7a47432c0bc6300ba31d08ce761675e2f0956
 \xe255322230c6eefec92998f14b4d6c763ed2bd3cd5b9419a470c219caf032a0d | management   | feature             | {"feature_id": 1}                                                                                                | \x497810f12683095d64d460f4a2ba9bf20fc8ffc94bf78b2f4554a92aca90c832
 \xe3aa90582cfb2bcad26408755cb7c42f23848d645b2de85ce755dc403b706486 | management   | inspection          | {"id": 1}                                                                                                        | \xae95205bfaeac9b8a94ea594909e35bb481e0242810a2c88b24b7600ef303d2f
 \xdc5d101757964c02b98600e45b382080b68bf50d6b37260d7d30e8ef6e83a41b | management   | manufacturer        | {"id": 1001}                                                                                                     | \x768045dfc258396d4d6120dfd25e8721a0e9fee12112c7064c5b2523cfb1a38d
 \xbb0584b29144900d6f9b4f39c51118646ccd78f8dbdd90f18e575836c576961b | management   | garage              | {"garage_id": 5001}                                                                                              | \x6639458be65c42fae1247ba69d233b4c15f31b5965d6ce010fa9a7919c412220
 \x526ee630e6e925425f7701be448ee417aa5404b48748e2b5802cf0db7170c250 | management   | owner               | {"id": 3001}                                                                                                     | \x05a1bf069c31ecc9f5ac04a9e27f71c7a7f4ae2b6459bde4593d4ecb102db420
 \x609306d46103e4ca7b440e1f1aa26c433f6e708eed36e35cda9b78c169fbd2ee | management   | tire                | {"id": 2001}                                                                                                     | \x6db9e0d97a30b54bcda2684fa92c935a6e1d73598291fd3dc7d22a2d3b739feb
 \x9138b030b2898344ce5c99e8b3ca146d8211c652faa8919f6a4ceed09257745b | management   | car                 | {"id": "11111111-1111-1111-1111-111111111111"}                                                                   | \xaeeafbaff8d52420acfd4a3deac9bd5f2935cb92a742a4f18efc005e10b3c5ca
 \x486634e902db06ad0914044921a11ee6e344a710d56459a8c53471b905b9de6d | management   | car                 | {"id": "22222222-2222-2222-2222-222222222222"}                                                                   | \x58a3c0c2f4b8ad6b848d6e994f107bc79bdafa716303846e1978bfa38efd43a3
 \x0545069d1461597c1f23a94c5eb8151393fca93cc06e6b36ed972a46fec6b05b | management   | tire_set            | {"rear_left_tire_id": 2001, "front_left_tire_id": 2001, "rear_right_tire_id": 2001, "front_right_tire_id": 2001} | \xbe9f294d13abaa61cc6a70c447c4f4c491c41093e938de62e0c422f132c199a1
 \xea6480057d6bbf6ccf7b9a1095f734ad614f51d701c0cf2deca82a9e2f0a6105 | management   | tire_set_log        | {"id": 2}                                                                                                        | \xcd2438aee13a18978626bc24db66ae0c4d525c696eb1849a37b764b624459853
 \x3b2709ee35eb98d281aea56a3a6be43855a8636503e6cebc27223bcdeea8ffa7 | management   | mechanic            | {"mechanic_id": 7001}                                                                                            | \x8d1affbf94a12191358a5f4f65cf80ec9c9ae2e7be96326dea0215136b03ff89
 \xbac76aa0f86d404d6002a69811955a2dc0adc18d664b2df6027031d821289d90 | management   | garage_mechanic     | {"garage_id": 5001, "mechanic_id": 7001}                                                                         | \x70c9d21866ddd5da33727c0b563856a45a93c424f387b918cbe900da2754d756
 \x6f8ebf27990b7140e605f1ca4ccad242dc726b4ad577b25e83bfe6693ac07a6d | management   | service_record      | {"service_id": "22222222-2222-2222-2222-222222222222"}                                                           | \xd5f0a0c283d99061ac8bef774f02463914e71e11d36f990b4dcef92c44a9fdf8
 \x2d99d9aa1285e0617043878787d2d4b68de525d46045a4acb754b93e61519cd4 | management   | service_record      | {"service_id": "33333333-3333-3333-3333-333333333333"}                                                           | \x794fb4ccd4d5624b257db94416adb09eb5862aade0aa6616690418bcb958b356
 \x2c3c20fda9a0a53348c47bd116beaba47e23c0b643ecea4047947a980dcb81e1 | management   | inspection          | {"id": 9001}                                                                                                     | \x29e3db2ad667e184c63d4695a49dab719deac307f67daf469ff6e83372291a2f
 \xde7199a7bc496e013b75b2fd1075b41c670fa7606da53017c81dd15879ce3c4a | management   | feature             | {"feature_id": 6001}                                                                                             | \x777824d319e432c1542c5400d396a47713af38e82bc1465df10b8be7b74172f6
 \x08b0e0398b1f0276e703c0a3b15e6641cd5ff761c2f443810af30a2adf1c7e9f | management   | car_feature         | {"id": 70001}                                                                                                    | \x2cde8a76cfb760aab3669d95a6efee5b76750f6e69aaf054a50bdfea2166c879
 \x603db8ab9e7a3c5cab2d342ede4a406cb99e68ae1d8ba3c6b609d9a357221880 | telematic    | telematics_snapshot | {"id": 10001}                                                                                                    | \x07be8572f7bee9d83691dbaef06881d0b9bcd0beea047ac95db9dfcb2ec49b59
 \x3934a6a47bf74ee54ecd61c4f9f9c7a2a2f161688aed589065937fde9da8ff46 | management   | maintenance_ticket  | {"custom_name_id": 90001}                                                                                        | \x669608bc9780d98ae92fbc5a31efe7525a575346ad8305008374f553fd91844b
 \xc6b7ad97900459270ae0138479a9db705cc8ee1150741c2aa1c42b49f3aac4b8 | management   | manufacturer        | {"id": 1002}                                                                                                     | \xa8a057d3a0acc3ba033d11acfcc6a1d346f65fdc35af14500a2808abf5dafaaf
 \x66170986cab6c6da24e0b866a23fe0a8876550dc2f7bc373665c5edf164a1349 | management   | garage              | {"garage_id": 5002}                                                                                              | \xbd2aabc62b2a1d593a9a9029ad6fc2ac1c41793e87fb9b20eacc88ae6a45923c
 \x86794c06fd0fffbeb056b438614a024316364eaf7fa198036e79e6d513364a1b | management   | owner               | {"id": 3002}                                                                                                     | \x1079d9d18fe0293133cc55ff2581847276d8711f3acb9058b19c8e2b5464b9c8
 \x08c17a5acf6855e4ab97ae622cd4d7630a0a3a38504c3ea92503b1c921e4e97e | management   | tire                | {"id": 2002}                                                                                                     | \xb3f52cd604f9fe0b50bb870772fdc3e649ccc579626ce738b7a4bc12b056c27e
 \x8a943603261f59918be19eb6bd91f817d8c34b616e6df469dde75773f8fd3bdb | management   | tire_set            | {"rear_left_tire_id": 2002, "front_left_tire_id": 2002, "rear_right_tire_id": 2002, "front_right_tire_id": 2002} | \xed073451dc188587f1bd3de7e6d6cd76b4e6bf477ed52a4c9f6e792b7f66b14c
 \x5c6c69d49e349f2e13505b5dd54bdff48a9e66e26d70cef6ee56dd51fede4862 | management   | tire_set_log        | {"id": 3}                                                                                                        | \x40817624376df00c0abc64a7b08a4facc4008219b76d2fa777fc6e90328fa2e7
 \x532972adae34a08ca473688f1e5d331d454562a3494d37b9d2623bcb2e0065ad | management   | mechanic            | {"mechanic_id": 7002}                                                                                            | \x9ae149d5317f2372007f5e6ad3ff28e8cf7c1f01c9cef5e44f48510c15c1dfc8
 \x4fa0e71952c73c281a20b49bab8ed0903e65fad8752f5602736b2bddb81805a9 | management   | garage_mechanic     | {"garage_id": 5002, "mechanic_id": 7002}                                                                         | \x87a80f670a3fbf6239daa50b4f397fe8284716735ca3a2a0437760b40b2268f9
 \xbe04b3c75c2467735daf299360c7b070a290085a3530ab027e1c795909daf744 | management   | inspection          | {"id": 9002}                                                                                                     | \x913322191988a6806cb265ac0d0f22341bacc8e30f9253b1b625f2916556e308
 \xab7cfa921cb28d3a3be794b6cd0d705408a7dca11f62f7d9c84fa55637b67c3b | management   | feature             | {"feature_id": 6002}                                                                                             | \x34f6262799987face52e86128009747d65379c9109da7cfb107c2eda52ceb4e1
 \xb315768c4b7c12f7c3ea0b1d1cce9facf1c90d439262486ea9f022b36821ab25 | management   | car_feature         | {"id": 70002}                                                                                                    | \x11e9bdfdeda4fe5b2862816a2084ff44f962e40f11b903187486c85c58d6d7ff
 \x0058eab7e5a99e6dea35bc1956bef7224fd3d758e7836480e31b5ff935bbfa01 | telematic    | telematics_snapshot | {"id": 10002}                                                                                                    | \xc9a9817ecc1e0910d715c33236d475129bef7db7c5f8bccb38d65a9fbc12f43f
 \x2bb61df243a23262e9b29f8a2f731d75c06318b57a609326f36d828e8ddea23a | management   | maintenance_ticket  | {"custom_name_id": 90002}                                                                                        | \x83b103b98ffa71ea58f0bb912ffcd520f184b5ea17a8e86fdff9d9cc9308050d
 \x69484c311ee576433565cece9519da7d5815f53beca6352a0129e9b2a22bd4bf | management   | manufacturer        | {"id": 1003}                                                                                                     | \xfa1dc3105bc6354336e0a6a02374730fb560f5318d401b6439bb60d69e693789
 \xb4dbc5604f92fb1005bb1899ead18a50de103ccb81099155f59bbe49b22e3145 | management   | manufacturer        | {"id": 1004}                                                                                                     | \x683bf04179df659059c6f7bd02df03d9eab776db7198ddbfd3858d1dbab2bad7
 \x532e8a2547a1cd3bac7331df001708a5c11a021bc5576e69d547e198cb9e6350 | management   | garage              | {"garage_id": 5004}                                                                                              | \x5f1958b46ac832ea3d9bbca0b454e17263905d22d68448c5c810a7f520305a86
 \xe1992e24f22689213af56c9eaee8887b4016e8db82620c22de8219e73935fa85 | management   | garage              | {"garage_id": 5003}                                                                                              | \x38831a338af234a6bceb44c282f5515524b43d979d231f3861ac7f59d9bbbfa2
 \xbd10ae7ae7fefbfe16de6404d503b40a1304b00177503b05d718fdae7db4e2f4 | management   | owner               | {"id": 3004}                                                                                                     | \xf90bc13887bb0ff3500b7a721adbb6c1d5a43f025f926017ca4e86317ee199ad
 \xc9cb68550b130dc6cf636454ba8350f25f77a1b3d582f4b2431c09b2c5c78cbd | management   | owner               | {"id": 3003}                                                                                                     | \x8e8a65b6de5621e79038b5608e988f0db0ca8f2a917e966d9cc8431ced810ac6
 \x06aa2c64d65525146c2ab81a27054891d36f59c62c359bbe400140dde92cd168 | management   | tire                | {"id": 2004}                                                                                                     | \xd704e518fba43c07bfb4da8d5a4004e8af366821d19c34a71127cf256c0064e8
 \x5bdc41d5936fc098a80a6acc6ec78b9e2eaf69d9c15ca61da03a06fb2354162a | management   | tire                | {"id": 2003}                                                                                                     | \xea87593e203658ce59ddee22a18a4e5bf0cbaba219470de9aa51b833f21e9dc1
 \x7fff527192b6c08fdeaa4171b36f9f5e41bfad294c466700a301f7579f882874 | management   | tire_set            | {"rear_left_tire_id": 2003, "front_left_tire_id": 2003, "rear_right_tire_id": 2003, "front_right_tire_id": 2003} | \x9864623329bc2631c0e43015ce61dc515f4532d2cb5dc36db162b4b5657b7b49
 \xa19cd5a4c6e53702a6ce602385dd8d079bc8cc26bda978fcbcb21926f861332e | management   | tire_set            | {"rear_left_tire_id": 2004, "front_left_tire_id": 2004, "rear_right_tire_id": 2004, "front_right_tire_id": 2004} | \x4fc51d0a03f436e407deabb71b20eb1b91d0fa22f29d39022e7dffd1f97e3633
 \x5c2009f7957dd1196521ad0b6d33c221b4cad705da132a86c830a3c9a7fc8167 | management   | tire_set_log        | {"id": 4}                                                                                                        | \x860f4cfae5dcebda01606ad89c39cfa632d64e786530a80e44627a5a43e8d7e5
 \xcf87c9f4096112ad0309aedc85a6b0f2055e662d16784fed4d15cfbec836ba87 | management   | tire_set_log        | {"id": 5}                                                                                                        | \xe8e60c6454f6133694c6b2886d6867260fac39f52327c2b635c4eea6c51ba065
 \xd7c914d8d631f4a01df6d1a382a4a63e8302dfb9674f63e4ab609ce8b6bdcbcd | management   | mechanic            | {"mechanic_id": 7003}                                                                                            | \x5fa781469b109394a2221b90814d4310655bcde3c0bc975ece1254de3282e159
 \xf9eefcb91d998dd470c8403e4dc84c0d5a3339ee8b00175b10b6fa1c401ad579 | management   | mechanic            | {"mechanic_id": 7004}                                                                                            | \xa42547b3b25abe7134775f43be47ffdc188cfff9e8d1570c0b2a4252a7f0a4fd
 \x3860cf70d4063aeb4d430306fc4ed85fb1ea9975c9ad45877c1ab202aa4cbafa | management   | manufacturer        | {"id": 1}                                                                                                        | \x307a48b7ab091d4438a8776f1cb758910edc9b5ce2eae9308b0a8dc8af63de23
 \x86eb00c386eb695390784a662b733a9a60206ec37efb7e50347470cb354faadd | management   | garage              | {"garage_id": 1}                                                                                                 | \x37915845393c79210e926ec2e8fdbd0ec1d2258e7eaf322b4ef9e85ce2b0c124
 \x2b991386e994dbb0f50de9a98cce4ab40a5f9553e9de245595e64a00391b3f5f | management   | owner               | {"id": 1}                                                                                                        | \xce9409298cb5160b25abc7b59fc6a73167d5193141dba4fd4fd2f1510556c8d6
 \x036655e28b7cb82c43869b129c0f2a81f81488e954a7edb488190f459f50cc78 | management   | tire                | {"id": 1}                                                                                                        | \x52dc362dc9f6a34f276b0ef339aec207b429613e1775f01b20b9d01d52da369a
 \x33bc640e0ae1f45a2d59b863035de39357a15b4310dbf84a44688d2356e94737 | management   | car                 | {"id": "00000000-0000-0000-0000-000000000001"}                                                                   | \x111cbc2d9c4868e845e18ac71a0ec4508eca171ac9c5816e18a7a2ba61e9cccc
 \xc3e53bdc83ea6d87ff2bf51228559a2ecb718ffcca680706a605e6c0ee8eb715 | management   | tire_set            | {"rear_left_tire_id": 2001, "front_left_tire_id": 2001, "rear_right_tire_id": 2001, "front_right_tire_id": 2001} | \x4207d0a0dc4a5e6cbd47d2b1dcf6c6c990c9cbed0296b51c4ddad59d03128e74
 \x3881cf485e546b193b837dcb4fec482ddc2020de60f054e23ee4f735a5ad1e2d | management   | mechanic            | {"mechanic_id": 1}                                                                                               | \xec69d636c17a810a5472de40bc3928058914762bcf648056b3e9320de5026547
 \xe70487d2bb96d8fdbaf4d207f590400b925c7a2c57dfe02894251b30ceb54495 | management   | garage_mechanic     | {"garage_id": 1, "mechanic_id": 1}                                                                               | \x0318ca43d8995397ec1996ade70bc598b37b8e3979562e5ba0ca204b03fb6ddf
 \x0194237841182aba38647f4637a64ff1921697af259b0de325c1a91781a53345 | management   | service_record      | {"service_id": "00000000-0000-0000-0000-000000000002"}                                                           | \x617e7beb929951f9df788ed6c2312799c510674796ee21b414d8e62531f1f8ef
 \x32d68d73e9421bee3b4b7e7a8f9192e8d7ccb05e5939d1e03d80d3e83f39f8a2 | management   | service_record      | {"service_id": "22222222-2222-2222-2222-222222222222"}                                                           | \x9f7c1e0fdcb2dfbcf91aa2234b812710ce6f3d8faa3a07c7cb3c68a0c4b5b12d
 \xd1f9b1912f7b4251c10bab8b8cff2007a5e987be9f609a26dd75877c350702ac | management   | service_record      | {"service_id": "33333333-3333-3333-3333-333333333333"}                                                           | \xe97932735631ad518bb9565af4a033df0660950195ee610648d0a2c29e0a5ab6
 \x6543e9f8fc48f36149bc9ed4a7df33bf8c058bbeb1ea19238deccb1c4829f14d | management   | inspection          | {"id": 9001}                                                                                                     | \xe5a966ae1b0a7223db8a9ca672b20935a30b6ac73708de6b61cce638852056aa
 \xc8ce60d6647b75f65bcadbc336c60c15069e60df744bc5e4f833b6a9caa40748 | management   | feature             | {"feature_id": 6001}                                                                                             | \x25344e3d055e57d80dbb1f6ed5f3271bdf2c41a32e2a74f17edac000a4d11711
 \x212ce5c6daedf23850860db330fa2b8c72d8210847260f0b6a34c90fa85d5469 | management   | car_feature         | {"id": 70001}                                                                                                    | \xaded482b69eeed7dc94bb17a4a664e690c3ffe38a20516fa33b8ce39dbdc4cce
 \x071b22905d51f866483f9099ca5b311c34347596f8cfec7f99f91d475c783b80 | telematic    | telematics_snapshot | {"id": 10001}                                                                                                    | \xd23ecfaaa3703980ce82305b56eeb7ba3fd08f34350e4ae812ebf8148fd79972
 \xcb98461fbb76683d0fbfeb4e5dfbd4c7c55c6316b0f67ec05862670da14816d0 | management   | car_owner_history   | {"id": 1}                                                                                                        | \x7bb0a3f92fede316ab4571ef62374d3b778339c2874951bfa0e194a94306a470
 \x4e09cecd622c2d980d89e472703fb1f3a3e73f6338c2cc380daae0c3278c5645 | management   | maintenance_ticket  | {"custom_name_id": 90001}                                                                                        | 
 \x4cf7c1da6100936169ca9eff370ec48b112fd86339aec7991feaa375672595b7 | management   | inspection          | {"id": 9001}                                                                                                     | 
 \x2983e7335f93d81d6e75f5d63b381ea0472d3f78a31ac948183cfad95a15ca5d | management   | car_feature         | {"id": 70001}                                                                                                    | 
 \xa5c3dc689a148ad79729daccff77e8ac8e798df66f2bdb3161c8c6637a55ae5e | management   | feature             | {"feature_id": 6001}                                                                                             | 
 \x39d608b9a7b5f885f023ebac08b8d8f5dba378247752efc9d792a6e996b8320f | telematic    | telematics_snapshot | {"id": 10001}                                                                                                    | 
 \x229fa4268520de42611230caf50a16883ab547b8925798afbf78153c5046d113 | management   | car_owner_history   | {"id": 1}                                                                                                        | 
 \x0a617f8a1e9e5dcc6faa0c87e1304cff5c6d58ccbb128e6e271e94cd0772e25e | management   | tire_set_log        | {"id": 2}                                                                                                        | 
 \x9d5c09fb765587e63cb76262dffe120fab142c3cea0bee1b48d965108dc3731c | management   | tire_set_log        | {"id": 3}                                                                                                        | 
 \x729ba8e92a36bd21c89eb0fd7d57eab7090a564b4c2f334e67ddc7a046c6032c | management   | garage_mechanic     | {"garage_id": 5001, "mechanic_id": 7001}                                                                         | 
 \x2727e951b91f4495148b3688e644cb6dffc76a650a335205a3a902eb8edb54e1 | management   | service_record      | {"service_id": "22222222-2222-2222-2222-222222222222"}                                                           | 
 \xe545fddb79566baed2bcb81f14268777ea884944c45bf39432407b6be61eb6d9 | management   | mechanic            | {"mechanic_id": 7001}                                                                                            | 
 \xf0378e10dd29eac669d390de0e78d91d5e8b8f6401542be9ccaf9a0c606d12b9 | management   | garage              | {"garage_id": 5001}                                                                                              | 
 \xbbb6c194f839d14b469c2a9bb6ed964117b0d04c0062785f81c45e7edefef17c | management   | owner               | {"id": 3001}                                                                                                     | 
 \x64638faceea103cec8fb6d9a762610ffe44e7a4cb42a09f797e0d6c8ffecf195 | management   | car                 | {"id": "11111111-1111-1111-1111-111111111111"}                                                                   | 
 \x438c2c7130f4f20abe91cf99c977a184b7f8e9e8ea5336f69681978f9d0922fc | management   | manufacturer        | {"id": 1001}                                                                                                     | 
 \x1f2efc0e19b400b916e75330e51a3c2447472728734c3f966e75e74e0b2767db | management   | tire_set            | {"rear_left_tire_id": 1, "front_left_tire_id": 1, "rear_right_tire_id": 1, "front_right_tire_id": 1}             | 
 \x6ab5ce1a2e1f9af9e1b2df9b41940454a6933339ec87f3b798e0a3292617861a | management   | tire                | {"id": 2001}                                                                                                     | 
(93 rows)

SELECT  'commit_hash_' || commit.rank, commit_tree.tree_hash
FROM _vie.commit_tree
         LEFT JOIN (SELECT hash, RANK() OVER (ORDER BY created_at) AS rank
                    FROM _vie.commit) AS commit ON commit.hash = commit_tree.commit_hash
ORDER BY commit.rank, commit_tree.tree_hash;
    ?column?    |                             tree_hash                              
----------------+--------------------------------------------------------------------
 commit_hash_2  | \x0634611b052b4683fec67c5a104ad6e82cb2ea3d2e0b565c1a5d582f4edf0ff8
 commit_hash_2  | \x1b0e48925dc05be0a11833bc9f8ef7f6d258b62b939fdf7c4033889bb325dd63
 commit_hash_2  | \x2f1fb48fa2361d2d56147123b1ea3db1762da68985eccaa065dbad27bc73d545
 commit_hash_2  | \x38bd1f02909f072ee3723f1474472b20701d2e4b6e8e150d898b994c0f92ddee
 commit_hash_2  | \x418614ff9b8b525314deadf38ee50fddc8bfb34f7f2a9877199960bb96fc2ebb
 commit_hash_2  | \x5d84dc21fb33b40d56b5294f6badb8df7fa9019fad216d2260fef97e2beb51e3
 commit_hash_2  | \x60cc2ef015279aef3bf4d8fbdd305d9f0ff36f43c5c8eecaf4a903262769bb9b
 commit_hash_2  | \x64f24611611408bf5b690b70e35c2d7646dc42f2eb55afb88885653d2c32516c
 commit_hash_2  | \x7ba8ba96abde60465e054806c72fb39eb571c70a4b05e3ca9d2178a8c9e07dc6
 commit_hash_2  | \x7e2fb55bd01a66661f247cefd896211ebb3f37e4d370c6a6e13bd69d50df0271
 commit_hash_2  | \x848ace6db2b077d30173290a8f77e52ddc64647140769e4b655ed822cb5b8919
 commit_hash_2  | \xaf6db0b28a5bc49044f07344b7e1a4d7e2200da4c9d0a32fdf40031664ebcf19
 commit_hash_2  | \xbd11e15f1ee3d1e40ba40c24827f35dae1eb1d0afbe0d5e6e0c12b655347c373
 commit_hash_2  | \xdcb1bf7539fc08e843c804b23d1b87c2067bbe3b53ad6e27090c846a0bf49404
 commit_hash_2  | \xe255322230c6eefec92998f14b4d6c763ed2bd3cd5b9419a470c219caf032a0d
 commit_hash_2  | \xe3aa90582cfb2bcad26408755cb7c42f23848d645b2de85ce755dc403b706486
 commit_hash_3  | \xdc5d101757964c02b98600e45b382080b68bf50d6b37260d7d30e8ef6e83a41b
 commit_hash_4  | \xbb0584b29144900d6f9b4f39c51118646ccd78f8dbdd90f18e575836c576961b
 commit_hash_5  | \x526ee630e6e925425f7701be448ee417aa5404b48748e2b5802cf0db7170c250
 commit_hash_6  | \x609306d46103e4ca7b440e1f1aa26c433f6e708eed36e35cda9b78c169fbd2ee
 commit_hash_7  | \x9138b030b2898344ce5c99e8b3ca146d8211c652faa8919f6a4ceed09257745b
 commit_hash_8  | \x486634e902db06ad0914044921a11ee6e344a710d56459a8c53471b905b9de6d
 commit_hash_9  | \x0545069d1461597c1f23a94c5eb8151393fca93cc06e6b36ed972a46fec6b05b
 commit_hash_10 | \xea6480057d6bbf6ccf7b9a1095f734ad614f51d701c0cf2deca82a9e2f0a6105
 commit_hash_11 | \x3b2709ee35eb98d281aea56a3a6be43855a8636503e6cebc27223bcdeea8ffa7
 commit_hash_12 | \xbac76aa0f86d404d6002a69811955a2dc0adc18d664b2df6027031d821289d90
 commit_hash_13 | \x6f8ebf27990b7140e605f1ca4ccad242dc726b4ad577b25e83bfe6693ac07a6d
 commit_hash_14 | \x2d99d9aa1285e0617043878787d2d4b68de525d46045a4acb754b93e61519cd4
 commit_hash_15 | \x2c3c20fda9a0a53348c47bd116beaba47e23c0b643ecea4047947a980dcb81e1
 commit_hash_16 | \xde7199a7bc496e013b75b2fd1075b41c670fa7606da53017c81dd15879ce3c4a
 commit_hash_17 | \x08b0e0398b1f0276e703c0a3b15e6641cd5ff761c2f443810af30a2adf1c7e9f
 commit_hash_18 | \x603db8ab9e7a3c5cab2d342ede4a406cb99e68ae1d8ba3c6b609d9a357221880
 commit_hash_19 | \x3934a6a47bf74ee54ecd61c4f9f9c7a2a2f161688aed589065937fde9da8ff46
 commit_hash_20 | \xc6b7ad97900459270ae0138479a9db705cc8ee1150741c2aa1c42b49f3aac4b8
 commit_hash_21 | \x66170986cab6c6da24e0b866a23fe0a8876550dc2f7bc373665c5edf164a1349
 commit_hash_22 | \x86794c06fd0fffbeb056b438614a024316364eaf7fa198036e79e6d513364a1b
 commit_hash_23 | \x08c17a5acf6855e4ab97ae622cd4d7630a0a3a38504c3ea92503b1c921e4e97e
 commit_hash_24 | \x8a943603261f59918be19eb6bd91f817d8c34b616e6df469dde75773f8fd3bdb
 commit_hash_25 | \x5c6c69d49e349f2e13505b5dd54bdff48a9e66e26d70cef6ee56dd51fede4862
 commit_hash_26 | \x532972adae34a08ca473688f1e5d331d454562a3494d37b9d2623bcb2e0065ad
 commit_hash_27 | \x4fa0e71952c73c281a20b49bab8ed0903e65fad8752f5602736b2bddb81805a9
 commit_hash_28 | \xbe04b3c75c2467735daf299360c7b070a290085a3530ab027e1c795909daf744
 commit_hash_29 | \xab7cfa921cb28d3a3be794b6cd0d705408a7dca11f62f7d9c84fa55637b67c3b
 commit_hash_30 | \xb315768c4b7c12f7c3ea0b1d1cce9facf1c90d439262486ea9f022b36821ab25
 commit_hash_31 | \x0058eab7e5a99e6dea35bc1956bef7224fd3d758e7836480e31b5ff935bbfa01
 commit_hash_32 | \x2bb61df243a23262e9b29f8a2f731d75c06318b57a609326f36d828e8ddea23a
 commit_hash_33 | \x69484c311ee576433565cece9519da7d5815f53beca6352a0129e9b2a22bd4bf
 commit_hash_33 | \xb4dbc5604f92fb1005bb1899ead18a50de103ccb81099155f59bbe49b22e3145
 commit_hash_34 | \x532e8a2547a1cd3bac7331df001708a5c11a021bc5576e69d547e198cb9e6350
 commit_hash_34 | \xe1992e24f22689213af56c9eaee8887b4016e8db82620c22de8219e73935fa85
 commit_hash_35 | \xbd10ae7ae7fefbfe16de6404d503b40a1304b00177503b05d718fdae7db4e2f4
 commit_hash_35 | \xc9cb68550b130dc6cf636454ba8350f25f77a1b3d582f4b2431c09b2c5c78cbd
 commit_hash_36 | \x06aa2c64d65525146c2ab81a27054891d36f59c62c359bbe400140dde92cd168
 commit_hash_36 | \x5bdc41d5936fc098a80a6acc6ec78b9e2eaf69d9c15ca61da03a06fb2354162a
 commit_hash_37 | \x7fff527192b6c08fdeaa4171b36f9f5e41bfad294c466700a301f7579f882874
 commit_hash_37 | \xa19cd5a4c6e53702a6ce602385dd8d079bc8cc26bda978fcbcb21926f861332e
 commit_hash_38 | \x5c2009f7957dd1196521ad0b6d33c221b4cad705da132a86c830a3c9a7fc8167
 commit_hash_38 | \xcf87c9f4096112ad0309aedc85a6b0f2055e662d16784fed4d15cfbec836ba87
 commit_hash_39 | \xd7c914d8d631f4a01df6d1a382a4a63e8302dfb9674f63e4ab609ce8b6bdcbcd
 commit_hash_39 | \xf9eefcb91d998dd470c8403e4dc84c0d5a3339ee8b00175b10b6fa1c401ad579
 commit_hash_40 | \x3860cf70d4063aeb4d430306fc4ed85fb1ea9975c9ad45877c1ab202aa4cbafa
 commit_hash_41 | \x86eb00c386eb695390784a662b733a9a60206ec37efb7e50347470cb354faadd
 commit_hash_42 | \x2b991386e994dbb0f50de9a98cce4ab40a5f9553e9de245595e64a00391b3f5f
 commit_hash_43 | \x036655e28b7cb82c43869b129c0f2a81f81488e954a7edb488190f459f50cc78
 commit_hash_44 | \x33bc640e0ae1f45a2d59b863035de39357a15b4310dbf84a44688d2356e94737
 commit_hash_45 | \xc3e53bdc83ea6d87ff2bf51228559a2ecb718ffcca680706a605e6c0ee8eb715
 commit_hash_46 | \x3881cf485e546b193b837dcb4fec482ddc2020de60f054e23ee4f735a5ad1e2d
 commit_hash_47 | \xe70487d2bb96d8fdbaf4d207f590400b925c7a2c57dfe02894251b30ceb54495
 commit_hash_48 | \x0194237841182aba38647f4637a64ff1921697af259b0de325c1a91781a53345
 commit_hash_48 | \x32d68d73e9421bee3b4b7e7a8f9192e8d7ccb05e5939d1e03d80d3e83f39f8a2
 commit_hash_48 | \xd1f9b1912f7b4251c10bab8b8cff2007a5e987be9f609a26dd75877c350702ac
 commit_hash_49 | \x6543e9f8fc48f36149bc9ed4a7df33bf8c058bbeb1ea19238deccb1c4829f14d
 commit_hash_50 | \xc8ce60d6647b75f65bcadbc336c60c15069e60df744bc5e4f833b6a9caa40748
 commit_hash_51 | \x212ce5c6daedf23850860db330fa2b8c72d8210847260f0b6a34c90fa85d5469
 commit_hash_52 | \x071b22905d51f866483f9099ca5b311c34347596f8cfec7f99f91d475c783b80
 commit_hash_53 | \xcb98461fbb76683d0fbfeb4e5dfbd4c7c55c6316b0f67ec05862670da14816d0
 commit_hash_54 | \x4e09cecd622c2d980d89e472703fb1f3a3e73f6338c2cc380daae0c3278c5645
 commit_hash_55 | \x4cf7c1da6100936169ca9eff370ec48b112fd86339aec7991feaa375672595b7
 commit_hash_56 | \x2983e7335f93d81d6e75f5d63b381ea0472d3f78a31ac948183cfad95a15ca5d
 commit_hash_57 | \xa5c3dc689a148ad79729daccff77e8ac8e798df66f2bdb3161c8c6637a55ae5e
 commit_hash_58 | \x39d608b9a7b5f885f023ebac08b8d8f5dba378247752efc9d792a6e996b8320f
 commit_hash_59 | \x229fa4268520de42611230caf50a16883ab547b8925798afbf78153c5046d113
 commit_hash_60 | \x0a617f8a1e9e5dcc6faa0c87e1304cff5c6d58ccbb128e6e271e94cd0772e25e
 commit_hash_60 | \x9d5c09fb765587e63cb76262dffe120fab142c3cea0bee1b48d965108dc3731c
 commit_hash_61 | \x729ba8e92a36bd21c89eb0fd7d57eab7090a564b4c2f334e67ddc7a046c6032c
 commit_hash_62 | \x2727e951b91f4495148b3688e644cb6dffc76a650a335205a3a902eb8edb54e1
 commit_hash_63 | \xe545fddb79566baed2bcb81f14268777ea884944c45bf39432407b6be61eb6d9
 commit_hash_64 | \xf0378e10dd29eac669d390de0e78d91d5e8b8f6401542be9ccaf9a0c606d12b9
 commit_hash_65 | \xbbb6c194f839d14b469c2a9bb6ed964117b0d04c0062785f81c45e7edefef17c
 commit_hash_66 | \x64638faceea103cec8fb6d9a762610ffe44e7a4cb42a09f797e0d6c8ffecf195
 commit_hash_67 | \x438c2c7130f4f20abe91cf99c977a184b7f8e9e8ea5336f69681978f9d0922fc
 commit_hash_68 | \x1f2efc0e19b400b916e75330e51a3c2447472728734c3f966e75e74e0b2767db
 commit_hash_69 | \x6ab5ce1a2e1f9af9e1b2df9b41940454a6933339ec87f3b798e0a3292617861a
(93 rows)

